{
  "last_updated": "2026-02-07T16:14:44.178332Z",
  "total_videos": 1565,
  "videos": [
    {
      "id": "mdtRdzj-ybs",
      "title": "Lezione del 05/02/2026",
      "published_at": "2026-02-05T08:48:38Z",
      "year": 2026,
      "month": 2,
      "duration_seconds": 0,
      "duration_formatted": "0s",
      "thumbnail_url": "https://i9.ytimg.com/vi/mdtRdzj-ybs/mqdefault_live.jpg?sqp=CNjHncwG&rs=AOn4CLBSahDO2fax2DB1mIBG2-lxh_GwnA",
      "watch_url": "https://www.youtube.com/watch?v=mdtRdzj-ybs"
    },
    {
      "id": "nmNGju0HQkM",
      "title": "Lezione del 04/02/2026",
      "published_at": "2026-02-04T16:08:17Z",
      "year": 2026,
      "month": 2,
      "duration_seconds": 2695,
      "duration_formatted": "44m",
      "thumbnail_url": "https://i9.ytimg.com/vi/nmNGju0HQkM/mqdefault.jpg?sqp=CNjHncwG&rs=AOn4CLCJU0z2Y8QjgBy4PaaPrg5HJo5tGQ",
      "watch_url": "https://www.youtube.com/watch?v=nmNGju0HQkM"
    },
    {
      "id": "rPiWySWQgyQ",
      "title": "Lezione del 03/02/2026 Pomeriggio",
      "published_at": "2026-02-03T16:09:27Z",
      "year": 2026,
      "month": 2,
      "duration_seconds": 2317,
      "duration_formatted": "38m",
      "thumbnail_url": "https://i9.ytimg.com/vi/rPiWySWQgyQ/mqdefault.jpg?sqp=CNjHncwG&rs=AOn4CLDqlAZe8WHBJM7BXv6aMZlJGWUXmw",
      "watch_url": "https://www.youtube.com/watch?v=rPiWySWQgyQ"
    },
    {
      "id": "H793yBRlLEc",
      "title": "Lezione del 02/02/2026",
      "published_at": "2026-02-02T19:36:57Z",
      "year": 2026,
      "month": 2,
      "duration_seconds": 3721,
      "duration_formatted": "1h 2m",
      "thumbnail_url": "https://i9.ytimg.com/vi/H793yBRlLEc/mqdefault.jpg?sqp=CNjHncwG&rs=AOn4CLB50ZmvmjMAQKSXxX6EZ0-GNRr4RA",
      "watch_url": "https://www.youtube.com/watch?v=H793yBRlLEc"
    },
    {
      "id": "YM54cxlqFYA",
      "title": "Lezione del 30/01/2026",
      "published_at": "2026-01-30T19:29:36Z",
      "year": 2026,
      "month": 1,
      "duration_seconds": 3511,
      "duration_formatted": "58m",
      "thumbnail_url": "https://i9.ytimg.com/vi/YM54cxlqFYA/mqdefault.jpg?sqp=CNjHncwG&rs=AOn4CLAa1W6gj3jIgvpiWNegbqIa-uOWuQ",
      "watch_url": "https://www.youtube.com/watch?v=YM54cxlqFYA"
    },
    {
      "id": "4Dbz5aHvG_8",
      "title": "Lezione del 29/01/2026",
      "published_at": "2026-01-29T19:34:24Z",
      "year": 2026,
      "month": 1,
      "duration_seconds": 3452,
      "duration_formatted": "57m",
      "thumbnail_url": "https://i9.ytimg.com/vi/4Dbz5aHvG_8/mqdefault.jpg?sqp=CNjHncwG&rs=AOn4CLCBI9K54vRYzsypisY891ovCV30eQ",
      "watch_url": "https://www.youtube.com/watch?v=4Dbz5aHvG_8"
    },
    {
      "id": "jJ0E_dKB1sE",
      "title": "Lezione del 27/01/2026 Pomeriggio",
      "published_at": "2026-01-27T16:05:27Z",
      "year": 2026,
      "month": 1,
      "duration_seconds": 1919,
      "duration_formatted": "31m",
      "thumbnail_url": "https://i9.ytimg.com/vi/jJ0E_dKB1sE/mqdefault.jpg?sqp=CNjHncwG&rs=AOn4CLAeLyMxiNFGDmvqPCnu2txz50ZAFA",
      "watch_url": "https://www.youtube.com/watch?v=jJ0E_dKB1sE"
    },
    {
      "id": "QFt6S-aV3Bc",
      "title": "Lezione del 26/01/2026",
      "published_at": "2026-01-26T19:32:52Z",
      "year": 2026,
      "month": 1,
      "duration_seconds": 3345,
      "duration_formatted": "55m",
      "thumbnail_url": "https://i9.ytimg.com/vi/QFt6S-aV3Bc/mqdefault.jpg?sqp=CNjHncwG&rs=AOn4CLBi5uMBR381A33lAiqPNM5R_SkKWg",
      "watch_url": "https://www.youtube.com/watch?v=QFt6S-aV3Bc"
    },
    {
      "id": "xl5uN6G4XpM",
      "title": "Lezione del 23/01/2026",
      "published_at": "2026-01-23T19:24:40Z",
      "year": 2026,
      "month": 1,
      "duration_seconds": 2964,
      "duration_formatted": "49m",
      "thumbnail_url": "https://i9.ytimg.com/vi/xl5uN6G4XpM/mqdefault.jpg?sqp=CNjHncwG&rs=AOn4CLCi7Mj9TnDn9ILSAH9y4JIQHyiTKg",
      "watch_url": "https://www.youtube.com/watch?v=xl5uN6G4XpM"
    },
    {
      "id": "okni9pLkMZA",
      "title": "Lezione del 22/01/2026 (SOLO AUDIO)",
      "published_at": "2026-01-22T19:36:06Z",
      "year": 2026,
      "month": 1,
      "duration_seconds": 3579,
      "duration_formatted": "59m",
      "thumbnail_url": "https://i9.ytimg.com/vi/okni9pLkMZA/mqdefault.jpg?sqp=CNjHncwG&rs=AOn4CLCM8f-4WLH0HpOV46eRba4J5PZU_Q",
      "watch_url": "https://www.youtube.com/watch?v=okni9pLkMZA"
    },
    {
      "id": "Rt4j7D8BCyI",
      "title": "Lezione del 21/01/2026",
      "published_at": "2026-01-21T16:07:49Z",
      "year": 2026,
      "month": 1,
      "duration_seconds": 2351,
      "duration_formatted": "39m",
      "thumbnail_url": "https://i9.ytimg.com/vi/Rt4j7D8BCyI/mqdefault.jpg?sqp=CNjHncwG&rs=AOn4CLAfXQFA8I3UI4m8dAx4pngrh8cAEA",
      "watch_url": "https://www.youtube.com/watch?v=Rt4j7D8BCyI"
    },
    {
      "id": "1Vvs28DQNj4",
      "title": "Lezione del 20/01/2026 Sera",
      "published_at": "2026-01-20T19:33:58Z",
      "year": 2026,
      "month": 1,
      "duration_seconds": 3341,
      "duration_formatted": "55m",
      "thumbnail_url": "https://i9.ytimg.com/vi/1Vvs28DQNj4/mqdefault.jpg?sqp=CNjHncwG&rs=AOn4CLCshf3460T7nLswX8t_whU15_RRmA",
      "watch_url": "https://www.youtube.com/watch?v=1Vvs28DQNj4"
    },
    {
      "id": "pSthx-2zl1A",
      "title": "Lezione del 20/01/2026 Pomeriggio",
      "published_at": "2026-01-20T16:09:40Z",
      "year": 2026,
      "month": 1,
      "duration_seconds": 2083,
      "duration_formatted": "34m",
      "thumbnail_url": "https://i9.ytimg.com/vi/pSthx-2zl1A/mqdefault.jpg?sqp=CNjHncwG&rs=AOn4CLCPLsy3MgDD2mcts24I5RN4Zo533w",
      "watch_url": "https://www.youtube.com/watch?v=pSthx-2zl1A"
    },
    {
      "id": "pBQQxNll6Fs",
      "title": "Lezione del 19/01/2026",
      "published_at": "2026-01-19T19:14:11Z",
      "year": 2026,
      "month": 1,
      "duration_seconds": 2585,
      "duration_formatted": "43m",
      "thumbnail_url": "https://i9.ytimg.com/vi/pBQQxNll6Fs/mqdefault.jpg?sqp=CNjHncwG&rs=AOn4CLC3bdjbS3nA_bSpYPOf3G1deL-9pQ",
      "watch_url": "https://www.youtube.com/watch?v=pBQQxNll6Fs"
    },
    {
      "id": "s6vUYWnJSpo",
      "title": "Lezione del 16/01/2026",
      "published_at": "2026-01-16T19:21:43Z",
      "year": 2026,
      "month": 1,
      "duration_seconds": 2794,
      "duration_formatted": "46m",
      "thumbnail_url": "https://i9.ytimg.com/vi/s6vUYWnJSpo/mqdefault.jpg?sqp=CNjHncwG&rs=AOn4CLB9OxwRVZVaPRru5h7l1sg2rZFJoA",
      "watch_url": "https://www.youtube.com/watch?v=s6vUYWnJSpo"
    },
    {
      "id": "Z8SrlC2igd4",
      "title": "Lezione del 15/01/2026",
      "published_at": "2026-01-15T19:34:54Z",
      "year": 2026,
      "month": 1,
      "duration_seconds": 3154,
      "duration_formatted": "52m",
      "thumbnail_url": "https://i9.ytimg.com/vi/Z8SrlC2igd4/mqdefault.jpg?sqp=CNjHncwG&rs=AOn4CLAyc-6KlgdpjMbbqb948cwAyNgajQ",
      "watch_url": "https://www.youtube.com/watch?v=Z8SrlC2igd4"
    },
    {
      "id": "D2vLeOlSuCQ",
      "title": "Lezione del 14/01/2026",
      "published_at": "2026-01-14T16:05:47Z",
      "year": 2026,
      "month": 1,
      "duration_seconds": 2509,
      "duration_formatted": "41m",
      "thumbnail_url": "https://i9.ytimg.com/vi/D2vLeOlSuCQ/mqdefault.jpg?sqp=CNjHncwG&rs=AOn4CLAkgevjykn_fBzsVbakOFRy2vwWJg",
      "watch_url": "https://www.youtube.com/watch?v=D2vLeOlSuCQ"
    },
    {
      "id": "mixnX8ynYzc",
      "title": "Lezione del 13/01/2026 Pomeriggio",
      "published_at": "2026-01-13T16:06:50Z",
      "year": 2026,
      "month": 1,
      "duration_seconds": 2004,
      "duration_formatted": "33m",
      "thumbnail_url": "https://i9.ytimg.com/vi/mixnX8ynYzc/mqdefault.jpg?sqp=CNjHncwG&rs=AOn4CLDu57-mhazzlMcnFScdWFcm5SvHJw",
      "watch_url": "https://www.youtube.com/watch?v=mixnX8ynYzc"
    },
    {
      "id": "zbW7DuzdwYw",
      "title": "Lezione del 12/01/2026",
      "published_at": "2026-01-12T19:34:28Z",
      "year": 2026,
      "month": 1,
      "duration_seconds": 3319,
      "duration_formatted": "55m",
      "thumbnail_url": "https://i9.ytimg.com/vi/zbW7DuzdwYw/mqdefault.jpg?sqp=CNjHncwG&rs=AOn4CLAum9DdqeJ9DPJjklsLRUCNlkynjA",
      "watch_url": "https://www.youtube.com/watch?v=zbW7DuzdwYw"
    },
    {
      "id": "k5wOHmzHgOY",
      "title": "Lezione del 09/01/2026",
      "published_at": "2026-01-09T19:34:40Z",
      "year": 2026,
      "month": 1,
      "duration_seconds": 3070,
      "duration_formatted": "51m",
      "thumbnail_url": "https://i9.ytimg.com/vi/k5wOHmzHgOY/mqdefault.jpg?sqp=CNjHncwG&rs=AOn4CLDZe6-3j18qUoeW0hIYVD1VsfJTZA",
      "watch_url": "https://www.youtube.com/watch?v=k5wOHmzHgOY"
    },
    {
      "id": "o4L-7b4hOyc",
      "title": "Lezione del 08/01/2026",
      "published_at": "2026-01-08T19:36:06Z",
      "year": 2026,
      "month": 1,
      "duration_seconds": 2365,
      "duration_formatted": "39m",
      "thumbnail_url": "https://i9.ytimg.com/vi/o4L-7b4hOyc/mqdefault.jpg?sqp=CNjHncwG&rs=AOn4CLDW4mfTgZ64vXUJ6ZSIhT2W3K7PZA",
      "watch_url": "https://www.youtube.com/watch?v=o4L-7b4hOyc"
    },
    {
      "id": "-0iuiRRgP7Y",
      "title": "Lezione del 07/01/2026",
      "published_at": "2026-01-07T16:08:58Z",
      "year": 2026,
      "month": 1,
      "duration_seconds": 2282,
      "duration_formatted": "38m",
      "thumbnail_url": "https://i9.ytimg.com/vi/-0iuiRRgP7Y/mqdefault.jpg?sqp=CNjHncwG&rs=AOn4CLAv9xCg5qnJH9SZPIf7iyxbpO4tZw",
      "watch_url": "https://www.youtube.com/watch?v=-0iuiRRgP7Y"
    },
    {
      "id": "dLaO5i6bjTg",
      "title": "🎄🎄 Lezione del 19/12/2025 🎄🎄🎄",
      "published_at": "2025-12-19T19:33:43Z",
      "year": 2025,
      "month": 12,
      "duration_seconds": 3323,
      "duration_formatted": "55m",
      "thumbnail_url": "https://i9.ytimg.com/vi/dLaO5i6bjTg/mqdefault.jpg?sqp=CNjHncwG&rs=AOn4CLAt9sb9L9NInKzq3zKA_ByDem0p1Q",
      "watch_url": "https://www.youtube.com/watch?v=dLaO5i6bjTg"
    },
    {
      "id": "FKGk20fqO5U",
      "title": "Lezione del 18/12/2025",
      "published_at": "2025-12-18T19:36:37Z",
      "year": 2025,
      "month": 12,
      "duration_seconds": 3167,
      "duration_formatted": "52m",
      "thumbnail_url": "https://i9.ytimg.com/vi/FKGk20fqO5U/mqdefault.jpg?sqp=CNjHncwG&rs=AOn4CLAN9RMEEihCUT3MmsVMJWOVIBITSw",
      "watch_url": "https://www.youtube.com/watch?v=FKGk20fqO5U"
    },
    {
      "id": "Oz8Sljg8Zpk",
      "title": "Lezione del 17/12/2025",
      "published_at": "2025-12-17T16:10:00Z",
      "year": 2025,
      "month": 12,
      "duration_seconds": 2623,
      "duration_formatted": "43m",
      "thumbnail_url": "https://i9.ytimg.com/vi/Oz8Sljg8Zpk/mqdefault.jpg?sqp=CNjHncwG&rs=AOn4CLCUigihU3_YJGKy_qpakBAN3xu-Gw",
      "watch_url": "https://www.youtube.com/watch?v=Oz8Sljg8Zpk"
    },
    {
      "id": "hnpYXodhu0U",
      "title": "Lezione del 16/12/2025 Sera",
      "published_at": "2025-12-16T19:24:39Z",
      "year": 2025,
      "month": 12,
      "duration_seconds": 2916,
      "duration_formatted": "48m",
      "thumbnail_url": "https://i9.ytimg.com/vi/hnpYXodhu0U/mqdefault.jpg?sqp=CNjHncwG&rs=AOn4CLDp-wrkqwKfLoztM7fjtk9-VXsZ_Q",
      "watch_url": "https://www.youtube.com/watch?v=hnpYXodhu0U"
    },
    {
      "id": "XI1vPVry9iI",
      "title": "Lezione del 16/12/2025 Pomeriggio",
      "published_at": "2025-12-16T16:06:34Z",
      "year": 2025,
      "month": 12,
      "duration_seconds": 2031,
      "duration_formatted": "33m",
      "thumbnail_url": "https://i9.ytimg.com/vi/XI1vPVry9iI/mqdefault.jpg?sqp=CNjHncwG&rs=AOn4CLA_eyLdFxzWgnWL-BWwOFVFMufeWA",
      "watch_url": "https://www.youtube.com/watch?v=XI1vPVry9iI"
    },
    {
      "id": "FhPtV2qiuV8",
      "title": "Lezione del 15/12/2025",
      "published_at": "2025-12-15T19:19:31Z",
      "year": 2025,
      "month": 12,
      "duration_seconds": 2912,
      "duration_formatted": "48m",
      "thumbnail_url": "https://i9.ytimg.com/vi/FhPtV2qiuV8/mqdefault.jpg?sqp=CNjHncwG&rs=AOn4CLA4T3Kc8ttSaUb4zsFqXws2sSAeGQ",
      "watch_url": "https://www.youtube.com/watch?v=FhPtV2qiuV8"
    },
    {
      "id": "G5QBrsU8mF0",
      "title": "Lezione del 12/12/2025",
      "published_at": "2025-12-12T19:31:59Z",
      "year": 2025,
      "month": 12,
      "duration_seconds": 3656,
      "duration_formatted": "1h 0m",
      "thumbnail_url": "https://i9.ytimg.com/vi/G5QBrsU8mF0/mqdefault.jpg?sqp=CNjHncwG&rs=AOn4CLDP1W-x9zPp5KVR8gOUMuWx9PoDCQ",
      "watch_url": "https://www.youtube.com/watch?v=G5QBrsU8mF0"
    },
    {
      "id": "tpGfSOCxbUw",
      "title": "Lezione del 10/12/2025",
      "published_at": "2025-12-10T16:08:35Z",
      "year": 2025,
      "month": 12,
      "duration_seconds": 2587,
      "duration_formatted": "43m",
      "thumbnail_url": "https://i9.ytimg.com/vi/tpGfSOCxbUw/mqdefault.jpg?sqp=CNjHncwG&rs=AOn4CLAFxG8fRFKv_dJvzO20QRyxUvhc_A",
      "watch_url": "https://www.youtube.com/watch?v=tpGfSOCxbUw"
    },
    {
      "id": "f9Cfedbq31I",
      "title": "Lezione del 09/12/2025",
      "published_at": "2025-12-09T19:22:51Z",
      "year": 2025,
      "month": 12,
      "duration_seconds": 2767,
      "duration_formatted": "46m",
      "thumbnail_url": "https://i9.ytimg.com/vi/f9Cfedbq31I/mqdefault.jpg?sqp=CNjHncwG&rs=AOn4CLDuKrYjM-YKx3RuF674KACY0k19OQ",
      "watch_url": "https://www.youtube.com/watch?v=f9Cfedbq31I"
    },
    {
      "id": "gxIjepJ18Ps",
      "title": "Lezione del 04/12/2025",
      "published_at": "2025-12-05T19:20:25Z",
      "year": 2025,
      "month": 12,
      "duration_seconds": 2835,
      "duration_formatted": "47m",
      "thumbnail_url": "https://i9.ytimg.com/vi/gxIjepJ18Ps/mqdefault.jpg?sqp=CNjHncwG&rs=AOn4CLDLle9MseLdbZd9VFr6E_mq-cjtzA",
      "watch_url": "https://www.youtube.com/watch?v=gxIjepJ18Ps"
    },
    {
      "id": "S2QHpa3o0VM",
      "title": "Lezione del 04/12/2025",
      "published_at": "2025-12-04T19:35:51Z",
      "year": 2025,
      "month": 12,
      "duration_seconds": 3041,
      "duration_formatted": "50m",
      "thumbnail_url": "https://i9.ytimg.com/vi/S2QHpa3o0VM/mqdefault.jpg?sqp=CNjHncwG&rs=AOn4CLDqsQeP0pq7YCeYI0PrG5kck3Tawg",
      "watch_url": "https://www.youtube.com/watch?v=S2QHpa3o0VM"
    },
    {
      "id": "ZAQOZneainQ",
      "title": "Lezione del 03/12/2025",
      "published_at": "2025-12-03T16:06:52Z",
      "year": 2025,
      "month": 12,
      "duration_seconds": 1809,
      "duration_formatted": "30m",
      "thumbnail_url": "https://i9.ytimg.com/vi/ZAQOZneainQ/mqdefault.jpg?sqp=CNjHncwG&rs=AOn4CLDhQqDRAZGBkBUDzBVyzZ8lcK5psQ",
      "watch_url": "https://www.youtube.com/watch?v=ZAQOZneainQ"
    },
    {
      "id": "cVHYy02i7Fg",
      "title": "Lezione del 02/12/2025 Sera",
      "published_at": "2025-12-02T19:31:11Z",
      "year": 2025,
      "month": 12,
      "duration_seconds": 3248,
      "duration_formatted": "54m",
      "thumbnail_url": "https://i9.ytimg.com/vi/cVHYy02i7Fg/mqdefault.jpg?sqp=CNjHncwG&rs=AOn4CLB13iyQIOC0lWVpVEbqz1i7UDbiPw",
      "watch_url": "https://www.youtube.com/watch?v=cVHYy02i7Fg"
    },
    {
      "id": "JTcNK9vhcWI",
      "title": "Lezione del 02/12/2025 Pomeriggio",
      "published_at": "2025-12-02T16:08:50Z",
      "year": 2025,
      "month": 12,
      "duration_seconds": 2161,
      "duration_formatted": "36m",
      "thumbnail_url": "https://i9.ytimg.com/vi/JTcNK9vhcWI/mqdefault.jpg?sqp=CNjHncwG&rs=AOn4CLBUZvLRl9d0VqF3kikl46al8B6L8g",
      "watch_url": "https://www.youtube.com/watch?v=JTcNK9vhcWI"
    },
    {
      "id": "hMTjBv9ZV_w",
      "title": "Lezione del 01/12/2025 (SOLO AUDIO)",
      "published_at": "2025-12-01T19:33:53Z",
      "year": 2025,
      "month": 12,
      "duration_seconds": 3901,
      "duration_formatted": "1h 5m",
      "thumbnail_url": "https://i9.ytimg.com/vi/hMTjBv9ZV_w/mqdefault.jpg?sqp=CNjHncwG&rs=AOn4CLDuob95ngKgx56kuK0gblud_bQing",
      "watch_url": "https://www.youtube.com/watch?v=hMTjBv9ZV_w"
    },
    {
      "id": "9DJ0uIfxKKo",
      "title": "Lezione del 28/11/2025",
      "published_at": "2025-11-28T19:34:30Z",
      "year": 2025,
      "month": 11,
      "duration_seconds": 3317,
      "duration_formatted": "55m",
      "thumbnail_url": "https://i9.ytimg.com/vi/9DJ0uIfxKKo/mqdefault.jpg?sqp=CNjHncwG&rs=AOn4CLC3K4iphBR1PBCIakC4KG2H8KS8Cg",
      "watch_url": "https://www.youtube.com/watch?v=9DJ0uIfxKKo"
    },
    {
      "id": "rtvX-0AbeBU",
      "title": "Lezione del 27/11/2025",
      "published_at": "2025-11-27T19:34:11Z",
      "year": 2025,
      "month": 11,
      "duration_seconds": 2830,
      "duration_formatted": "47m",
      "thumbnail_url": "https://i9.ytimg.com/vi/rtvX-0AbeBU/mqdefault.jpg?sqp=CNjHncwG&rs=AOn4CLAr1XrkDBkOv0oSS0MQgix2wpGZsQ",
      "watch_url": "https://www.youtube.com/watch?v=rtvX-0AbeBU"
    },
    {
      "id": "rHnF79DtSXk",
      "title": "Lezione del 25/11/2025 Sera",
      "published_at": "2025-11-25T19:25:28Z",
      "year": 2025,
      "month": 11,
      "duration_seconds": 2925,
      "duration_formatted": "48m",
      "thumbnail_url": "https://i9.ytimg.com/vi/rHnF79DtSXk/mqdefault.jpg?sqp=CNjHncwG&rs=AOn4CLD-Vwx0CitG_7PSXWln5dtH99IJfA",
      "watch_url": "https://www.youtube.com/watch?v=rHnF79DtSXk"
    },
    {
      "id": "23DQ3SFG83g",
      "title": "Lezione del 25/11/2025 Pomeriggio",
      "published_at": "2025-11-25T16:06:35Z",
      "year": 2025,
      "month": 11,
      "duration_seconds": 2308,
      "duration_formatted": "38m",
      "thumbnail_url": "https://i9.ytimg.com/vi/23DQ3SFG83g/mqdefault.jpg?sqp=CNjHncwG&rs=AOn4CLCkCXHIQZiZyyiXQ-O0cVEYeBWVZQ",
      "watch_url": "https://www.youtube.com/watch?v=23DQ3SFG83g"
    },
    {
      "id": "v0mQKRdnErQ",
      "title": "Lezione del 24/11/2025",
      "published_at": "2025-11-24T19:20:45Z",
      "year": 2025,
      "month": 11,
      "duration_seconds": 2388,
      "duration_formatted": "39m",
      "thumbnail_url": "https://i9.ytimg.com/vi/v0mQKRdnErQ/mqdefault.jpg?sqp=CNjHncwG&rs=AOn4CLDlwGDWL2lOEXX58w9viAU168Ctzg",
      "watch_url": "https://www.youtube.com/watch?v=v0mQKRdnErQ"
    },
    {
      "id": "pe1vfUQcLiM",
      "title": "Lezione del 21/11/2025",
      "published_at": "2025-11-21T19:35:14Z",
      "year": 2025,
      "month": 11,
      "duration_seconds": 3579,
      "duration_formatted": "59m",
      "thumbnail_url": "https://i9.ytimg.com/vi/pe1vfUQcLiM/mqdefault.jpg?sqp=CNjHncwG&rs=AOn4CLCnhoqQyr64NoW04fJS2e4Bhgw9bw",
      "watch_url": "https://www.youtube.com/watch?v=pe1vfUQcLiM"
    },
    {
      "id": "qarIwCNkkK4",
      "title": "Lezione del 20/11/2025",
      "published_at": "2025-11-20T19:33:58Z",
      "year": 2025,
      "month": 11,
      "duration_seconds": 2922,
      "duration_formatted": "48m",
      "thumbnail_url": "https://i9.ytimg.com/vi/qarIwCNkkK4/mqdefault.jpg?sqp=CNjHncwG&rs=AOn4CLCtB2e7ml_SShXZoqCE49eUq-RddQ",
      "watch_url": "https://www.youtube.com/watch?v=qarIwCNkkK4"
    },
    {
      "id": "y23FeuB3sb8",
      "title": "Lezione del 19/11/2025",
      "published_at": "2025-11-19T16:08:36Z",
      "year": 2025,
      "month": 11,
      "duration_seconds": 1939,
      "duration_formatted": "32m",
      "thumbnail_url": "https://i9.ytimg.com/vi/y23FeuB3sb8/mqdefault.jpg?sqp=CNjHncwG&rs=AOn4CLD273DTceLoMnKgxfRFDlDsgBGMXg",
      "watch_url": "https://www.youtube.com/watch?v=y23FeuB3sb8"
    },
    {
      "id": "J1VCTs2oYME",
      "title": "Lezione del 18/11/2025 Sera",
      "published_at": "2025-11-18T19:34:08Z",
      "year": 2025,
      "month": 11,
      "duration_seconds": 3205,
      "duration_formatted": "53m",
      "thumbnail_url": "https://i9.ytimg.com/vi/J1VCTs2oYME/mqdefault.jpg?sqp=CNjHncwG&rs=AOn4CLAi3AdXtLvjzjbNdFBlM4EMagkWHw",
      "watch_url": "https://www.youtube.com/watch?v=J1VCTs2oYME"
    },
    {
      "id": "Bgpar6IgRPQ",
      "title": "Lezione del 18/11/2025 Pomeriggio",
      "published_at": "2025-11-18T16:11:07Z",
      "year": 2025,
      "month": 11,
      "duration_seconds": 2232,
      "duration_formatted": "37m",
      "thumbnail_url": "https://i9.ytimg.com/vi/Bgpar6IgRPQ/mqdefault.jpg?sqp=CNjHncwG&rs=AOn4CLCno8_kGjej5hQrWPwqNNGFt0IMdA",
      "watch_url": "https://www.youtube.com/watch?v=Bgpar6IgRPQ"
    },
    {
      "id": "stWStJxJ-5A",
      "title": "Lezione del 17/11/2025",
      "published_at": "2025-11-17T19:33:40Z",
      "year": 2025,
      "month": 11,
      "duration_seconds": 3097,
      "duration_formatted": "51m",
      "thumbnail_url": "https://i9.ytimg.com/vi/stWStJxJ-5A/mqdefault.jpg?sqp=CNjHncwG&rs=AOn4CLACHZaq2jZNlv2IwqU9quyHEiUy6w",
      "watch_url": "https://www.youtube.com/watch?v=stWStJxJ-5A"
    },
    {
      "id": "aiv0jMSCsA0",
      "title": "Lezione del 14/11/2025",
      "published_at": "2025-11-14T19:34:43Z",
      "year": 2025,
      "month": 11,
      "duration_seconds": 3214,
      "duration_formatted": "53m",
      "thumbnail_url": "https://i9.ytimg.com/vi/aiv0jMSCsA0/mqdefault.jpg?sqp=CNjHncwG&rs=AOn4CLC30UJNhATuF3ZkZbP_TUfCLPfG9Q",
      "watch_url": "https://www.youtube.com/watch?v=aiv0jMSCsA0"
    },
    {
      "id": "yCnzriccKjg",
      "title": "Lezione del 13/11/2025",
      "published_at": "2025-11-13T19:33:09Z",
      "year": 2025,
      "month": 11,
      "duration_seconds": 3244,
      "duration_formatted": "54m",
      "thumbnail_url": "https://i9.ytimg.com/vi/yCnzriccKjg/mqdefault.jpg?sqp=CNjHncwG&rs=AOn4CLAqy7N2zo9pbfbGCD6PfzPIgLevzQ",
      "watch_url": "https://www.youtube.com/watch?v=yCnzriccKjg"
    },
    {
      "id": "mHlqXcATq4g",
      "title": "Lezione del 12/11/2025",
      "published_at": "2025-11-12T16:05:49Z",
      "year": 2025,
      "month": 11,
      "duration_seconds": 2086,
      "duration_formatted": "34m",
      "thumbnail_url": "https://i9.ytimg.com/vi/mHlqXcATq4g/mqdefault.jpg?sqp=CNjHncwG&rs=AOn4CLCAttoAA8Pz_MRhGPkOC22WErYMNA",
      "watch_url": "https://www.youtube.com/watch?v=mHlqXcATq4g"
    },
    {
      "id": "cM82ShhxLCo",
      "title": "Lezione del 11/11/2025 Sera",
      "published_at": "2025-11-11T19:32:39Z",
      "year": 2025,
      "month": 11,
      "duration_seconds": 3494,
      "duration_formatted": "58m",
      "thumbnail_url": "https://i9.ytimg.com/vi/cM82ShhxLCo/mqdefault.jpg?sqp=CNjHncwG&rs=AOn4CLDyKNIEmnGarxpdZm9H9FhubW9w-g",
      "watch_url": "https://www.youtube.com/watch?v=cM82ShhxLCo"
    },
    {
      "id": "gQ0DqrjF6co",
      "title": "Lezione del 11/11/2025 Pomeriggio",
      "published_at": "2025-11-11T16:05:55Z",
      "year": 2025,
      "month": 11,
      "duration_seconds": 2118,
      "duration_formatted": "35m",
      "thumbnail_url": "https://i9.ytimg.com/vi/gQ0DqrjF6co/mqdefault.jpg?sqp=CNjHncwG&rs=AOn4CLDBYX3IeMjwsOATFq0AfAcy1GsGAA",
      "watch_url": "https://www.youtube.com/watch?v=gQ0DqrjF6co"
    },
    {
      "id": "wpxy-yq5m8Y",
      "title": "Lezione del 10/11/2025",
      "published_at": "2025-11-10T19:33:57Z",
      "year": 2025,
      "month": 11,
      "duration_seconds": 3149,
      "duration_formatted": "52m",
      "thumbnail_url": "https://i9.ytimg.com/vi/wpxy-yq5m8Y/mqdefault.jpg?sqp=CNjHncwG&rs=AOn4CLDKu-gUyDnF2vzOg5a2OxUCNPHKpQ",
      "watch_url": "https://www.youtube.com/watch?v=wpxy-yq5m8Y"
    },
    {
      "id": "gwOHWPAjmKM",
      "title": "Lezione del 07/11/2025",
      "published_at": "2025-11-07T19:34:22Z",
      "year": 2025,
      "month": 11,
      "duration_seconds": 2910,
      "duration_formatted": "48m",
      "thumbnail_url": "https://i9.ytimg.com/vi/gwOHWPAjmKM/mqdefault.jpg?sqp=CNjHncwG&rs=AOn4CLC-YlgmrxG9o5PKiO7QJy3EugI-BA",
      "watch_url": "https://www.youtube.com/watch?v=gwOHWPAjmKM"
    },
    {
      "id": "3cpTQ0sPba0",
      "title": "Lezione del 06/11/2025",
      "published_at": "2025-11-06T19:34:27Z",
      "year": 2025,
      "month": 11,
      "duration_seconds": 3077,
      "duration_formatted": "51m",
      "thumbnail_url": "https://i9.ytimg.com/vi/3cpTQ0sPba0/mqdefault.jpg?sqp=CNjHncwG&rs=AOn4CLC6FOO8RXQSSaSnzlN3gbPbMp8fmg",
      "watch_url": "https://www.youtube.com/watch?v=3cpTQ0sPba0"
    },
    {
      "id": "mmdrGcj0AJM",
      "title": "Lezione del 05/11/2025",
      "published_at": "2025-11-05T16:06:04Z",
      "year": 2025,
      "month": 11,
      "duration_seconds": 2266,
      "duration_formatted": "37m",
      "thumbnail_url": "https://i9.ytimg.com/vi/mmdrGcj0AJM/mqdefault.jpg?sqp=CNjHncwG&rs=AOn4CLByPnNLSHU0tg6Z-eH2Jvghy8z6EA",
      "watch_url": "https://www.youtube.com/watch?v=mmdrGcj0AJM"
    },
    {
      "id": "rNXgvHpQtMo",
      "title": "Lezione del 03/11/2025",
      "published_at": "2025-11-03T19:33:57Z",
      "year": 2025,
      "month": 11,
      "duration_seconds": 3222,
      "duration_formatted": "53m",
      "thumbnail_url": "https://i9.ytimg.com/vi/rNXgvHpQtMo/mqdefault.jpg?sqp=CNjHncwG&rs=AOn4CLDpaU6aRbDXjI0vF0UaFjegYVrVoQ",
      "watch_url": "https://www.youtube.com/watch?v=rNXgvHpQtMo"
    },
    {
      "id": "teuky1a9BOo",
      "title": "Lezione del 31/10/2025",
      "published_at": "2025-10-31T19:11:56Z",
      "year": 2025,
      "month": 10,
      "duration_seconds": 2120,
      "duration_formatted": "35m",
      "thumbnail_url": "https://i9.ytimg.com/vi/teuky1a9BOo/mqdefault.jpg?sqp=CNjHncwG&rs=AOn4CLCHp_3GIVzp2s9zrMD1GfDexhTJQQ",
      "watch_url": "https://www.youtube.com/watch?v=teuky1a9BOo"
    },
    {
      "id": "k1gxwhwEdpA",
      "title": "Lezione del 30/10/2025",
      "published_at": "2025-10-30T19:34:34Z",
      "year": 2025,
      "month": 10,
      "duration_seconds": 2837,
      "duration_formatted": "47m",
      "thumbnail_url": "https://i9.ytimg.com/vi/k1gxwhwEdpA/mqdefault.jpg?sqp=CNjHncwG&rs=AOn4CLA8mAbLylI_NlUfH9D4XAJLS0Wx7Q",
      "watch_url": "https://www.youtube.com/watch?v=k1gxwhwEdpA"
    },
    {
      "id": "ztZEZlDXbGQ",
      "title": "Lezione del 29/10/2025",
      "published_at": "2025-10-29T16:11:21Z",
      "year": 2025,
      "month": 10,
      "duration_seconds": 2351,
      "duration_formatted": "39m",
      "thumbnail_url": "https://i9.ytimg.com/vi/ztZEZlDXbGQ/mqdefault.jpg?sqp=CNjHncwG&rs=AOn4CLCaMtvgDqYaUH8lRX6QlyxtmuWQ1A",
      "watch_url": "https://www.youtube.com/watch?v=ztZEZlDXbGQ"
    },
    {
      "id": "wxDcPskexSE",
      "title": "Lezione del 28/10/2025 Sera",
      "published_at": "2025-10-28T19:33:12Z",
      "year": 2025,
      "month": 10,
      "duration_seconds": 3166,
      "duration_formatted": "52m",
      "thumbnail_url": "https://i9.ytimg.com/vi/wxDcPskexSE/mqdefault.jpg?sqp=CNjHncwG&rs=AOn4CLDpfXnnDAfHGoA_xKSAQOXoEkuTDQ",
      "watch_url": "https://www.youtube.com/watch?v=wxDcPskexSE"
    },
    {
      "id": "7e2R0zB0dbQ",
      "title": "Lezione del 28/10/2025 Pomeriggio",
      "published_at": "2025-10-28T16:09:29Z",
      "year": 2025,
      "month": 10,
      "duration_seconds": 2049,
      "duration_formatted": "34m",
      "thumbnail_url": "https://i9.ytimg.com/vi/7e2R0zB0dbQ/mqdefault.jpg?sqp=CNjHncwG&rs=AOn4CLAqBqsHdloBndkCpW6nMrCh4gyu0A",
      "watch_url": "https://www.youtube.com/watch?v=7e2R0zB0dbQ"
    },
    {
      "id": "ok7cGedtiDs",
      "title": "Lezione del 27/10/2025",
      "published_at": "2025-10-27T19:32:31Z",
      "year": 2025,
      "month": 10,
      "duration_seconds": 3010,
      "duration_formatted": "50m",
      "thumbnail_url": "https://i9.ytimg.com/vi/ok7cGedtiDs/mqdefault.jpg?sqp=CNjHncwG&rs=AOn4CLBe-_1t-jaHVDDeWv4ibluqjJTJhA",
      "watch_url": "https://www.youtube.com/watch?v=ok7cGedtiDs"
    },
    {
      "id": "TI5njb1jSxA",
      "title": "Lezione del 24/10/2025",
      "published_at": "2025-10-24T18:33:06Z",
      "year": 2025,
      "month": 10,
      "duration_seconds": 3254,
      "duration_formatted": "54m",
      "thumbnail_url": "https://i9.ytimg.com/vi/TI5njb1jSxA/mqdefault.jpg?sqp=CNjHncwG&rs=AOn4CLAfwJ_ye2gw6QhFX-ws2E7z6Ww5xg",
      "watch_url": "https://www.youtube.com/watch?v=TI5njb1jSxA"
    },
    {
      "id": "rWvD_wMLy3o",
      "title": "Lezione del 23/10/2025",
      "published_at": "2025-10-23T18:35:50Z",
      "year": 2025,
      "month": 10,
      "duration_seconds": 2987,
      "duration_formatted": "49m",
      "thumbnail_url": "https://i9.ytimg.com/vi/rWvD_wMLy3o/mqdefault.jpg?sqp=CNjHncwG&rs=AOn4CLCjnHfG-lqBuCP4nB8eDXQquosGbQ",
      "watch_url": "https://www.youtube.com/watch?v=rWvD_wMLy3o"
    },
    {
      "id": "lK9qWQLOk3o",
      "title": "Lezione del 22/10/2025",
      "published_at": "2025-10-22T15:06:14Z",
      "year": 2025,
      "month": 10,
      "duration_seconds": 2363,
      "duration_formatted": "39m",
      "thumbnail_url": "https://i9.ytimg.com/vi/lK9qWQLOk3o/mqdefault.jpg?sqp=CNjHncwG&rs=AOn4CLBg_LYIC7oPxkDsTSSrB07r6QUFvQ",
      "watch_url": "https://www.youtube.com/watch?v=lK9qWQLOk3o"
    },
    {
      "id": "owi7KaN7D78",
      "title": "Lezione del 21/10/2025",
      "published_at": "2025-10-21T18:33:49Z",
      "year": 2025,
      "month": 10,
      "duration_seconds": 3510,
      "duration_formatted": "58m",
      "thumbnail_url": "https://i9.ytimg.com/vi/owi7KaN7D78/mqdefault.jpg?sqp=CNjHncwG&rs=AOn4CLB7vTOFLPqBTS5ibdVWyLb7V3kmCw",
      "watch_url": "https://www.youtube.com/watch?v=owi7KaN7D78"
    },
    {
      "id": "-A7wLp7N650",
      "title": "Lezione del 20/10/2025",
      "published_at": "2025-10-20T18:33:34Z",
      "year": 2025,
      "month": 10,
      "duration_seconds": 3192,
      "duration_formatted": "53m",
      "thumbnail_url": "https://i9.ytimg.com/vi/-A7wLp7N650/mqdefault.jpg?sqp=CNjHncwG&rs=AOn4CLA0ruWQOXysRbjl6PNWY99wR4BnSA",
      "watch_url": "https://www.youtube.com/watch?v=-A7wLp7N650"
    },
    {
      "id": "jUUwV4d0aK4",
      "title": "Lezione del 17/10/2025",
      "published_at": "2025-10-17T18:34:11Z",
      "year": 2025,
      "month": 10,
      "duration_seconds": 2900,
      "duration_formatted": "48m",
      "thumbnail_url": "https://i9.ytimg.com/vi/jUUwV4d0aK4/mqdefault.jpg?sqp=CNjHncwG&rs=AOn4CLDhMRUw_WBvgfaxe96-3IuPKRcd7g",
      "watch_url": "https://www.youtube.com/watch?v=jUUwV4d0aK4"
    },
    {
      "id": "PYPJzlY-IF8",
      "title": "Lezione del 16/10/2025",
      "published_at": "2025-10-16T18:35:36Z",
      "year": 2025,
      "month": 10,
      "duration_seconds": 3132,
      "duration_formatted": "52m",
      "thumbnail_url": "https://i9.ytimg.com/vi/PYPJzlY-IF8/mqdefault.jpg?sqp=CNjHncwG&rs=AOn4CLCCcsn2NlF4oje74t-YS6iy8YtzwQ",
      "watch_url": "https://www.youtube.com/watch?v=PYPJzlY-IF8"
    },
    {
      "id": "FOCSb_Je9DU",
      "title": "Lezione del 15/10/2025",
      "published_at": "2025-10-15T15:43:10Z",
      "year": 2025,
      "month": 10,
      "duration_seconds": 2192,
      "duration_formatted": "36m",
      "thumbnail_url": "https://i9.ytimg.com/vi/FOCSb_Je9DU/mqdefault.jpg?sqp=CNjHncwG&rs=AOn4CLC0bUO-t7KWHvYIFgVMp2HwTDEO1Q",
      "watch_url": "https://www.youtube.com/watch?v=FOCSb_Je9DU"
    },
    {
      "id": "Ka2XBXwAyxg",
      "title": "Lezione del 14/10/2025",
      "published_at": "2025-10-14T18:33:07Z",
      "year": 2025,
      "month": 10,
      "duration_seconds": 3140,
      "duration_formatted": "52m",
      "thumbnail_url": "https://i9.ytimg.com/vi/Ka2XBXwAyxg/mqdefault.jpg?sqp=CNjHncwG&rs=AOn4CLDI8uazs7ZuKNF9tfihHH0sLj3lHA",
      "watch_url": "https://www.youtube.com/watch?v=Ka2XBXwAyxg"
    },
    {
      "id": "aOWmtkXsCI4",
      "title": "Lezione del 13/10/2025",
      "published_at": "2025-10-13T18:35:04Z",
      "year": 2025,
      "month": 10,
      "duration_seconds": 3406,
      "duration_formatted": "56m",
      "thumbnail_url": "https://i9.ytimg.com/vi/aOWmtkXsCI4/mqdefault.jpg?sqp=CNjHncwG&rs=AOn4CLB8KD2izENjpTq3dxrfbq-6NdOzgA",
      "watch_url": "https://www.youtube.com/watch?v=aOWmtkXsCI4"
    },
    {
      "id": "AGHwUIyJSuU",
      "title": "Lezione del 10/10/2025",
      "published_at": "2025-10-10T18:34:44Z",
      "year": 2025,
      "month": 10,
      "duration_seconds": 3405,
      "duration_formatted": "56m",
      "thumbnail_url": "https://i9.ytimg.com/vi/AGHwUIyJSuU/mqdefault.jpg?sqp=CNjHncwG&rs=AOn4CLByXOz8mxts2lb3TEFRspsRIxzn-w",
      "watch_url": "https://www.youtube.com/watch?v=AGHwUIyJSuU"
    },
    {
      "id": "gFgHdqzZu4g",
      "title": "Lezione del 09/10/2025",
      "published_at": "2025-10-09T18:35:05Z",
      "year": 2025,
      "month": 10,
      "duration_seconds": 3072,
      "duration_formatted": "51m",
      "thumbnail_url": "https://i9.ytimg.com/vi/gFgHdqzZu4g/mqdefault.jpg?sqp=CNjHncwG&rs=AOn4CLAGhWiHl-2bVMBJO51DitKT895O-g",
      "watch_url": "https://www.youtube.com/watch?v=gFgHdqzZu4g"
    },
    {
      "id": "MBy5E2pJHok",
      "title": "Lezione del 08/10/2025",
      "published_at": "2025-10-08T15:08:53Z",
      "year": 2025,
      "month": 10,
      "duration_seconds": 2091,
      "duration_formatted": "34m",
      "thumbnail_url": "https://i9.ytimg.com/vi/MBy5E2pJHok/mqdefault.jpg?sqp=CNjHncwG&rs=AOn4CLDMt5dbvOo5W5g413Lk4Jno4UO4sQ",
      "watch_url": "https://www.youtube.com/watch?v=MBy5E2pJHok"
    },
    {
      "id": "7yMb_k6cCHQ",
      "title": "Lezione del 07/10/2025 Sera",
      "published_at": "2025-10-07T18:36:42Z",
      "year": 2025,
      "month": 10,
      "duration_seconds": 3637,
      "duration_formatted": "1h 0m",
      "thumbnail_url": "https://i9.ytimg.com/vi/7yMb_k6cCHQ/mqdefault.jpg?sqp=CNjHncwG&rs=AOn4CLAISo3Uc26MgbiaFmftRMZn6HCXbA",
      "watch_url": "https://www.youtube.com/watch?v=7yMb_k6cCHQ"
    },
    {
      "id": "7dMOG-qSLEw",
      "title": "Lezione del 07/10/2025 Pomeriggio",
      "published_at": "2025-10-07T15:09:14Z",
      "year": 2025,
      "month": 10,
      "duration_seconds": 2648,
      "duration_formatted": "44m",
      "thumbnail_url": "https://i9.ytimg.com/vi/7dMOG-qSLEw/mqdefault.jpg?sqp=CNjHncwG&rs=AOn4CLAyVX5t-61fKLDA-tmLo20P5lAt8g",
      "watch_url": "https://www.youtube.com/watch?v=7dMOG-qSLEw"
    },
    {
      "id": "H_1TxpYpBSw",
      "title": "Lezione del 06/10/2025",
      "published_at": "2025-10-06T18:33:42Z",
      "year": 2025,
      "month": 10,
      "duration_seconds": 3136,
      "duration_formatted": "52m",
      "thumbnail_url": "https://i9.ytimg.com/vi/H_1TxpYpBSw/mqdefault.jpg?sqp=CNjHncwG&rs=AOn4CLC1LHrRc5YjDbGvVNJOVmseLcHieA",
      "watch_url": "https://www.youtube.com/watch?v=H_1TxpYpBSw"
    },
    {
      "id": "0AzeD9kJY1o",
      "title": "Lezione del 03/10/2025",
      "published_at": "2025-10-03T18:33:26Z",
      "year": 2025,
      "month": 10,
      "duration_seconds": 3097,
      "duration_formatted": "51m",
      "thumbnail_url": "https://i9.ytimg.com/vi/0AzeD9kJY1o/mqdefault.jpg?sqp=CNjHncwG&rs=AOn4CLBmfPQ0VRY1qlTr7cXejrR0cEI0lg",
      "watch_url": "https://www.youtube.com/watch?v=0AzeD9kJY1o"
    },
    {
      "id": "SWV_vp2h8_Q",
      "title": "Lezione del 02/10/2025",
      "published_at": "2025-10-02T18:36:38Z",
      "year": 2025,
      "month": 10,
      "duration_seconds": 3164,
      "duration_formatted": "52m",
      "thumbnail_url": "https://i9.ytimg.com/vi/SWV_vp2h8_Q/mqdefault.jpg?sqp=CNjHncwG&rs=AOn4CLCr2zz1B3huz8a25wyvnul7S7MAhg",
      "watch_url": "https://www.youtube.com/watch?v=SWV_vp2h8_Q"
    },
    {
      "id": "Y-xJbuVpe8Q",
      "title": "Lezione del 01/10/2025",
      "published_at": "2025-10-01T15:11:41Z",
      "year": 2025,
      "month": 10,
      "duration_seconds": 2407,
      "duration_formatted": "40m",
      "thumbnail_url": "https://i9.ytimg.com/vi/Y-xJbuVpe8Q/mqdefault.jpg?sqp=CNjHncwG&rs=AOn4CLBmKKb01tDFgw1GAm8-GTgJo72duw",
      "watch_url": "https://www.youtube.com/watch?v=Y-xJbuVpe8Q"
    },
    {
      "id": "mFMtLSdZI9I",
      "title": "Lezione del 30/09/2025 Sera",
      "published_at": "2025-09-30T18:34:10Z",
      "year": 2025,
      "month": 9,
      "duration_seconds": 3359,
      "duration_formatted": "55m",
      "thumbnail_url": "https://i9.ytimg.com/vi/mFMtLSdZI9I/mqdefault.jpg?sqp=CNjHncwG&rs=AOn4CLBOecBtVVm4hH6FeWOWqk3KVEhM5g",
      "watch_url": "https://www.youtube.com/watch?v=mFMtLSdZI9I"
    },
    {
      "id": "H58cx2FjVwA",
      "title": "Lezione del 30/09/2025 Pomeriggio",
      "published_at": "2025-09-30T15:08:21Z",
      "year": 2025,
      "month": 9,
      "duration_seconds": 2063,
      "duration_formatted": "34m",
      "thumbnail_url": "https://i9.ytimg.com/vi/H58cx2FjVwA/mqdefault.jpg?sqp=CNjHncwG&rs=AOn4CLBLseV8MhKVESkozrxLzYezYl1otQ",
      "watch_url": "https://www.youtube.com/watch?v=H58cx2FjVwA"
    },
    {
      "id": "c2iwAjTqOQo",
      "title": "Lezione del 29/09/2025",
      "published_at": "2025-09-29T18:33:29Z",
      "year": 2025,
      "month": 9,
      "duration_seconds": 3316,
      "duration_formatted": "55m",
      "thumbnail_url": "https://i9.ytimg.com/vi/c2iwAjTqOQo/mqdefault.jpg?sqp=CNjHncwG&rs=AOn4CLBuly5kuR-gM7XVDAwV2NqY8IRDuw",
      "watch_url": "https://www.youtube.com/watch?v=c2iwAjTqOQo"
    },
    {
      "id": "-41QbBCuSU4",
      "title": "Lezione del 26/09/2025",
      "published_at": "2025-09-26T18:32:41Z",
      "year": 2025,
      "month": 9,
      "duration_seconds": 3231,
      "duration_formatted": "53m",
      "thumbnail_url": "https://i9.ytimg.com/vi/-41QbBCuSU4/mqdefault.jpg?sqp=CNjHncwG&rs=AOn4CLDNOeTuUeccX8zlvWMBrIuP90WcCQ",
      "watch_url": "https://www.youtube.com/watch?v=-41QbBCuSU4"
    },
    {
      "id": "UuwpuHrZ2JI",
      "title": "Lezione del 25/09/2025",
      "published_at": "2025-09-25T18:36:44Z",
      "year": 2025,
      "month": 9,
      "duration_seconds": 3236,
      "duration_formatted": "53m",
      "thumbnail_url": "https://i9.ytimg.com/vi/UuwpuHrZ2JI/mqdefault.jpg?sqp=CNjHncwG&rs=AOn4CLDl6Jd3BnhkBR51WqAErek6HCDpWg",
      "watch_url": "https://www.youtube.com/watch?v=UuwpuHrZ2JI"
    },
    {
      "id": "K7M6H2X7ABk",
      "title": "Lezione del 24/09/2025",
      "published_at": "2025-09-24T15:10:32Z",
      "year": 2025,
      "month": 9,
      "duration_seconds": 2395,
      "duration_formatted": "39m",
      "thumbnail_url": "https://i9.ytimg.com/vi/K7M6H2X7ABk/mqdefault.jpg?sqp=CNjHncwG&rs=AOn4CLAunkZuMweiHpz2VIqMOQGWYEiYgw",
      "watch_url": "https://www.youtube.com/watch?v=K7M6H2X7ABk"
    },
    {
      "id": "ntrgHGffhwA",
      "title": "Lezione del 23/09/2025",
      "published_at": "2025-09-23T18:34:37Z",
      "year": 2025,
      "month": 9,
      "duration_seconds": 3479,
      "duration_formatted": "57m",
      "thumbnail_url": "https://i9.ytimg.com/vi/ntrgHGffhwA/mqdefault.jpg?sqp=CNjHncwG&rs=AOn4CLBM4Wc-_kDG3P5_Fwa5l395-vfq8A",
      "watch_url": "https://www.youtube.com/watch?v=ntrgHGffhwA"
    },
    {
      "id": "_omOGcnxZAM",
      "title": "Lezione del 22/09/2025",
      "published_at": "2025-09-22T18:36:23Z",
      "year": 2025,
      "month": 9,
      "duration_seconds": 3020,
      "duration_formatted": "50m",
      "thumbnail_url": "https://i9.ytimg.com/vi/_omOGcnxZAM/mqdefault.jpg?sqp=CNjHncwG&rs=AOn4CLBvYB_kipPKKhGpx4bk5S36gyHzGA",
      "watch_url": "https://www.youtube.com/watch?v=_omOGcnxZAM"
    },
    {
      "id": "qtnMti_9KU4",
      "title": "Lezione del 18/09/2025",
      "published_at": "2025-09-19T18:33:35Z",
      "year": 2025,
      "month": 9,
      "duration_seconds": 3071,
      "duration_formatted": "51m",
      "thumbnail_url": "https://i9.ytimg.com/vi/qtnMti_9KU4/mqdefault.jpg?sqp=CNjHncwG&rs=AOn4CLB4ATJnzSLt8LlWa5-eVuKumCQBmA",
      "watch_url": "https://www.youtube.com/watch?v=qtnMti_9KU4"
    },
    {
      "id": "Sm37LpYTEFA",
      "title": "Lezione del 18/09/2025",
      "published_at": "2025-09-18T18:34:40Z",
      "year": 2025,
      "month": 9,
      "duration_seconds": 3182,
      "duration_formatted": "53m",
      "thumbnail_url": "https://i9.ytimg.com/vi/Sm37LpYTEFA/mqdefault.jpg?sqp=CNjHncwG&rs=AOn4CLBmU9iVi7OCch_WhI7mh96ojPaJbw",
      "watch_url": "https://www.youtube.com/watch?v=Sm37LpYTEFA"
    },
    {
      "id": "F88DTJYu2wA",
      "title": "Lezione del 17/09/2025",
      "published_at": "2025-09-17T15:11:57Z",
      "year": 2025,
      "month": 9,
      "duration_seconds": 2684,
      "duration_formatted": "44m",
      "thumbnail_url": "https://i9.ytimg.com/vi/F88DTJYu2wA/mqdefault.jpg?sqp=CNjHncwG&rs=AOn4CLDGXpqa3qOyylBPdpxpYLoXDNFQfQ",
      "watch_url": "https://www.youtube.com/watch?v=F88DTJYu2wA"
    },
    {
      "id": "SO1ptOJROxY",
      "title": "Lezione del 16/09/2025 Sera",
      "published_at": "2025-09-16T18:34:25Z",
      "year": 2025,
      "month": 9,
      "duration_seconds": 3177,
      "duration_formatted": "52m",
      "thumbnail_url": "https://i9.ytimg.com/vi/SO1ptOJROxY/mqdefault.jpg?sqp=CNjHncwG&rs=AOn4CLC0HTeJDebfrWeHRRSOW3I4QS_AwQ",
      "watch_url": "https://www.youtube.com/watch?v=SO1ptOJROxY"
    },
    {
      "id": "EkpPP03mJJM",
      "title": "Lezione del 16/09/2025 Pomeriggio",
      "published_at": "2025-09-16T15:04:59Z",
      "year": 2025,
      "month": 9,
      "duration_seconds": 2333,
      "duration_formatted": "38m",
      "thumbnail_url": "https://i9.ytimg.com/vi/EkpPP03mJJM/mqdefault.jpg?sqp=CNjHncwG&rs=AOn4CLC52JBZz0t5h50LePph7QjTiSyUKg",
      "watch_url": "https://www.youtube.com/watch?v=EkpPP03mJJM"
    },
    {
      "id": "8JFlyR1GIMo",
      "title": "Lezione del 15/09/2025",
      "published_at": "2025-09-15T18:33:54Z",
      "year": 2025,
      "month": 9,
      "duration_seconds": 3359,
      "duration_formatted": "55m",
      "thumbnail_url": "https://i9.ytimg.com/vi/8JFlyR1GIMo/mqdefault.jpg?sqp=CNjHncwG&rs=AOn4CLDCn5C-XeCrj7dBCuJpBLmRBeJ-Jw",
      "watch_url": "https://www.youtube.com/watch?v=8JFlyR1GIMo"
    },
    {
      "id": "GBrAnlZj7g0",
      "title": "Lezione del 12/09/2025",
      "published_at": "2025-09-12T18:33:18Z",
      "year": 2025,
      "month": 9,
      "duration_seconds": 3392,
      "duration_formatted": "56m",
      "thumbnail_url": "https://i9.ytimg.com/vi/GBrAnlZj7g0/mqdefault.jpg?sqp=CNjHncwG&rs=AOn4CLBGNMRx4DJxWif8COOfcYHWs4-wqQ",
      "watch_url": "https://www.youtube.com/watch?v=GBrAnlZj7g0"
    },
    {
      "id": "NXe2mcwsp1k",
      "title": "Lezione del 11/09/2025",
      "published_at": "2025-09-11T18:35:07Z",
      "year": 2025,
      "month": 9,
      "duration_seconds": 3005,
      "duration_formatted": "50m",
      "thumbnail_url": "https://i9.ytimg.com/vi/NXe2mcwsp1k/mqdefault.jpg?sqp=CNjHncwG&rs=AOn4CLDOZkxxcWvEF2OzVnj-mmQasJzDKA",
      "watch_url": "https://www.youtube.com/watch?v=NXe2mcwsp1k"
    },
    {
      "id": "a0MPGnn1sSs",
      "title": "Lezione del 09/09/2025",
      "published_at": "2025-09-09T18:33:16Z",
      "year": 2025,
      "month": 9,
      "duration_seconds": 3174,
      "duration_formatted": "52m",
      "thumbnail_url": "https://i9.ytimg.com/vi/a0MPGnn1sSs/mqdefault.jpg?sqp=CNjHncwG&rs=AOn4CLC-RJr4J9B3Om79rzv0ovPD9pxzsg",
      "watch_url": "https://www.youtube.com/watch?v=a0MPGnn1sSs"
    },
    {
      "id": "eNne2Z-RFCM",
      "title": "Lezione del 08/09/2025",
      "published_at": "2025-09-08T18:34:54Z",
      "year": 2025,
      "month": 9,
      "duration_seconds": 3592,
      "duration_formatted": "59m",
      "thumbnail_url": "https://i9.ytimg.com/vi/eNne2Z-RFCM/mqdefault.jpg?sqp=CNjHncwG&rs=AOn4CLCtlKBC7xcV1NDgep6yXUN9y8u1Vw",
      "watch_url": "https://www.youtube.com/watch?v=eNne2Z-RFCM"
    },
    {
      "id": "6CSL2AG6_GE",
      "title": "Lezione del 04/09/2025",
      "published_at": "2025-09-04T18:35:30Z",
      "year": 2025,
      "month": 9,
      "duration_seconds": 3111,
      "duration_formatted": "51m",
      "thumbnail_url": "https://i9.ytimg.com/vi/6CSL2AG6_GE/mqdefault.jpg?sqp=CNjHncwG&rs=AOn4CLBQkMrvtS32r4KEfRq_q2AGTpqVjQ",
      "watch_url": "https://www.youtube.com/watch?v=6CSL2AG6_GE"
    },
    {
      "id": "HV9OXj7VQkw",
      "title": "Lezione del 02/09/2025 Sera",
      "published_at": "2025-09-02T18:33:44Z",
      "year": 2025,
      "month": 9,
      "duration_seconds": 3287,
      "duration_formatted": "54m",
      "thumbnail_url": "https://i9.ytimg.com/vi/HV9OXj7VQkw/mqdefault.jpg?sqp=CNjHncwG&rs=AOn4CLBFxeregFGqaWtDQV9YjMTZUZW4cQ",
      "watch_url": "https://www.youtube.com/watch?v=HV9OXj7VQkw"
    },
    {
      "id": "9D8mlNqYI-M",
      "title": "Lezione del 02/09/2025 Pomeriggio",
      "published_at": "2025-09-02T15:14:11Z",
      "year": 2025,
      "month": 9,
      "duration_seconds": 2397,
      "duration_formatted": "39m",
      "thumbnail_url": "https://i9.ytimg.com/vi/9D8mlNqYI-M/mqdefault.jpg?sqp=CNjHncwG&rs=AOn4CLAGZPgiPA-UPjulkzIZUfZG_dPm6w",
      "watch_url": "https://www.youtube.com/watch?v=9D8mlNqYI-M"
    },
    {
      "id": "og9ngIp7zPw",
      "title": "Lezione del 01/09/2025",
      "published_at": "2025-09-01T18:34:27Z",
      "year": 2025,
      "month": 9,
      "duration_seconds": 3173,
      "duration_formatted": "52m",
      "thumbnail_url": "https://i9.ytimg.com/vi/og9ngIp7zPw/mqdefault.jpg?sqp=CNjHncwG&rs=AOn4CLDove321onVzuGxRBchsL_AlZvHUw",
      "watch_url": "https://www.youtube.com/watch?v=og9ngIp7zPw"
    },
    {
      "id": "GqJ-0dd87os",
      "title": "Pillole di Guida - Il Servosterzo",
      "published_at": "2025-08-31T16:00:06Z",
      "year": 2025,
      "month": 8,
      "duration_seconds": 625,
      "duration_formatted": "10m",
      "thumbnail_url": "https://i.ytimg.com/vi/GqJ-0dd87os/mqdefault.jpg",
      "watch_url": "https://www.youtube.com/watch?v=GqJ-0dd87os"
    },
    {
      "id": "RIs21JjsoH8",
      "title": "Lezione del 29/08/2025",
      "published_at": "2025-08-29T18:28:12Z",
      "year": 2025,
      "month": 8,
      "duration_seconds": 3073,
      "duration_formatted": "51m",
      "thumbnail_url": "https://i9.ytimg.com/vi/RIs21JjsoH8/mqdefault.jpg?sqp=CNjHncwG&rs=AOn4CLBLoX-EQOB26JnTbJOCkmPl5QEqxg",
      "watch_url": "https://www.youtube.com/watch?v=RIs21JjsoH8"
    },
    {
      "id": "y4GkQdVxafw",
      "title": "Lezione del 28/08/2025",
      "published_at": "2025-08-28T18:36:42Z",
      "year": 2025,
      "month": 8,
      "duration_seconds": 2744,
      "duration_formatted": "45m",
      "thumbnail_url": "https://i9.ytimg.com/vi/y4GkQdVxafw/mqdefault.jpg?sqp=CNjHncwG&rs=AOn4CLDztXzVD7HyVvHJFzUrVelu7JBC0A",
      "watch_url": "https://www.youtube.com/watch?v=y4GkQdVxafw"
    },
    {
      "id": "yYjpCc-IGFY",
      "title": "L' Avvocato Risponde - Premio e Massimale",
      "published_at": "2025-08-27T16:00:06Z",
      "year": 2025,
      "month": 8,
      "duration_seconds": 831,
      "duration_formatted": "13m",
      "thumbnail_url": "https://i.ytimg.com/vi/yYjpCc-IGFY/mqdefault.jpg",
      "watch_url": "https://www.youtube.com/watch?v=yYjpCc-IGFY"
    },
    {
      "id": "9TKIWEcf7cI",
      "title": "Lezione del 27/08/2025",
      "published_at": "2025-08-27T15:09:24Z",
      "year": 2025,
      "month": 8,
      "duration_seconds": 2317,
      "duration_formatted": "38m",
      "thumbnail_url": "https://i9.ytimg.com/vi/9TKIWEcf7cI/mqdefault.jpg?sqp=CNjHncwG&rs=AOn4CLBn_p_H8C61MVwRoIwKDPE9qmdP1A",
      "watch_url": "https://www.youtube.com/watch?v=9TKIWEcf7cI"
    },
    {
      "id": "6A6PGOJHxcw",
      "title": "Lezione del 26/08/2025 Pomeriggio",
      "published_at": "2025-08-26T15:05:24Z",
      "year": 2025,
      "month": 8,
      "duration_seconds": 2105,
      "duration_formatted": "35m",
      "thumbnail_url": "https://i9.ytimg.com/vi/6A6PGOJHxcw/mqdefault.jpg?sqp=CNjHncwG&rs=AOn4CLDr_QEnlyZhOL8Zu7mPIBGRaJ3lCg",
      "watch_url": "https://www.youtube.com/watch?v=6A6PGOJHxcw"
    },
    {
      "id": "lW1_rhzLE-c",
      "title": "Lezione del 25/08/2025",
      "published_at": "2025-08-25T18:34:30Z",
      "year": 2025,
      "month": 8,
      "duration_seconds": 3495,
      "duration_formatted": "58m",
      "thumbnail_url": "https://i9.ytimg.com/vi/lW1_rhzLE-c/mqdefault.jpg?sqp=CNjHncwG&rs=AOn4CLCBMkZpbUzHoHSONRSxEv6GPlXdfQ",
      "watch_url": "https://www.youtube.com/watch?v=lW1_rhzLE-c"
    },
    {
      "id": "aOq3DmUESY4",
      "title": "Pillole di Meccanica - Il Turbocompressore",
      "published_at": "2025-08-20T16:00:06Z",
      "year": 2025,
      "month": 8,
      "duration_seconds": 605,
      "duration_formatted": "10m",
      "thumbnail_url": "https://i.ytimg.com/vi/aOq3DmUESY4/mqdefault.jpg",
      "watch_url": "https://www.youtube.com/watch?v=aOq3DmUESY4"
    },
    {
      "id": "GOyNf_PHDhs",
      "title": "L' Ingegnere Insegna - Le Sospensioni",
      "published_at": "2025-08-15T16:00:06Z",
      "year": 2025,
      "month": 8,
      "duration_seconds": 609,
      "duration_formatted": "10m",
      "thumbnail_url": "https://i.ytimg.com/vi/GOyNf_PHDhs/mqdefault.jpg",
      "watch_url": "https://www.youtube.com/watch?v=GOyNf_PHDhs"
    },
    {
      "id": "2LppnuNUdDU",
      "title": "Pillole di Teoria - Le Luci",
      "published_at": "2025-08-10T16:00:06Z",
      "year": 2025,
      "month": 8,
      "duration_seconds": 990,
      "duration_formatted": "16m",
      "thumbnail_url": "https://i.ytimg.com/vi/2LppnuNUdDU/mqdefault.jpg",
      "watch_url": "https://www.youtube.com/watch?v=2LppnuNUdDU"
    },
    {
      "id": "HQfh_CPR9wM",
      "title": "Ci vediamo il 25 Agosto!!! 🏖️",
      "published_at": "2025-08-08T17:30:29Z",
      "year": 2025,
      "month": 8,
      "duration_seconds": 395,
      "duration_formatted": "6m",
      "thumbnail_url": "https://i9.ytimg.com/vi/HQfh_CPR9wM/mqdefault.jpg?sqp=CNjHncwG&rs=AOn4CLCCLVlqj76i87KsJ5w3iI8EdaAuqQ",
      "watch_url": "https://www.youtube.com/watch?v=HQfh_CPR9wM"
    },
    {
      "id": "pN8t3OwyOKo",
      "title": "Lezione del 07/08/2025",
      "published_at": "2025-08-07T18:34:41Z",
      "year": 2025,
      "month": 8,
      "duration_seconds": 3258,
      "duration_formatted": "54m",
      "thumbnail_url": "https://i9.ytimg.com/vi/pN8t3OwyOKo/mqdefault.jpg?sqp=CNjHncwG&rs=AOn4CLCL6fCrEoXW0fWkczzE6i6Z-tNAaQ",
      "watch_url": "https://www.youtube.com/watch?v=pN8t3OwyOKo"
    },
    {
      "id": "zUnVCe9C_dE",
      "title": "Lezione del 06/08/2025",
      "published_at": "2025-08-06T15:08:38Z",
      "year": 2025,
      "month": 8,
      "duration_seconds": 2424,
      "duration_formatted": "40m",
      "thumbnail_url": "https://i9.ytimg.com/vi/zUnVCe9C_dE/mqdefault.jpg?sqp=CNjHncwG&rs=AOn4CLCZ6EGOWdObm62PylXdsppMEmo79A",
      "watch_url": "https://www.youtube.com/watch?v=zUnVCe9C_dE"
    },
    {
      "id": "KecuvgpFNXk",
      "title": "Lezione del 05/08/2025 Sera",
      "published_at": "2025-08-05T18:34:27Z",
      "year": 2025,
      "month": 8,
      "duration_seconds": 3082,
      "duration_formatted": "51m",
      "thumbnail_url": "https://i9.ytimg.com/vi/KecuvgpFNXk/mqdefault.jpg?sqp=CNjHncwG&rs=AOn4CLB18I9EC09sOYF1XE_p3RXKdIzhqA",
      "watch_url": "https://www.youtube.com/watch?v=KecuvgpFNXk"
    },
    {
      "id": "xsbiRAZ0XNg",
      "title": "Lezione del 05/08/2025 Pomeriggio",
      "published_at": "2025-08-05T15:05:02Z",
      "year": 2025,
      "month": 8,
      "duration_seconds": 1977,
      "duration_formatted": "32m",
      "thumbnail_url": "https://i9.ytimg.com/vi/xsbiRAZ0XNg/mqdefault.jpg?sqp=CNjHncwG&rs=AOn4CLAGZaDtedWqaEIQFQ9muHCLDBZcGg",
      "watch_url": "https://www.youtube.com/watch?v=xsbiRAZ0XNg"
    },
    {
      "id": "A46jWZHRCco",
      "title": "Lezione del 04/08/2025",
      "published_at": "2025-08-04T18:35:10Z",
      "year": 2025,
      "month": 8,
      "duration_seconds": 3231,
      "duration_formatted": "53m",
      "thumbnail_url": "https://i9.ytimg.com/vi/A46jWZHRCco/mqdefault.jpg?sqp=CNjHncwG&rs=AOn4CLDGQTNOWzltgcZJ5qrIm_e6NXOKKw",
      "watch_url": "https://www.youtube.com/watch?v=A46jWZHRCco"
    },
    {
      "id": "SraadRph-AU",
      "title": "Lezione del 30/07/2025",
      "published_at": "2025-07-30T15:09:38Z",
      "year": 2025,
      "month": 7,
      "duration_seconds": 2008,
      "duration_formatted": "33m",
      "thumbnail_url": "https://i9.ytimg.com/vi/SraadRph-AU/mqdefault.jpg?sqp=CNjHncwG&rs=AOn4CLARrQBXLnXZsISOOUnDj75ITnAL8w",
      "watch_url": "https://www.youtube.com/watch?v=SraadRph-AU"
    },
    {
      "id": "PMuymQ1EeHM",
      "title": "Lezione del 29/07/2025 Sera",
      "published_at": "2025-07-29T18:32:46Z",
      "year": 2025,
      "month": 7,
      "duration_seconds": 3639,
      "duration_formatted": "1h 0m",
      "thumbnail_url": "https://i9.ytimg.com/vi/PMuymQ1EeHM/mqdefault.jpg?sqp=CNjHncwG&rs=AOn4CLClXa4LAmke4R7Of1LQ3rw3kbqGdg",
      "watch_url": "https://www.youtube.com/watch?v=PMuymQ1EeHM"
    },
    {
      "id": "fTKpxDpO4Vg",
      "title": "Lezione del 29/07/2025 Pomeriggio",
      "published_at": "2025-07-29T15:05:47Z",
      "year": 2025,
      "month": 7,
      "duration_seconds": 2203,
      "duration_formatted": "36m",
      "thumbnail_url": "https://i9.ytimg.com/vi/fTKpxDpO4Vg/mqdefault.jpg?sqp=CNjHncwG&rs=AOn4CLD-Dgox1htU1gkkbJffFB3Y05Olrg",
      "watch_url": "https://www.youtube.com/watch?v=fTKpxDpO4Vg"
    },
    {
      "id": "TxS2AY4RPok",
      "title": "Lezione del 28/07/2025",
      "published_at": "2025-07-28T18:33:52Z",
      "year": 2025,
      "month": 7,
      "duration_seconds": 3126,
      "duration_formatted": "52m",
      "thumbnail_url": "https://i9.ytimg.com/vi/TxS2AY4RPok/mqdefault.jpg?sqp=CNjHncwG&rs=AOn4CLA-R2fCUK2Qgs1Qqu187FjuV0tDYw",
      "watch_url": "https://www.youtube.com/watch?v=TxS2AY4RPok"
    },
    {
      "id": "9C4Xc2ZcD0U",
      "title": "Lezione del 25/07/2025",
      "published_at": "2025-07-25T18:35:27Z",
      "year": 2025,
      "month": 7,
      "duration_seconds": 3529,
      "duration_formatted": "58m",
      "thumbnail_url": "https://i9.ytimg.com/vi/9C4Xc2ZcD0U/mqdefault.jpg?sqp=CNjHncwG&rs=AOn4CLAxHBFPluXRcJOekWFoJ8mqdJmZ0w",
      "watch_url": "https://www.youtube.com/watch?v=9C4Xc2ZcD0U"
    },
    {
      "id": "YUyo69Q_2wE",
      "title": "Lezione del 24/07/2025",
      "published_at": "2025-07-24T18:36:11Z",
      "year": 2025,
      "month": 7,
      "duration_seconds": 3325,
      "duration_formatted": "55m",
      "thumbnail_url": "https://i9.ytimg.com/vi/YUyo69Q_2wE/mqdefault.jpg?sqp=CNjHncwG&rs=AOn4CLCIMO2UToyVDmm-XXSQb30BW5trkA",
      "watch_url": "https://www.youtube.com/watch?v=YUyo69Q_2wE"
    },
    {
      "id": "Dmn6gU3aDTU",
      "title": "Lezione del 23/07/2025",
      "published_at": "2025-07-23T15:10:19Z",
      "year": 2025,
      "month": 7,
      "duration_seconds": 2307,
      "duration_formatted": "38m",
      "thumbnail_url": "https://i9.ytimg.com/vi/Dmn6gU3aDTU/mqdefault.jpg?sqp=CNjHncwG&rs=AOn4CLC3zasI_be0-5PujO76OCc9hbCRnA",
      "watch_url": "https://www.youtube.com/watch?v=Dmn6gU3aDTU"
    },
    {
      "id": "m9INmBABjlI",
      "title": "Lezione del 22/07/2025",
      "published_at": "2025-07-22T18:35:00Z",
      "year": 2025,
      "month": 7,
      "duration_seconds": 3563,
      "duration_formatted": "59m",
      "thumbnail_url": "https://i9.ytimg.com/vi/m9INmBABjlI/mqdefault.jpg?sqp=CNjHncwG&rs=AOn4CLD2aXESdtzasQOicLuvRL7MPZTfgw",
      "watch_url": "https://www.youtube.com/watch?v=m9INmBABjlI"
    },
    {
      "id": "vnR9bg2G4ic",
      "title": "Lezione del 21/07/2025",
      "published_at": "2025-07-21T18:32:59Z",
      "year": 2025,
      "month": 7,
      "duration_seconds": 3442,
      "duration_formatted": "57m",
      "thumbnail_url": "https://i9.ytimg.com/vi/vnR9bg2G4ic/mqdefault.jpg?sqp=CNjHncwG&rs=AOn4CLCk0oqkXG7_0LG1KYffONirPM1_9Q",
      "watch_url": "https://www.youtube.com/watch?v=vnR9bg2G4ic"
    },
    {
      "id": "DfrVqmAuZY4",
      "title": "Lezione del 18/07/2025",
      "published_at": "2025-07-18T18:34:17Z",
      "year": 2025,
      "month": 7,
      "duration_seconds": 3304,
      "duration_formatted": "55m",
      "thumbnail_url": "https://i9.ytimg.com/vi/DfrVqmAuZY4/mqdefault.jpg?sqp=CNjHncwG&rs=AOn4CLAPlWILMjj8Rb2nNVPYOCvjg22D4A",
      "watch_url": "https://www.youtube.com/watch?v=DfrVqmAuZY4"
    },
    {
      "id": "K_iOZN0L2oA",
      "title": "Lezione del 17/07/2025",
      "published_at": "2025-07-17T18:36:22Z",
      "year": 2025,
      "month": 7,
      "duration_seconds": 3302,
      "duration_formatted": "55m",
      "thumbnail_url": "https://i9.ytimg.com/vi/K_iOZN0L2oA/mqdefault.jpg?sqp=CNjHncwG&rs=AOn4CLA0Zw0TEKQtu5hKJvb3VTTEOdPTdQ",
      "watch_url": "https://www.youtube.com/watch?v=K_iOZN0L2oA"
    },
    {
      "id": "9t72-0R8OgE",
      "title": "Lezione del 16/07/2025",
      "published_at": "2025-07-16T15:08:13Z",
      "year": 2025,
      "month": 7,
      "duration_seconds": 2064,
      "duration_formatted": "34m",
      "thumbnail_url": "https://i9.ytimg.com/vi/9t72-0R8OgE/mqdefault.jpg?sqp=CNjHncwG&rs=AOn4CLBQTdRbo2as_mnd2rlNsdmnkhMYqg",
      "watch_url": "https://www.youtube.com/watch?v=9t72-0R8OgE"
    },
    {
      "id": "4rR5HnwsmSw",
      "title": "Lezione del 15/07/2025 Sera",
      "published_at": "2025-07-15T18:21:07Z",
      "year": 2025,
      "month": 7,
      "duration_seconds": 2899,
      "duration_formatted": "48m",
      "thumbnail_url": "https://i9.ytimg.com/vi/4rR5HnwsmSw/mqdefault.jpg?sqp=CNjHncwG&rs=AOn4CLAjP1Qd2culC5_ZkS9o3NbL8GbEIQ",
      "watch_url": "https://www.youtube.com/watch?v=4rR5HnwsmSw"
    },
    {
      "id": "uxNqDaU_F_M",
      "title": "Lezione del 15/07/2025 Pomerggio",
      "published_at": "2025-07-15T15:09:53Z",
      "year": 2025,
      "month": 7,
      "duration_seconds": 2177,
      "duration_formatted": "36m",
      "thumbnail_url": "https://i9.ytimg.com/vi/uxNqDaU_F_M/mqdefault.jpg?sqp=CNjHncwG&rs=AOn4CLCs8rfKsTTTbBZCcPWveUM7Akor_g",
      "watch_url": "https://www.youtube.com/watch?v=uxNqDaU_F_M"
    },
    {
      "id": "7P_XUDbPw2c",
      "title": "Lezione del 14/07/2025",
      "published_at": "2025-07-14T18:36:10Z",
      "year": 2025,
      "month": 7,
      "duration_seconds": 3590,
      "duration_formatted": "59m",
      "thumbnail_url": "https://i9.ytimg.com/vi/7P_XUDbPw2c/mqdefault.jpg?sqp=CNjHncwG&rs=AOn4CLAQH9tPQhb6lEQLnaFpMGrp1SU35Q",
      "watch_url": "https://www.youtube.com/watch?v=7P_XUDbPw2c"
    },
    {
      "id": "lZVdrNo0S34",
      "title": "Lezione del 11/07/2025",
      "published_at": "2025-07-11T18:33:38Z",
      "year": 2025,
      "month": 7,
      "duration_seconds": 3283,
      "duration_formatted": "54m",
      "thumbnail_url": "https://i9.ytimg.com/vi/lZVdrNo0S34/mqdefault.jpg?sqp=CNjHncwG&rs=AOn4CLC_Ft5j2Il5XBgupwJXkSmV7WAgXw",
      "watch_url": "https://www.youtube.com/watch?v=lZVdrNo0S34"
    },
    {
      "id": "x4Z9CuMQ_JM",
      "title": "Lezione del 10/07/2025",
      "published_at": "2025-07-10T18:34:46Z",
      "year": 2025,
      "month": 7,
      "duration_seconds": 3218,
      "duration_formatted": "53m",
      "thumbnail_url": "https://i9.ytimg.com/vi/x4Z9CuMQ_JM/mqdefault.jpg?sqp=CNjHncwG&rs=AOn4CLDqEgc0hSTJRg6AFLvvn0ClZFHq-w",
      "watch_url": "https://www.youtube.com/watch?v=x4Z9CuMQ_JM"
    },
    {
      "id": "EQ7FrcLrcvo",
      "title": "Lezione del 09/07/2025",
      "published_at": "2025-07-09T15:05:20Z",
      "year": 2025,
      "month": 7,
      "duration_seconds": 2451,
      "duration_formatted": "40m",
      "thumbnail_url": "https://i9.ytimg.com/vi/EQ7FrcLrcvo/mqdefault.jpg?sqp=CNjHncwG&rs=AOn4CLApcXGxWgbwpOBL--mpx7Yp_x2fzw",
      "watch_url": "https://www.youtube.com/watch?v=EQ7FrcLrcvo"
    },
    {
      "id": "q5y2XnP0HeY",
      "title": "Lezione del 08/07/2025 Sera",
      "published_at": "2025-07-08T18:33:41Z",
      "year": 2025,
      "month": 7,
      "duration_seconds": 3523,
      "duration_formatted": "58m",
      "thumbnail_url": "https://i9.ytimg.com/vi/q5y2XnP0HeY/mqdefault.jpg?sqp=CNjHncwG&rs=AOn4CLDC3h54oqj-Bvo6xgpWEIwpMQPzmA",
      "watch_url": "https://www.youtube.com/watch?v=q5y2XnP0HeY"
    },
    {
      "id": "iCuCWJWCQJU",
      "title": "Lezione del 08/07/2025 Pomeriggio",
      "published_at": "2025-07-08T15:09:45Z",
      "year": 2025,
      "month": 7,
      "duration_seconds": 2333,
      "duration_formatted": "38m",
      "thumbnail_url": "https://i9.ytimg.com/vi/iCuCWJWCQJU/mqdefault.jpg?sqp=CNjHncwG&rs=AOn4CLAPmwI0DrI8Z8BazkWgwhB3gDvXfA",
      "watch_url": "https://www.youtube.com/watch?v=iCuCWJWCQJU"
    },
    {
      "id": "HFSCBVVKK3A",
      "title": "Lezione del 07/07/2025",
      "published_at": "2025-07-07T18:35:03Z",
      "year": 2025,
      "month": 7,
      "duration_seconds": 3597,
      "duration_formatted": "59m",
      "thumbnail_url": "https://i9.ytimg.com/vi/HFSCBVVKK3A/mqdefault.jpg?sqp=CNjHncwG&rs=AOn4CLAQxIcGGSn3pjMtVt2ToxZ4UG3E7g",
      "watch_url": "https://www.youtube.com/watch?v=HFSCBVVKK3A"
    },
    {
      "id": "7oh2st0RhCQ",
      "title": "Lezione del 04/07/2025",
      "published_at": "2025-07-04T18:34:20Z",
      "year": 2025,
      "month": 7,
      "duration_seconds": 3453,
      "duration_formatted": "57m",
      "thumbnail_url": "https://i9.ytimg.com/vi/7oh2st0RhCQ/mqdefault.jpg?sqp=CNjHncwG&rs=AOn4CLAzOASupwkhf3H4NA8Jxwpy0gYA4Q",
      "watch_url": "https://www.youtube.com/watch?v=7oh2st0RhCQ"
    },
    {
      "id": "G0sTH3Irego",
      "title": "Lezione del 03/07/2025",
      "published_at": "2025-07-03T18:35:40Z",
      "year": 2025,
      "month": 7,
      "duration_seconds": 3050,
      "duration_formatted": "50m",
      "thumbnail_url": "https://i9.ytimg.com/vi/G0sTH3Irego/mqdefault.jpg?sqp=CNjHncwG&rs=AOn4CLCEbqIPGhgvFOdqfr36Iqk1YhZ14A",
      "watch_url": "https://www.youtube.com/watch?v=G0sTH3Irego"
    },
    {
      "id": "ahg_sUMQBqM",
      "title": "Lezione del 02/07/2025",
      "published_at": "2025-07-02T15:12:44Z",
      "year": 2025,
      "month": 7,
      "duration_seconds": 2559,
      "duration_formatted": "42m",
      "thumbnail_url": "https://i9.ytimg.com/vi/ahg_sUMQBqM/mqdefault.jpg?sqp=CNjHncwG&rs=AOn4CLC9fJwt7FmbWMo4f4C2M-iZCc0QIw",
      "watch_url": "https://www.youtube.com/watch?v=ahg_sUMQBqM"
    },
    {
      "id": "Z4YA15jbQxU",
      "title": "Lezione del 01/07/2025 Sera",
      "published_at": "2025-07-01T18:07:48Z",
      "year": 2025,
      "month": 7,
      "duration_seconds": 2455,
      "duration_formatted": "40m",
      "thumbnail_url": "https://i9.ytimg.com/vi/Z4YA15jbQxU/mqdefault.jpg?sqp=CNjHncwG&rs=AOn4CLDp2nfqqkwy0TSSI-X6YCmK6eZ_Ww",
      "watch_url": "https://www.youtube.com/watch?v=Z4YA15jbQxU"
    },
    {
      "id": "9LN1_lA2Okc",
      "title": "Lezione del 01/07/2025 Pomeriggio",
      "published_at": "2025-07-01T15:04:59Z",
      "year": 2025,
      "month": 7,
      "duration_seconds": 2182,
      "duration_formatted": "36m",
      "thumbnail_url": "https://i9.ytimg.com/vi/9LN1_lA2Okc/mqdefault.jpg?sqp=CNjHncwG&rs=AOn4CLCIou08Xm_yhFac36Bkmss1KS9wgw",
      "watch_url": "https://www.youtube.com/watch?v=9LN1_lA2Okc"
    },
    {
      "id": "yAGVaJ5sEAs",
      "title": "Lezione del 27/06/2025",
      "published_at": "2025-06-27T18:33:46Z",
      "year": 2025,
      "month": 6,
      "duration_seconds": 3135,
      "duration_formatted": "52m",
      "thumbnail_url": "https://i9.ytimg.com/vi/yAGVaJ5sEAs/mqdefault.jpg?sqp=CNjHncwG&rs=AOn4CLBvosrXkUkGCB6bk4PhqFaSfJxHww",
      "watch_url": "https://www.youtube.com/watch?v=yAGVaJ5sEAs"
    },
    {
      "id": "LHE-ctiPO2E",
      "title": "Lezione del 26/06/2025",
      "published_at": "2025-06-26T18:33:18Z",
      "year": 2025,
      "month": 6,
      "duration_seconds": 3451,
      "duration_formatted": "57m",
      "thumbnail_url": "https://i9.ytimg.com/vi/LHE-ctiPO2E/mqdefault.jpg?sqp=CNjHncwG&rs=AOn4CLD_RePeMT-nClcVVsE3kvxRcMtRSQ",
      "watch_url": "https://www.youtube.com/watch?v=LHE-ctiPO2E"
    },
    {
      "id": "lWiq_9FiXIE",
      "title": "Lezione del 25/06/2025",
      "published_at": "2025-06-25T15:08:52Z",
      "year": 2025,
      "month": 6,
      "duration_seconds": 2467,
      "duration_formatted": "41m",
      "thumbnail_url": "https://i9.ytimg.com/vi/lWiq_9FiXIE/mqdefault.jpg?sqp=CNjHncwG&rs=AOn4CLAeRJTjG3WPdZD0QmIP7bTZLwmErQ",
      "watch_url": "https://www.youtube.com/watch?v=lWiq_9FiXIE"
    },
    {
      "id": "ZxM_27rApSs",
      "title": "Lezione del 24/06/2025 Sera",
      "published_at": "2025-06-24T18:25:46Z",
      "year": 2025,
      "month": 6,
      "duration_seconds": 2794,
      "duration_formatted": "46m",
      "thumbnail_url": "https://i9.ytimg.com/vi/ZxM_27rApSs/mqdefault.jpg?sqp=CNjHncwG&rs=AOn4CLAFOPFDnM3dqj1_-i_AQbs6xjXEJA",
      "watch_url": "https://www.youtube.com/watch?v=ZxM_27rApSs"
    },
    {
      "id": "z7NSppdbMS0",
      "title": "Lezione del 24/06/2025 Pomeriggio",
      "published_at": "2025-06-24T15:03:19Z",
      "year": 2025,
      "month": 6,
      "duration_seconds": 1976,
      "duration_formatted": "32m",
      "thumbnail_url": "https://i9.ytimg.com/vi/z7NSppdbMS0/mqdefault.jpg?sqp=CNjHncwG&rs=AOn4CLDmqoEdd5fe9BDTOA7R0iJIznJzxA",
      "watch_url": "https://www.youtube.com/watch?v=z7NSppdbMS0"
    },
    {
      "id": "1_78skEbYpM",
      "title": "Lezione del 23/06/2025",
      "published_at": "2025-06-23T18:32:53Z",
      "year": 2025,
      "month": 6,
      "duration_seconds": 3487,
      "duration_formatted": "58m",
      "thumbnail_url": "https://i9.ytimg.com/vi/1_78skEbYpM/mqdefault.jpg?sqp=CNjHncwG&rs=AOn4CLBqOOBizC4lYhvutWbR2YazMaBFPA",
      "watch_url": "https://www.youtube.com/watch?v=1_78skEbYpM"
    },
    {
      "id": "MWXevrFZOnI",
      "title": "Lezione del 20/06/2025",
      "published_at": "2025-06-20T18:34:34Z",
      "year": 2025,
      "month": 6,
      "duration_seconds": 3326,
      "duration_formatted": "55m",
      "thumbnail_url": "https://i9.ytimg.com/vi/MWXevrFZOnI/mqdefault.jpg?sqp=CNjHncwG&rs=AOn4CLCdAWCet_OWp4IeyLFHea892Sx8Tw",
      "watch_url": "https://www.youtube.com/watch?v=MWXevrFZOnI"
    },
    {
      "id": "g2SdTzUMKlc",
      "title": "Lezione del 19/06/2025",
      "published_at": "2025-06-19T18:31:55Z",
      "year": 2025,
      "month": 6,
      "duration_seconds": 2843,
      "duration_formatted": "47m",
      "thumbnail_url": "https://i9.ytimg.com/vi/g2SdTzUMKlc/mqdefault.jpg?sqp=CNjHncwG&rs=AOn4CLANJ_Mvid3UMAl1nbfsmJfHUszRSA",
      "watch_url": "https://www.youtube.com/watch?v=g2SdTzUMKlc"
    },
    {
      "id": "BYTC6_nlw5g",
      "title": "Lezione del 18/06/2025",
      "published_at": "2025-06-18T15:08:59Z",
      "year": 2025,
      "month": 6,
      "duration_seconds": 2442,
      "duration_formatted": "40m",
      "thumbnail_url": "https://i9.ytimg.com/vi/BYTC6_nlw5g/mqdefault.jpg?sqp=CNjHncwG&rs=AOn4CLCX9-NEUygkSJpalqd01CXX_NXjIg",
      "watch_url": "https://www.youtube.com/watch?v=BYTC6_nlw5g"
    },
    {
      "id": "lniO_k5XOuQ",
      "title": "Lezione del 17/06/2025",
      "published_at": "2025-06-17T15:09:27Z",
      "year": 2025,
      "month": 6,
      "duration_seconds": 2123,
      "duration_formatted": "35m",
      "thumbnail_url": "https://i9.ytimg.com/vi/lniO_k5XOuQ/mqdefault.jpg?sqp=CNjHncwG&rs=AOn4CLAJhVbBujApp1rCqeQv5UKWN9TkXw",
      "watch_url": "https://www.youtube.com/watch?v=lniO_k5XOuQ"
    },
    {
      "id": "PYmsnTMz1Mc",
      "title": "Lezione del 16/06/2025",
      "published_at": "2025-06-16T18:35:54Z",
      "year": 2025,
      "month": 6,
      "duration_seconds": 3204,
      "duration_formatted": "53m",
      "thumbnail_url": "https://i9.ytimg.com/vi/PYmsnTMz1Mc/mqdefault.jpg?sqp=CNjHncwG&rs=AOn4CLAVJ9N6IsWQBPkvF71AE8bR_IDisQ",
      "watch_url": "https://www.youtube.com/watch?v=PYmsnTMz1Mc"
    },
    {
      "id": "MuEz4QrgyAw",
      "title": "Lezione del 13/06/2025",
      "published_at": "2025-06-13T18:30:27Z",
      "year": 2025,
      "month": 6,
      "duration_seconds": 3689,
      "duration_formatted": "1h 1m",
      "thumbnail_url": "https://i9.ytimg.com/vi/MuEz4QrgyAw/mqdefault.jpg?sqp=CNjHncwG&rs=AOn4CLAXCSHHTVdbaXKealeBki1rzzBAIw",
      "watch_url": "https://www.youtube.com/watch?v=MuEz4QrgyAw"
    },
    {
      "id": "56BxpEGoNQg",
      "title": "Lezione del 12/06/2025",
      "published_at": "2025-06-12T18:34:52Z",
      "year": 2025,
      "month": 6,
      "duration_seconds": 2807,
      "duration_formatted": "46m",
      "thumbnail_url": "https://i9.ytimg.com/vi/56BxpEGoNQg/mqdefault.jpg?sqp=CNjHncwG&rs=AOn4CLCGZCkZrafc-bUvl_dIRQDS_IwglA",
      "watch_url": "https://www.youtube.com/watch?v=56BxpEGoNQg"
    },
    {
      "id": "F6Z_dEqh4JM",
      "title": "Lezione del 11/06/2025",
      "published_at": "2025-06-11T15:07:26Z",
      "year": 2025,
      "month": 6,
      "duration_seconds": 2155,
      "duration_formatted": "35m",
      "thumbnail_url": "https://i9.ytimg.com/vi/F6Z_dEqh4JM/mqdefault.jpg?sqp=CNjHncwG&rs=AOn4CLBpiM9bC6t140xVqUgEMjgu7LBJ8Q",
      "watch_url": "https://www.youtube.com/watch?v=F6Z_dEqh4JM"
    },
    {
      "id": "v2e1zfEsupA",
      "title": "Lezione del 10/06/2025",
      "published_at": "2025-06-10T15:13:11Z",
      "year": 2025,
      "month": 6,
      "duration_seconds": 2612,
      "duration_formatted": "43m",
      "thumbnail_url": "https://i9.ytimg.com/vi/v2e1zfEsupA/mqdefault.jpg?sqp=CNjHncwG&rs=AOn4CLAH96_V54GHx8koTw9DFoMoMEP7Kg",
      "watch_url": "https://www.youtube.com/watch?v=v2e1zfEsupA"
    },
    {
      "id": "UJeUF84kcsc",
      "title": "Lezione del 09/06/2025",
      "published_at": "2025-06-09T18:35:27Z",
      "year": 2025,
      "month": 6,
      "duration_seconds": 3264,
      "duration_formatted": "54m",
      "thumbnail_url": "https://i9.ytimg.com/vi/UJeUF84kcsc/mqdefault.jpg?sqp=CNjHncwG&rs=AOn4CLC2DS-dLFQ1JU_N1v2Yx6XXx5DQHA",
      "watch_url": "https://www.youtube.com/watch?v=UJeUF84kcsc"
    },
    {
      "id": "zSWLUKZR-DE",
      "title": "L' Ingegnere Insegna - Ibrido Toyota",
      "published_at": "2025-06-08T18:00:06Z",
      "year": 2025,
      "month": 6,
      "duration_seconds": 613,
      "duration_formatted": "10m",
      "thumbnail_url": "https://i.ytimg.com/vi/zSWLUKZR-DE/mqdefault.jpg",
      "watch_url": "https://www.youtube.com/watch?v=zSWLUKZR-DE"
    },
    {
      "id": "zSWLUKZR-DE",
      "title": "L' Ingegnere Insegna - Ibrido Toyota",
      "published_at": "2025-06-08T18:00:06Z",
      "year": 2025,
      "month": 6,
      "duration_seconds": 613,
      "duration_formatted": "10m",
      "thumbnail_url": "https://i.ytimg.com/vi/zSWLUKZR-DE/mqdefault.jpg",
      "watch_url": "https://www.youtube.com/watch?v=zSWLUKZR-DE"
    },
    {
      "id": "EwB76VoJDes",
      "title": "Lezione del 06/06/2025",
      "published_at": "2025-06-06T18:32:20Z",
      "year": 2025,
      "month": 6,
      "duration_seconds": 3272,
      "duration_formatted": "54m",
      "thumbnail_url": "https://i9.ytimg.com/vi/EwB76VoJDes/mqdefault.jpg?sqp=CNjHncwG&rs=AOn4CLDrGEbtV9IXwD3gpqMG-_jeFF3PFg",
      "watch_url": "https://www.youtube.com/watch?v=EwB76VoJDes"
    },
    {
      "id": "ujWSBWg9asg",
      "title": "Lezione del 05/06/2025",
      "published_at": "2025-06-05T18:35:29Z",
      "year": 2025,
      "month": 6,
      "duration_seconds": 3336,
      "duration_formatted": "55m",
      "thumbnail_url": "https://i9.ytimg.com/vi/ujWSBWg9asg/mqdefault.jpg?sqp=CNjHncwG&rs=AOn4CLAeMLmdFghhZdWqSkEO_qjoPaN3Qg",
      "watch_url": "https://www.youtube.com/watch?v=ujWSBWg9asg"
    },
    {
      "id": "bdPAF8fDmuI",
      "title": "Lezione del 03/06/2025",
      "published_at": "2025-06-04T15:12:41Z",
      "year": 2025,
      "month": 6,
      "duration_seconds": 2762,
      "duration_formatted": "46m",
      "thumbnail_url": "https://i9.ytimg.com/vi/bdPAF8fDmuI/mqdefault.jpg?sqp=CNjHncwG&rs=AOn4CLCzsyUoBMt59VWzIxnX7vu5HtQj2Q",
      "watch_url": "https://www.youtube.com/watch?v=bdPAF8fDmuI"
    },
    {
      "id": "PFfgyKWhPCU",
      "title": "Lezione del 03/06/2025",
      "published_at": "2025-06-03T15:10:41Z",
      "year": 2025,
      "month": 6,
      "duration_seconds": 2500,
      "duration_formatted": "41m",
      "thumbnail_url": "https://i9.ytimg.com/vi/PFfgyKWhPCU/mqdefault.jpg?sqp=CNjHncwG&rs=AOn4CLANPoJu8VxLfcpwbgGV5hBKW8OtMQ",
      "watch_url": "https://www.youtube.com/watch?v=PFfgyKWhPCU"
    },
    {
      "id": "FlF9ufQqT-s",
      "title": "Lezione del 30/05/2025",
      "published_at": "2025-05-30T18:33:20Z",
      "year": 2025,
      "month": 5,
      "duration_seconds": 3352,
      "duration_formatted": "55m",
      "thumbnail_url": "https://i9.ytimg.com/vi/FlF9ufQqT-s/mqdefault.jpg?sqp=CNjHncwG&rs=AOn4CLCGgFsOPZXEPUWun11N5mMQTCkSMA",
      "watch_url": "https://www.youtube.com/watch?v=FlF9ufQqT-s"
    },
    {
      "id": "Zzm6yzuqRIo",
      "title": "Lezione del 29/05/2025",
      "published_at": "2025-05-29T18:33:43Z",
      "year": 2025,
      "month": 5,
      "duration_seconds": 3221,
      "duration_formatted": "53m",
      "thumbnail_url": "https://i9.ytimg.com/vi/Zzm6yzuqRIo/mqdefault.jpg?sqp=CNjHncwG&rs=AOn4CLC0CECWNtEQomOhvZwJm4myBHNbgg",
      "watch_url": "https://www.youtube.com/watch?v=Zzm6yzuqRIo"
    },
    {
      "id": "kmNLPRtv6Fg",
      "title": "Lezione del 28/05/2025",
      "published_at": "2025-05-28T15:08:36Z",
      "year": 2025,
      "month": 5,
      "duration_seconds": 2578,
      "duration_formatted": "42m",
      "thumbnail_url": "https://i9.ytimg.com/vi/kmNLPRtv6Fg/mqdefault.jpg?sqp=CNjHncwG&rs=AOn4CLCpl9Din2-XAex_jnkVRCN6fX60TQ",
      "watch_url": "https://www.youtube.com/watch?v=kmNLPRtv6Fg"
    },
    {
      "id": "JJ_oaTWWtm0",
      "title": "Lezione del 27/05/2025 Sera",
      "published_at": "2025-05-27T18:32:07Z",
      "year": 2025,
      "month": 5,
      "duration_seconds": 3424,
      "duration_formatted": "57m",
      "thumbnail_url": "https://i9.ytimg.com/vi/JJ_oaTWWtm0/mqdefault.jpg?sqp=CNjHncwG&rs=AOn4CLDKr70P9jfpjpQQz3onUoB4EY2l6A",
      "watch_url": "https://www.youtube.com/watch?v=JJ_oaTWWtm0"
    },
    {
      "id": "nYXU3edjK7g",
      "title": "Lezione del 27/05/2025 Pomeriggio",
      "published_at": "2025-05-27T15:08:09Z",
      "year": 2025,
      "month": 5,
      "duration_seconds": 2796,
      "duration_formatted": "46m",
      "thumbnail_url": "https://i9.ytimg.com/vi/nYXU3edjK7g/mqdefault.jpg?sqp=CNjHncwG&rs=AOn4CLAYn9OVnKtgBcqLvpKV9HECy9Ge0Q",
      "watch_url": "https://www.youtube.com/watch?v=nYXU3edjK7g"
    },
    {
      "id": "nDxJa_HQJyc",
      "title": "Lezione del 26/05/2025",
      "published_at": "2025-05-26T18:32:46Z",
      "year": 2025,
      "month": 5,
      "duration_seconds": 3354,
      "duration_formatted": "55m",
      "thumbnail_url": "https://i9.ytimg.com/vi/nDxJa_HQJyc/mqdefault.jpg?sqp=CNjHncwG&rs=AOn4CLCYSnyWRJO9qISSJtuSw7UI56l8WQ",
      "watch_url": "https://www.youtube.com/watch?v=nDxJa_HQJyc"
    },
    {
      "id": "RUvf5i7CCT4",
      "title": "Lezione del 23/05/2025",
      "published_at": "2025-05-23T18:31:05Z",
      "year": 2025,
      "month": 5,
      "duration_seconds": 3129,
      "duration_formatted": "52m",
      "thumbnail_url": "https://i9.ytimg.com/vi/RUvf5i7CCT4/mqdefault.jpg?sqp=CNjHncwG&rs=AOn4CLBaMvBfklG0aaEOF11UCKaNuA8LrA",
      "watch_url": "https://www.youtube.com/watch?v=RUvf5i7CCT4"
    },
    {
      "id": "p6_VUDcsq2s",
      "title": "Lezione del 22/05/2025",
      "published_at": "2025-05-22T18:32:07Z",
      "year": 2025,
      "month": 5,
      "duration_seconds": 3276,
      "duration_formatted": "54m",
      "thumbnail_url": "https://i9.ytimg.com/vi/p6_VUDcsq2s/mqdefault.jpg?sqp=CNjHncwG&rs=AOn4CLBlUccdJeG7QNsZw-MOtAkzbaErmQ",
      "watch_url": "https://www.youtube.com/watch?v=p6_VUDcsq2s"
    },
    {
      "id": "v-f3KiZBWhU",
      "title": "Lezione del 21/05/2025",
      "published_at": "2025-05-21T15:08:57Z",
      "year": 2025,
      "month": 5,
      "duration_seconds": 2288,
      "duration_formatted": "38m",
      "thumbnail_url": "https://i9.ytimg.com/vi/v-f3KiZBWhU/mqdefault.jpg?sqp=CNjHncwG&rs=AOn4CLDcxGQUCX-vxqtPJAVG5t-Q48crgQ",
      "watch_url": "https://www.youtube.com/watch?v=v-f3KiZBWhU"
    },
    {
      "id": "8ovXEcFoyfE",
      "title": "L' Ingegnere Insegna - Staccabatteria",
      "published_at": "2025-05-21T14:00:06Z",
      "year": 2025,
      "month": 5,
      "duration_seconds": 626,
      "duration_formatted": "10m",
      "thumbnail_url": "https://i.ytimg.com/vi/8ovXEcFoyfE/mqdefault.jpg",
      "watch_url": "https://www.youtube.com/watch?v=8ovXEcFoyfE"
    },
    {
      "id": "8ovXEcFoyfE",
      "title": "L' Ingegnere Insegna - Staccabatteria",
      "published_at": "2025-05-21T14:00:06Z",
      "year": 2025,
      "month": 5,
      "duration_seconds": 626,
      "duration_formatted": "10m",
      "thumbnail_url": "https://i.ytimg.com/vi/8ovXEcFoyfE/mqdefault.jpg",
      "watch_url": "https://www.youtube.com/watch?v=8ovXEcFoyfE"
    },
    {
      "id": "mNnPjhLx23E",
      "title": "Lezione del 19/05/2025",
      "published_at": "2025-05-19T18:34:31Z",
      "year": 2025,
      "month": 5,
      "duration_seconds": 3279,
      "duration_formatted": "54m",
      "thumbnail_url": "https://i9.ytimg.com/vi/mNnPjhLx23E/mqdefault.jpg?sqp=CNjHncwG&rs=AOn4CLDFciWSVybL6tTkkvQJBE95H5RsiQ",
      "watch_url": "https://www.youtube.com/watch?v=mNnPjhLx23E"
    },
    {
      "id": "Y2lw5fyaeUg",
      "title": "Lezione del 16/05/2025",
      "published_at": "2025-05-16T18:30:12Z",
      "year": 2025,
      "month": 5,
      "duration_seconds": 3168,
      "duration_formatted": "52m",
      "thumbnail_url": "https://i9.ytimg.com/vi/Y2lw5fyaeUg/mqdefault.jpg?sqp=CNjHncwG&rs=AOn4CLC-RXVyf8WCrLsHOnoIDBRDy8_Qvw",
      "watch_url": "https://www.youtube.com/watch?v=Y2lw5fyaeUg"
    },
    {
      "id": "858SqdREuGQ",
      "title": "Lezione del 15/05/2025",
      "published_at": "2025-05-15T18:34:29Z",
      "year": 2025,
      "month": 5,
      "duration_seconds": 2592,
      "duration_formatted": "43m",
      "thumbnail_url": "https://i9.ytimg.com/vi/858SqdREuGQ/mqdefault.jpg?sqp=CNjHncwG&rs=AOn4CLCF0_6awvArcxr196m9kG_dwwwSpw",
      "watch_url": "https://www.youtube.com/watch?v=858SqdREuGQ"
    },
    {
      "id": "WVUw4MnKSUA",
      "title": "Lezione del 14/05/2025",
      "published_at": "2025-05-14T15:05:28Z",
      "year": 2025,
      "month": 5,
      "duration_seconds": 2670,
      "duration_formatted": "44m",
      "thumbnail_url": "https://i9.ytimg.com/vi/WVUw4MnKSUA/mqdefault.jpg?sqp=CNjHncwG&rs=AOn4CLBtdpJOw7aUEFXClj0J2T4Fxk4feA",
      "watch_url": "https://www.youtube.com/watch?v=WVUw4MnKSUA"
    },
    {
      "id": "diT1g8QlG8s",
      "title": "Lezione del 13/05/2025 Pomeriggio",
      "published_at": "2025-05-13T15:06:26Z",
      "year": 2025,
      "month": 5,
      "duration_seconds": 2095,
      "duration_formatted": "34m",
      "thumbnail_url": "https://i9.ytimg.com/vi/diT1g8QlG8s/mqdefault.jpg?sqp=CNjHncwG&rs=AOn4CLDYjM8pvk-omTfGQ5eTYdTVC6YZEg",
      "watch_url": "https://www.youtube.com/watch?v=diT1g8QlG8s"
    },
    {
      "id": "ta4BFCo9vJk",
      "title": "Lezione del 12/05/2025",
      "published_at": "2025-05-12T18:33:06Z",
      "year": 2025,
      "month": 5,
      "duration_seconds": 3476,
      "duration_formatted": "57m",
      "thumbnail_url": "https://i9.ytimg.com/vi/ta4BFCo9vJk/mqdefault.jpg?sqp=CNjHncwG&rs=AOn4CLBPXr00NNrWJqCij9Z0FEv9gSTrEg",
      "watch_url": "https://www.youtube.com/watch?v=ta4BFCo9vJk"
    },
    {
      "id": "s2YTJpGpg4Y",
      "title": "L' Ingegnere Insegna - Interruttore Inerziale",
      "published_at": "2025-05-10T12:00:06Z",
      "year": 2025,
      "month": 5,
      "duration_seconds": 446,
      "duration_formatted": "7m",
      "thumbnail_url": "https://i.ytimg.com/vi/s2YTJpGpg4Y/mqdefault.jpg",
      "watch_url": "https://www.youtube.com/watch?v=s2YTJpGpg4Y"
    },
    {
      "id": "s2YTJpGpg4Y",
      "title": "L' Ingegnere Insegna - Interruttore Inerziale",
      "published_at": "2025-05-10T12:00:06Z",
      "year": 2025,
      "month": 5,
      "duration_seconds": 446,
      "duration_formatted": "7m",
      "thumbnail_url": "https://i.ytimg.com/vi/s2YTJpGpg4Y/mqdefault.jpg",
      "watch_url": "https://www.youtube.com/watch?v=s2YTJpGpg4Y"
    },
    {
      "id": "74bY7oUzIqU",
      "title": "Lezione del 09/05/2025",
      "published_at": "2025-05-09T18:33:26Z",
      "year": 2025,
      "month": 5,
      "duration_seconds": 3644,
      "duration_formatted": "1h 0m",
      "thumbnail_url": "https://i9.ytimg.com/vi/74bY7oUzIqU/mqdefault.jpg?sqp=CNjHncwG&rs=AOn4CLA_eHeyThACKlFvcGStTsln2W3dRA",
      "watch_url": "https://www.youtube.com/watch?v=74bY7oUzIqU"
    },
    {
      "id": "uJruOYRrylE",
      "title": "Lezione del 08/05/2025",
      "published_at": "2025-05-08T18:33:32Z",
      "year": 2025,
      "month": 5,
      "duration_seconds": 3596,
      "duration_formatted": "59m",
      "thumbnail_url": "https://i9.ytimg.com/vi/uJruOYRrylE/mqdefault.jpg?sqp=CNjHncwG&rs=AOn4CLARKfcX70srYfZx96uySeOHU9LgzQ",
      "watch_url": "https://www.youtube.com/watch?v=uJruOYRrylE"
    },
    {
      "id": "NahRaImRFzw",
      "title": "Lezione del 07/05/2025",
      "published_at": "2025-05-07T15:09:36Z",
      "year": 2025,
      "month": 5,
      "duration_seconds": 2564,
      "duration_formatted": "42m",
      "thumbnail_url": "https://i9.ytimg.com/vi/NahRaImRFzw/mqdefault.jpg?sqp=CNjHncwG&rs=AOn4CLCbDgYVYt4LyVusTKoYj7UVcuGz2w",
      "watch_url": "https://www.youtube.com/watch?v=NahRaImRFzw"
    },
    {
      "id": "ggaNgHVSyYI",
      "title": "Lezione del 06/05/2025 Sera",
      "published_at": "2025-05-06T18:22:31Z",
      "year": 2025,
      "month": 5,
      "duration_seconds": 2300,
      "duration_formatted": "38m",
      "thumbnail_url": "https://i9.ytimg.com/vi/ggaNgHVSyYI/mqdefault.jpg?sqp=CNjHncwG&rs=AOn4CLCaje99PoZDQqy9OUJ3LnAiU1sTVA",
      "watch_url": "https://www.youtube.com/watch?v=ggaNgHVSyYI"
    },
    {
      "id": "1uI6Uxu0uYI",
      "title": "Lezione del 06/05/2025 Pomeriggio",
      "published_at": "2025-05-06T15:07:16Z",
      "year": 2025,
      "month": 5,
      "duration_seconds": 2331,
      "duration_formatted": "38m",
      "thumbnail_url": "https://i9.ytimg.com/vi/1uI6Uxu0uYI/mqdefault.jpg?sqp=CNjHncwG&rs=AOn4CLDc79jRc2TGQUal0Rykoe36hFTrDA",
      "watch_url": "https://www.youtube.com/watch?v=1uI6Uxu0uYI"
    },
    {
      "id": "qKNiji2I4Io",
      "title": "Lezione del 05/05/2025",
      "published_at": "2025-05-05T18:33:21Z",
      "year": 2025,
      "month": 5,
      "duration_seconds": 3251,
      "duration_formatted": "54m",
      "thumbnail_url": "https://i9.ytimg.com/vi/qKNiji2I4Io/mqdefault.jpg?sqp=CNjHncwG&rs=AOn4CLCWeE5bH6iMorrx4B9Y11KSf9VWFA",
      "watch_url": "https://www.youtube.com/watch?v=qKNiji2I4Io"
    },
    {
      "id": "ecX4tPfIsGE",
      "title": "Pillole di Meccanica - il Differenziale",
      "published_at": "2025-05-04T18:00:06Z",
      "year": 2025,
      "month": 5,
      "duration_seconds": 307,
      "duration_formatted": "5m",
      "thumbnail_url": "https://i.ytimg.com/vi/ecX4tPfIsGE/mqdefault.jpg",
      "watch_url": "https://www.youtube.com/watch?v=ecX4tPfIsGE"
    },
    {
      "id": "XKIy8wt8pjs",
      "title": "Psicologia al Volante - Abuso Alcol",
      "published_at": "2025-05-01T18:00:06Z",
      "year": 2025,
      "month": 5,
      "duration_seconds": 943,
      "duration_formatted": "15m",
      "thumbnail_url": "https://i.ytimg.com/vi/XKIy8wt8pjs/mqdefault.jpg",
      "watch_url": "https://www.youtube.com/watch?v=XKIy8wt8pjs"
    },
    {
      "id": "_VsyINlLP6g",
      "title": "Pillole di Teoria - La Revisione dei Veicoli",
      "published_at": "2025-04-27T18:00:22Z",
      "year": 2025,
      "month": 4,
      "duration_seconds": 539,
      "duration_formatted": "8m",
      "thumbnail_url": "https://i.ytimg.com/vi/_VsyINlLP6g/mqdefault.jpg",
      "watch_url": "https://www.youtube.com/watch?v=_VsyINlLP6g"
    },
    {
      "id": "_x2iIOXtaQ0",
      "title": "Pillole di Guida - Il Sorpasso",
      "published_at": "2025-04-23T16:00:06Z",
      "year": 2025,
      "month": 4,
      "duration_seconds": 588,
      "duration_formatted": "9m",
      "thumbnail_url": "https://i.ytimg.com/vi/_x2iIOXtaQ0/mqdefault.jpg",
      "watch_url": "https://www.youtube.com/watch?v=_x2iIOXtaQ0"
    },
    {
      "id": "IzJ5dGKphTQ",
      "title": "Lezione del 22/04/2025",
      "published_at": "2025-04-22T15:09:29Z",
      "year": 2025,
      "month": 4,
      "duration_seconds": 2585,
      "duration_formatted": "43m",
      "thumbnail_url": "https://i9.ytimg.com/vi/IzJ5dGKphTQ/mqdefault.jpg?sqp=CNjHncwG&rs=AOn4CLCMpdAXy78Jfh69jo9KRmOy0k5Kig",
      "watch_url": "https://www.youtube.com/watch?v=IzJ5dGKphTQ"
    },
    {
      "id": "P73CD71edpM",
      "title": "L' Ingegnere Insegna - Aereodinamica in F1",
      "published_at": "2025-04-20T18:00:06Z",
      "year": 2025,
      "month": 4,
      "duration_seconds": 507,
      "duration_formatted": "8m",
      "thumbnail_url": "https://i.ytimg.com/vi/P73CD71edpM/mqdefault.jpg",
      "watch_url": "https://www.youtube.com/watch?v=P73CD71edpM"
    },
    {
      "id": "2ziR8vL_Rao",
      "title": "Lezione del 18/04/2025",
      "published_at": "2025-04-18T18:31:17Z",
      "year": 2025,
      "month": 4,
      "duration_seconds": 3341,
      "duration_formatted": "55m",
      "thumbnail_url": "https://i9.ytimg.com/vi/2ziR8vL_Rao/mqdefault.jpg?sqp=CNjHncwG&rs=AOn4CLBVt7VyadFE1mG63es7k_HdZmHCZQ",
      "watch_url": "https://www.youtube.com/watch?v=2ziR8vL_Rao"
    },
    {
      "id": "l-encBlvuyY",
      "title": "Lezione del 17/04/2025",
      "published_at": "2025-04-17T18:29:00Z",
      "year": 2025,
      "month": 4,
      "duration_seconds": 3239,
      "duration_formatted": "53m",
      "thumbnail_url": "https://i9.ytimg.com/vi/l-encBlvuyY/mqdefault.jpg?sqp=CNjHncwG&rs=AOn4CLDflDC4SkYIr4zLx-yq5RGjIhfLjQ",
      "watch_url": "https://www.youtube.com/watch?v=l-encBlvuyY"
    },
    {
      "id": "m3dwspr1suc",
      "title": "L' Avvocato Risponde - Responsabilità Patenti",
      "published_at": "2025-04-16T16:00:06Z",
      "year": 2025,
      "month": 4,
      "duration_seconds": 436,
      "duration_formatted": "7m",
      "thumbnail_url": "https://i.ytimg.com/vi/m3dwspr1suc/mqdefault.jpg",
      "watch_url": "https://www.youtube.com/watch?v=m3dwspr1suc"
    },
    {
      "id": "hwZnbvSBSnc",
      "title": "Lezione del 15/04/2025",
      "published_at": "2025-04-15T15:08:57Z",
      "year": 2025,
      "month": 4,
      "duration_seconds": 1676,
      "duration_formatted": "27m",
      "thumbnail_url": "https://i9.ytimg.com/vi/hwZnbvSBSnc/mqdefault.jpg?sqp=CNjHncwG&rs=AOn4CLATNcKvuIs7PHECOq_6XTk5UE-YQw",
      "watch_url": "https://www.youtube.com/watch?v=hwZnbvSBSnc"
    },
    {
      "id": "Xl8rQszPn3M",
      "title": "Pillole di Teoria - La Distanza di Sicurezza",
      "published_at": "2025-04-13T18:00:06Z",
      "year": 2025,
      "month": 4,
      "duration_seconds": 580,
      "duration_formatted": "9m",
      "thumbnail_url": "https://i.ytimg.com/vi/Xl8rQszPn3M/mqdefault.jpg",
      "watch_url": "https://www.youtube.com/watch?v=Xl8rQszPn3M"
    },
    {
      "id": "pHEOBXvvE20",
      "title": "Lezione del 11/04/2025",
      "published_at": "2025-04-11T18:31:07Z",
      "year": 2025,
      "month": 4,
      "duration_seconds": 3401,
      "duration_formatted": "56m",
      "thumbnail_url": "https://i9.ytimg.com/vi/pHEOBXvvE20/mqdefault.jpg?sqp=CNjHncwG&rs=AOn4CLC-ld9lW1lJDnjpzSKDmaeeIqmjiA",
      "watch_url": "https://www.youtube.com/watch?v=pHEOBXvvE20"
    },
    {
      "id": "weaOvGLXlBU",
      "title": "Lezione del 10/04/2025",
      "published_at": "2025-04-10T18:32:37Z",
      "year": 2025,
      "month": 4,
      "duration_seconds": 3386,
      "duration_formatted": "56m",
      "thumbnail_url": "https://i9.ytimg.com/vi/weaOvGLXlBU/mqdefault.jpg?sqp=CNjHncwG&rs=AOn4CLDgytk00x4xyuRdwZ3JxRL6K9yUZw",
      "watch_url": "https://www.youtube.com/watch?v=weaOvGLXlBU"
    },
    {
      "id": "quHwxetvs2Q",
      "title": "L' Ingegnere Insegna - Impianto di Scarico",
      "published_at": "2025-04-09T16:00:06Z",
      "year": 2025,
      "month": 4,
      "duration_seconds": 447,
      "duration_formatted": "7m",
      "thumbnail_url": "https://i.ytimg.com/vi/quHwxetvs2Q/mqdefault.jpg",
      "watch_url": "https://www.youtube.com/watch?v=quHwxetvs2Q"
    },
    {
      "id": "Dg4c6T48OVA",
      "title": "Lezione del 08/04/2025 Pomeriggio",
      "published_at": "2025-04-08T15:12:05Z",
      "year": 2025,
      "month": 4,
      "duration_seconds": 1999,
      "duration_formatted": "33m",
      "thumbnail_url": "https://i9.ytimg.com/vi/Dg4c6T48OVA/mqdefault.jpg?sqp=CNjHncwG&rs=AOn4CLDVXVEUCdNbQ4-cavBIIY_FVir8BQ",
      "watch_url": "https://www.youtube.com/watch?v=Dg4c6T48OVA"
    },
    {
      "id": "8ZSQCseQzMA",
      "title": "Lezione del 07/04/2025",
      "published_at": "2025-04-07T18:33:07Z",
      "year": 2025,
      "month": 4,
      "duration_seconds": 3624,
      "duration_formatted": "1h 0m",
      "thumbnail_url": "https://i9.ytimg.com/vi/8ZSQCseQzMA/mqdefault.jpg?sqp=CNjHncwG&rs=AOn4CLCb9SpWrjpKPc6erG-jd8h5QGhMBw",
      "watch_url": "https://www.youtube.com/watch?v=8ZSQCseQzMA"
    },
    {
      "id": "20tZDsym0co",
      "title": "Psicologia al Volante - Posizione di Guida",
      "published_at": "2025-04-05T12:00:06Z",
      "year": 2025,
      "month": 4,
      "duration_seconds": 735,
      "duration_formatted": "12m",
      "thumbnail_url": "https://i.ytimg.com/vi/20tZDsym0co/mqdefault.jpg",
      "watch_url": "https://www.youtube.com/watch?v=20tZDsym0co"
    },
    {
      "id": "TMSTTh0tvx4",
      "title": "Lezione del 04/04/2025",
      "published_at": "2025-04-04T18:32:45Z",
      "year": 2025,
      "month": 4,
      "duration_seconds": 3334,
      "duration_formatted": "55m",
      "thumbnail_url": "https://i9.ytimg.com/vi/TMSTTh0tvx4/mqdefault.jpg?sqp=CNjHncwG&rs=AOn4CLBvAdgDl-ZcpOdgY_F40ISMks8MKg",
      "watch_url": "https://www.youtube.com/watch?v=TMSTTh0tvx4"
    },
    {
      "id": "JUwLMaM1_G4",
      "title": "Lezione del 03/04/2025",
      "published_at": "2025-04-03T18:20:16Z",
      "year": 2025,
      "month": 4,
      "duration_seconds": 2775,
      "duration_formatted": "46m",
      "thumbnail_url": "https://i9.ytimg.com/vi/JUwLMaM1_G4/mqdefault.jpg?sqp=CNjHncwG&rs=AOn4CLBHPEjztN_hCOwsSZCtqShTc8ewgw",
      "watch_url": "https://www.youtube.com/watch?v=JUwLMaM1_G4"
    },
    {
      "id": "NV9M7VTClDQ",
      "title": "Pillole di Teoria - La Patente C",
      "published_at": "2025-04-02T16:00:06Z",
      "year": 2025,
      "month": 4,
      "duration_seconds": 434,
      "duration_formatted": "7m",
      "thumbnail_url": "https://i.ytimg.com/vi/NV9M7VTClDQ/mqdefault.jpg",
      "watch_url": "https://www.youtube.com/watch?v=NV9M7VTClDQ"
    },
    {
      "id": "NV9M7VTClDQ",
      "title": "Pillole di Teoria - La Patente C",
      "published_at": "2025-04-02T16:00:06Z",
      "year": 2025,
      "month": 4,
      "duration_seconds": 434,
      "duration_formatted": "7m",
      "thumbnail_url": "https://i.ytimg.com/vi/NV9M7VTClDQ/mqdefault.jpg",
      "watch_url": "https://www.youtube.com/watch?v=NV9M7VTClDQ"
    },
    {
      "id": "NaoTfobyzZo",
      "title": "Lezione del 01/04/2025 Sera",
      "published_at": "2025-04-01T18:15:06Z",
      "year": 2025,
      "month": 4,
      "duration_seconds": 2649,
      "duration_formatted": "44m",
      "thumbnail_url": "https://i9.ytimg.com/vi/NaoTfobyzZo/mqdefault.jpg?sqp=CNjHncwG&rs=AOn4CLAFziPLohfFlouLYpUFeqvS4Z25tQ",
      "watch_url": "https://www.youtube.com/watch?v=NaoTfobyzZo"
    },
    {
      "id": "5K7O-08WXBA",
      "title": "Lezione del 01/04/2025 Pomeriggio",
      "published_at": "2025-04-01T15:06:49Z",
      "year": 2025,
      "month": 4,
      "duration_seconds": 2030,
      "duration_formatted": "33m",
      "thumbnail_url": "https://i9.ytimg.com/vi/5K7O-08WXBA/mqdefault.jpg?sqp=CNjHncwG&rs=AOn4CLBB_One1YOIyqsrXIImFkJs3yNuKA",
      "watch_url": "https://www.youtube.com/watch?v=5K7O-08WXBA"
    },
    {
      "id": "zdEyS7roEWc",
      "title": "Lezione del 31/03/2025",
      "published_at": "2025-03-31T18:32:00Z",
      "year": 2025,
      "month": 3,
      "duration_seconds": 3463,
      "duration_formatted": "57m",
      "thumbnail_url": "https://i9.ytimg.com/vi/zdEyS7roEWc/mqdefault.jpg?sqp=CNjHncwG&rs=AOn4CLBk9LweG4zyTzJocJowVaGqFNtJ2Q",
      "watch_url": "https://www.youtube.com/watch?v=zdEyS7roEWc"
    },
    {
      "id": "TtwGBvkrwm0",
      "title": "Lezione del 28/03/2025",
      "published_at": "2025-03-28T19:31:23Z",
      "year": 2025,
      "month": 3,
      "duration_seconds": 3555,
      "duration_formatted": "59m",
      "thumbnail_url": "https://i9.ytimg.com/vi/TtwGBvkrwm0/mqdefault.jpg?sqp=CNjHncwG&rs=AOn4CLBMk1n1SAxyXSnhMZ9SkcHXpWMncw",
      "watch_url": "https://www.youtube.com/watch?v=TtwGBvkrwm0"
    },
    {
      "id": "IFvW8V6gnr4",
      "title": "Lezione del 27/03/2025",
      "published_at": "2025-03-27T19:32:07Z",
      "year": 2025,
      "month": 3,
      "duration_seconds": 3503,
      "duration_formatted": "58m",
      "thumbnail_url": "https://i9.ytimg.com/vi/IFvW8V6gnr4/mqdefault.jpg?sqp=CNjHncwG&rs=AOn4CLD-uxNbF0_GE69zZD7tPoYAN-yPPg",
      "watch_url": "https://www.youtube.com/watch?v=IFvW8V6gnr4"
    },
    {
      "id": "O3hgL2BowyY",
      "title": "Pillole di Meccanica - ESP",
      "published_at": "2025-03-26T17:00:05Z",
      "year": 2025,
      "month": 3,
      "duration_seconds": 446,
      "duration_formatted": "7m",
      "thumbnail_url": "https://i.ytimg.com/vi/O3hgL2BowyY/mqdefault.jpg",
      "watch_url": "https://www.youtube.com/watch?v=O3hgL2BowyY"
    },
    {
      "id": "O3hgL2BowyY",
      "title": "Pillole di Meccanica - ESP",
      "published_at": "2025-03-26T17:00:05Z",
      "year": 2025,
      "month": 3,
      "duration_seconds": 446,
      "duration_formatted": "7m",
      "thumbnail_url": "https://i.ytimg.com/vi/O3hgL2BowyY/mqdefault.jpg",
      "watch_url": "https://www.youtube.com/watch?v=O3hgL2BowyY"
    },
    {
      "id": "NTT3ixhRWDU",
      "title": "Lezione del 25/03/2025 Pomeriggio",
      "published_at": "2025-03-25T16:03:19Z",
      "year": 2025,
      "month": 3,
      "duration_seconds": 2011,
      "duration_formatted": "33m",
      "thumbnail_url": "https://i9.ytimg.com/vi/NTT3ixhRWDU/mqdefault.jpg?sqp=CNjHncwG&rs=AOn4CLDi8gwNiMroAet0kjq9kIQbtDG5fg",
      "watch_url": "https://www.youtube.com/watch?v=NTT3ixhRWDU"
    },
    {
      "id": "h7hubz-WjlI",
      "title": "Lezione del 24/03/2025",
      "published_at": "2025-03-24T19:33:39Z",
      "year": 2025,
      "month": 3,
      "duration_seconds": 3836,
      "duration_formatted": "1h 3m",
      "thumbnail_url": "https://i9.ytimg.com/vi/h7hubz-WjlI/mqdefault.jpg?sqp=CNjHncwG&rs=AOn4CLBsoSIxFK6G8pOkKaLkb8MAMRDngg",
      "watch_url": "https://www.youtube.com/watch?v=h7hubz-WjlI"
    },
    {
      "id": "qqzRDIKBOKI",
      "title": "Pillole di Meccanica - ABS",
      "published_at": "2025-03-23T19:00:06Z",
      "year": 2025,
      "month": 3,
      "duration_seconds": 491,
      "duration_formatted": "8m",
      "thumbnail_url": "https://i.ytimg.com/vi/qqzRDIKBOKI/mqdefault.jpg",
      "watch_url": "https://www.youtube.com/watch?v=qqzRDIKBOKI"
    },
    {
      "id": "qqzRDIKBOKI",
      "title": "Pillole di Meccanica - ABS",
      "published_at": "2025-03-23T19:00:06Z",
      "year": 2025,
      "month": 3,
      "duration_seconds": 491,
      "duration_formatted": "8m",
      "thumbnail_url": "https://i.ytimg.com/vi/qqzRDIKBOKI/mqdefault.jpg",
      "watch_url": "https://www.youtube.com/watch?v=qqzRDIKBOKI"
    },
    {
      "id": "dnfRkBTzK7g",
      "title": "Lezione del 21/03/2025",
      "published_at": "2025-03-21T19:30:13Z",
      "year": 2025,
      "month": 3,
      "duration_seconds": 3209,
      "duration_formatted": "53m",
      "thumbnail_url": "https://i9.ytimg.com/vi/dnfRkBTzK7g/mqdefault.jpg?sqp=CNjHncwG&rs=AOn4CLBgFs03psEYzj-zrvne0zOAOdeNEw",
      "watch_url": "https://www.youtube.com/watch?v=dnfRkBTzK7g"
    },
    {
      "id": "aVT9CmjipDI",
      "title": "Psicologia al Volante - Dinamiche Giovani",
      "published_at": "2025-03-21T13:00:06Z",
      "year": 2025,
      "month": 3,
      "duration_seconds": 274,
      "duration_formatted": "4m",
      "thumbnail_url": "https://i.ytimg.com/vi/aVT9CmjipDI/mqdefault.jpg",
      "watch_url": "https://www.youtube.com/watch?v=aVT9CmjipDI"
    },
    {
      "id": "aVT9CmjipDI",
      "title": "Psicologia al Volante - Dinamiche Giovani",
      "published_at": "2025-03-21T13:00:06Z",
      "year": 2025,
      "month": 3,
      "duration_seconds": 274,
      "duration_formatted": "4m",
      "thumbnail_url": "https://i.ytimg.com/vi/aVT9CmjipDI/mqdefault.jpg",
      "watch_url": "https://www.youtube.com/watch?v=aVT9CmjipDI"
    },
    {
      "id": "7eZoYJ8KMpU",
      "title": "Lezione del 20/03/2025",
      "published_at": "2025-03-20T19:31:46Z",
      "year": 2025,
      "month": 3,
      "duration_seconds": 3455,
      "duration_formatted": "57m",
      "thumbnail_url": "https://i9.ytimg.com/vi/7eZoYJ8KMpU/mqdefault.jpg?sqp=CNjHncwG&rs=AOn4CLCIYKa_b1wBPoXAqogbf9DPnIAxow",
      "watch_url": "https://www.youtube.com/watch?v=7eZoYJ8KMpU"
    },
    {
      "id": "4l-HXhIBSkM",
      "title": "Pillole di Teoria - RCA (Responsabilità Civile Auto)",
      "published_at": "2025-03-19T17:00:18Z",
      "year": 2025,
      "month": 3,
      "duration_seconds": 395,
      "duration_formatted": "6m",
      "thumbnail_url": "https://i.ytimg.com/vi/4l-HXhIBSkM/mqdefault.jpg",
      "watch_url": "https://www.youtube.com/watch?v=4l-HXhIBSkM"
    },
    {
      "id": "4l-HXhIBSkM",
      "title": "Pillole di Teoria - RCA (Responsabilità Civile Auto)",
      "published_at": "2025-03-19T17:00:18Z",
      "year": 2025,
      "month": 3,
      "duration_seconds": 395,
      "duration_formatted": "6m",
      "thumbnail_url": "https://i.ytimg.com/vi/4l-HXhIBSkM/mqdefault.jpg",
      "watch_url": "https://www.youtube.com/watch?v=4l-HXhIBSkM"
    },
    {
      "id": "sVH0eSzw1Ts",
      "title": "Lezione del 19/03/2025",
      "published_at": "2025-03-19T16:56:23Z",
      "year": 2025,
      "month": 3,
      "duration_seconds": 230,
      "duration_formatted": "3m",
      "thumbnail_url": "https://i9.ytimg.com/vi/sVH0eSzw1Ts/mqdefault.jpg?sqp=CNjHncwG&rs=AOn4CLDxz7wGeVmiVNoaQzc-rQK82USuWQ",
      "watch_url": "https://www.youtube.com/watch?v=sVH0eSzw1Ts"
    },
    {
      "id": "oA4zzQuDZN8",
      "title": "Lezione del 19/03/2025",
      "published_at": "2025-03-19T15:56:29Z",
      "year": 2025,
      "month": 3,
      "duration_seconds": 1308,
      "duration_formatted": "21m",
      "thumbnail_url": "https://i9.ytimg.com/vi/oA4zzQuDZN8/mqdefault.jpg?sqp=CNjHncwG&rs=AOn4CLDQ4sF318gt2BBam-oIdxhNHfJXZw",
      "watch_url": "https://www.youtube.com/watch?v=oA4zzQuDZN8"
    },
    {
      "id": "n0vDpNaarDY",
      "title": "Lezione del 18/03/2025",
      "published_at": "2025-03-18T16:04:21Z",
      "year": 2025,
      "month": 3,
      "duration_seconds": 2276,
      "duration_formatted": "37m",
      "thumbnail_url": "https://i9.ytimg.com/vi/n0vDpNaarDY/mqdefault.jpg?sqp=CNjHncwG&rs=AOn4CLAOSexbQj8q46mzjl2e_TC7K6lztw",
      "watch_url": "https://www.youtube.com/watch?v=n0vDpNaarDY"
    },
    {
      "id": "qQMxLIiA6tc",
      "title": "Pillole di Meccanica - Gli Pneumatici",
      "published_at": "2025-03-16T19:00:06Z",
      "year": 2025,
      "month": 3,
      "duration_seconds": 492,
      "duration_formatted": "8m",
      "thumbnail_url": "https://i.ytimg.com/vi/qQMxLIiA6tc/mqdefault.jpg",
      "watch_url": "https://www.youtube.com/watch?v=qQMxLIiA6tc"
    },
    {
      "id": "qQMxLIiA6tc",
      "title": "Pillole di Meccanica - Gli Pneumatici",
      "published_at": "2025-03-16T19:00:06Z",
      "year": 2025,
      "month": 3,
      "duration_seconds": 492,
      "duration_formatted": "8m",
      "thumbnail_url": "https://i.ytimg.com/vi/qQMxLIiA6tc/mqdefault.jpg",
      "watch_url": "https://www.youtube.com/watch?v=qQMxLIiA6tc"
    },
    {
      "id": "qLh2FIKP30o",
      "title": "Lezione del 14/03/2025",
      "published_at": "2025-03-14T19:33:31Z",
