{
    "last_updated":  "2026-02-11T04:31:05.836136Z",
    "total_videos":  1566,
    "total_hours":  1349,
    "videos":  [
                   {
                       "id":  "PDa0BX3FVNU",
                       "title":  "Lezione del 10/02/2026",
                       "published_at":  "2026-02-10T15:36:48Z",
                       "year":  2026,
                       "month":  2,
                       "duration_seconds":  0,
                       "duration_formatted":  "0s",
                       "thumbnail_url":  "/thumbnail-default.png",
                       "watch_url":  "https://www.youtube.com/watch?v=PDa0BX3FVNU"
                   },
                   {
                       "id":  "mdtRdzj-ybs",
                       "title":  "Lezione del 09/02/2026",
                       "published_at":  "2026-02-09T19:34:31Z",
                       "year":  2026,
                       "month":  2,
                       "duration_seconds":  3531,
                       "duration_formatted":  "58m",
                       "thumbnail_url":  "/thumbnail-default.png",
                       "watch_url":  "https://www.youtube.com/watch?v=mdtRdzj-ybs"
                   },
                   {
                       "id":  "nmNGju0HQkM",
                       "title":  "Lezione del 04/02/2026",
                       "published_at":  "2026-02-04T16:08:17Z",
                       "year":  2026,
                       "month":  2,
                       "duration_seconds":  2695,
                       "duration_formatted":  "44m",
                       "thumbnail_url":  "/thumbnail-default.png",
                       "watch_url":  "https://www.youtube.com/watch?v=nmNGju0HQkM"
                   },
                   {
                       "id":  "rPiWySWQgyQ",
                       "title":  "Lezione del 03/02/2026 Pomeriggio",
                       "published_at":  "2026-02-03T16:09:27Z",
                       "year":  2026,
                       "month":  2,
                       "duration_seconds":  2317,
                       "duration_formatted":  "38m",
                       "thumbnail_url":  "/thumbnail-default.png",
                       "watch_url":  "https://www.youtube.com/watch?v=rPiWySWQgyQ"
                   },
                   {
                       "id":  "H793yBRlLEc",
                       "title":  "Lezione del 02/02/2026",
                       "published_at":  "2026-02-02T19:36:57Z",
                       "year":  2026,
                       "month":  2,
                       "duration_seconds":  3721,
                       "duration_formatted":  "1h 2m",
                       "thumbnail_url":  "/thumbnail-default.png",
                       "watch_url":  "https://www.youtube.com/watch?v=H793yBRlLEc"
                   },
                   {
                       "id":  "YM54cxlqFYA",
                       "title":  "Lezione del 30/01/2026",
                       "published_at":  "2026-01-30T19:29:36Z",
                       "year":  2026,
                       "month":  1,
                       "duration_seconds":  3511,
                       "duration_formatted":  "58m",
                       "thumbnail_url":  "/thumbnail-default.png",
                       "watch_url":  "https://www.youtube.com/watch?v=YM54cxlqFYA"
                   },
                   {
                       "id":  "4Dbz5aHvG_8",
                       "title":  "Lezione del 29/01/2026",
                       "published_at":  "2026-01-29T19:34:24Z",
                       "year":  2026,
                       "month":  1,
                       "duration_seconds":  3452,
                       "duration_formatted":  "57m",
                       "thumbnail_url":  "/thumbnail-default.png",
                       "watch_url":  "https://www.youtube.com/watch?v=4Dbz5aHvG_8"
                   },
                   {
                       "id":  "jJ0E_dKB1sE",
                       "title":  "Lezione del 27/01/2026 Pomeriggio",
                       "published_at":  "2026-01-27T16:05:27Z",
                       "year":  2026,
                       "month":  1,
                       "duration_seconds":  1919,
                       "duration_formatted":  "31m",
                       "thumbnail_url":  "/thumbnail-default.png",
                       "watch_url":  "https://www.youtube.com/watch?v=jJ0E_dKB1sE"
                   },
                   {
                       "id":  "QFt6S-aV3Bc",
                       "title":  "Lezione del 26/01/2026",
                       "published_at":  "2026-01-26T19:32:52Z",
                       "year":  2026,
                       "month":  1,
                       "duration_seconds":  3345,
                       "duration_formatted":  "55m",
                       "thumbnail_url":  "/thumbnail-default.png",
                       "watch_url":  "https://www.youtube.com/watch?v=QFt6S-aV3Bc"
                   },
                   {
                       "id":  "xl5uN6G4XpM",
                       "title":  "Lezione del 23/01/2026",
                       "published_at":  "2026-01-23T19:24:40Z",
                       "year":  2026,
                       "month":  1,
                       "duration_seconds":  2964,
                       "duration_formatted":  "49m",
                       "thumbnail_url":  "/thumbnail-default.png",
                       "watch_url":  "https://www.youtube.com/watch?v=xl5uN6G4XpM"
                   },
                   {
                       "id":  "okni9pLkMZA",
                       "title":  "Lezione del 22/01/2026 (SOLO AUDIO)",
                       "published_at":  "2026-01-22T19:36:06Z",
                       "year":  2026,
                       "month":  1,
                       "duration_seconds":  3579,
                       "duration_formatted":  "59m",
                       "thumbnail_url":  "/thumbnail-default.png",
                       "watch_url":  "https://www.youtube.com/watch?v=okni9pLkMZA"
                   },
                   {
                       "id":  "Rt4j7D8BCyI",
                       "title":  "Lezione del 21/01/2026",
                       "published_at":  "2026-01-21T16:07:49Z",
                       "year":  2026,
                       "month":  1,
                       "duration_seconds":  2351,
                       "duration_formatted":  "39m",
                       "thumbnail_url":  "/thumbnail-default.png",
                       "watch_url":  "https://www.youtube.com/watch?v=Rt4j7D8BCyI"
                   },
                   {
                       "id":  "1Vvs28DQNj4",
                       "title":  "Lezione del 20/01/2026 Sera",
                       "published_at":  "2026-01-20T19:33:58Z",
                       "year":  2026,
                       "month":  1,
                       "duration_seconds":  3341,
                       "duration_formatted":  "55m",
                       "thumbnail_url":  "/thumbnail-default.png",
                       "watch_url":  "https://www.youtube.com/watch?v=1Vvs28DQNj4"
                   },
                   {
                       "id":  "pSthx-2zl1A",
                       "title":  "Lezione del 20/01/2026 Pomeriggio",
                       "published_at":  "2026-01-20T16:09:40Z",
                       "year":  2026,
                       "month":  1,
                       "duration_seconds":  2083,
                       "duration_formatted":  "34m",
                       "thumbnail_url":  "/thumbnail-default.png",
                       "watch_url":  "https://www.youtube.com/watch?v=pSthx-2zl1A"
                   },
                   {
                       "id":  "pBQQxNll6Fs",
                       "title":  "Lezione del 19/01/2026",
                       "published_at":  "2026-01-19T19:14:11Z",
                       "year":  2026,
                       "month":  1,
                       "duration_seconds":  2585,
                       "duration_formatted":  "43m",
                       "thumbnail_url":  "/thumbnail-default.png",
                       "watch_url":  "https://www.youtube.com/watch?v=pBQQxNll6Fs"
                   },
                   {
                       "id":  "s6vUYWnJSpo",
                       "title":  "Lezione del 16/01/2026",
                       "published_at":  "2026-01-16T19:21:43Z",
                       "year":  2026,
                       "month":  1,
                       "duration_seconds":  2794,
                       "duration_formatted":  "46m",
                       "thumbnail_url":  "/thumbnail-default.png",
                       "watch_url":  "https://www.youtube.com/watch?v=s6vUYWnJSpo"
                   },
                   {
                       "id":  "Z8SrlC2igd4",
                       "title":  "Lezione del 15/01/2026",
                       "published_at":  "2026-01-15T19:34:54Z",
                       "year":  2026,
                       "month":  1,
                       "duration_seconds":  3154,
                       "duration_formatted":  "52m",
                       "thumbnail_url":  "/thumbnail-default.png",
                       "watch_url":  "https://www.youtube.com/watch?v=Z8SrlC2igd4"
                   },
                   {
                       "id":  "D2vLeOlSuCQ",
                       "title":  "Lezione del 14/01/2026",
                       "published_at":  "2026-01-14T16:05:47Z",
                       "year":  2026,
                       "month":  1,
                       "duration_seconds":  2509,
                       "duration_formatted":  "41m",
                       "thumbnail_url":  "/thumbnail-default.png",
                       "watch_url":  "https://www.youtube.com/watch?v=D2vLeOlSuCQ"
                   },
                   {
                       "id":  "mixnX8ynYzc",
                       "title":  "Lezione del 13/01/2026 Pomeriggio",
                       "published_at":  "2026-01-13T16:06:50Z",
                       "year":  2026,
                       "month":  1,
                       "duration_seconds":  2004,
                       "duration_formatted":  "33m",
                       "thumbnail_url":  "/thumbnail-default.png",
                       "watch_url":  "https://www.youtube.com/watch?v=mixnX8ynYzc"
                   },
                   {
                       "id":  "zbW7DuzdwYw",
                       "title":  "Lezione del 12/01/2026",
                       "published_at":  "2026-01-12T19:34:28Z",
                       "year":  2026,
                       "month":  1,
                       "duration_seconds":  3319,
                       "duration_formatted":  "55m",
                       "thumbnail_url":  "/thumbnail-default.png",
                       "watch_url":  "https://www.youtube.com/watch?v=zbW7DuzdwYw"
                   },
                   {
                       "id":  "k5wOHmzHgOY",
                       "title":  "Lezione del 09/01/2026",
                       "published_at":  "2026-01-09T19:34:40Z",
                       "year":  2026,
                       "month":  1,
                       "duration_seconds":  3070,
                       "duration_formatted":  "51m",
                       "thumbnail_url":  "/thumbnail-default.png",
                       "watch_url":  "https://www.youtube.com/watch?v=k5wOHmzHgOY"
                   },
                   {
                       "id":  "o4L-7b4hOyc",
                       "title":  "Lezione del 08/01/2026",
                       "published_at":  "2026-01-08T19:36:06Z",
                       "year":  2026,
                       "month":  1,
                       "duration_seconds":  2365,
                       "duration_formatted":  "39m",
                       "thumbnail_url":  "/thumbnail-default.png",
                       "watch_url":  "https://www.youtube.com/watch?v=o4L-7b4hOyc"
                   },
                   {
                       "id":  "-0iuiRRgP7Y",
                       "title":  "Lezione del 07/01/2026",
                       "published_at":  "2026-01-07T16:08:58Z",
                       "year":  2026,
                       "month":  1,
                       "duration_seconds":  2282,
                       "duration_formatted":  "38m",
                       "thumbnail_url":  "/thumbnail-default.png",
                       "watch_url":  "https://www.youtube.com/watch?v=-0iuiRRgP7Y"
                   },
                   {
                       "id":  "dLaO5i6bjTg",
                       "title":  "ðŸŽ„ðŸŽ„ Lezione del 19/12/2025 ðŸŽ„ðŸŽ„ðŸŽ„",
                       "published_at":  "2025-12-19T19:33:43Z",
                       "year":  2025,
                       "month":  12,
                       "duration_seconds":  3323,
                       "duration_formatted":  "55m",
                       "thumbnail_url":  "/thumbnail-default.png",
                       "watch_url":  "https://www.youtube.com/watch?v=dLaO5i6bjTg"
                   },
                   {
                       "id":  "FKGk20fqO5U",
                       "title":  "Lezione del 18/12/2025",
                       "published_at":  "2025-12-18T19:36:37Z",
                       "year":  2025,
                       "month":  12,
                       "duration_seconds":  3167,
                       "duration_formatted":  "52m",
                       "thumbnail_url":  "/thumbnail-default.png",
                       "watch_url":  "https://www.youtube.com/watch?v=FKGk20fqO5U"
                   },
                   {
                       "id":  "Oz8Sljg8Zpk",
                       "title":  "Lezione del 17/12/2025",
                       "published_at":  "2025-12-17T16:10:00Z",
                       "year":  2025,
                       "month":  12,
                       "duration_seconds":  2623,
                       "duration_formatted":  "43m",
                       "thumbnail_url":  "/thumbnail-default.png",
                       "watch_url":  "https://www.youtube.com/watch?v=Oz8Sljg8Zpk"
                   },
                   {
                       "id":  "hnpYXodhu0U",
                       "title":  "Lezione del 16/12/2025 Sera",
                       "published_at":  "2025-12-16T19:24:39Z",
                       "year":  2025,
                       "month":  12,
                       "duration_seconds":  2916,
                       "duration_formatted":  "48m",
                       "thumbnail_url":  "/thumbnail-default.png",
                       "watch_url":  "https://www.youtube.com/watch?v=hnpYXodhu0U"
                   },
                   {
                       "id":  "XI1vPVry9iI",
                       "title":  "Lezione del 16/12/2025 Pomeriggio",
                       "published_at":  "2025-12-16T16:06:34Z",
                       "year":  2025,
                       "month":  12,
                       "duration_seconds":  2031,
                       "duration_formatted":  "33m",
                       "thumbnail_url":  "/thumbnail-default.png",
                       "watch_url":  "https://www.youtube.com/watch?v=XI1vPVry9iI"
                   },
                   {
                       "id":  "FhPtV2qiuV8",
                       "title":  "Lezione del 15/12/2025",
                       "published_at":  "2025-12-15T19:19:31Z",
                       "year":  2025,
                       "month":  12,
                       "duration_seconds":  2912,
                       "duration_formatted":  "48m",
                       "thumbnail_url":  "/thumbnail-default.png",
                       "watch_url":  "https://www.youtube.com/watch?v=FhPtV2qiuV8"
                   },
                   {
                       "id":  "G5QBrsU8mF0",
                       "title":  "Lezione del 12/12/2025",
                       "published_at":  "2025-12-12T19:31:59Z",
                       "year":  2025,
                       "month":  12,
                       "duration_seconds":  3656,
                       "duration_formatted":  "1h 0m",
                       "thumbnail_url":  "/thumbnail-default.png",
                       "watch_url":  "https://www.youtube.com/watch?v=G5QBrsU8mF0"
                   },
                   {
                       "id":  "tpGfSOCxbUw",
                       "title":  "Lezione del 10/12/2025",
                       "published_at":  "2025-12-10T16:08:35Z",
                       "year":  2025,
                       "month":  12,
                       "duration_seconds":  2587,
                       "duration_formatted":  "43m",
                       "thumbnail_url":  "/thumbnail-default.png",
                       "watch_url":  "https://www.youtube.com/watch?v=tpGfSOCxbUw"
                   },
                   {
                       "id":  "f9Cfedbq31I",
                       "title":  "Lezione del 09/12/2025",
                       "published_at":  "2025-12-09T19:22:51Z",
                       "year":  2025,
                       "month":  12,
                       "duration_seconds":  2767,
                       "duration_formatted":  "46m",
                       "thumbnail_url":  "/thumbnail-default.png",
                       "watch_url":  "https://www.youtube.com/watch?v=f9Cfedbq31I"
                   },
                   {
                       "id":  "gxIjepJ18Ps",
                       "title":  "Lezione del 04/12/2025",
                       "published_at":  "2025-12-05T19:20:25Z",
                       "year":  2025,
                       "month":  12,
                       "duration_seconds":  2835,
                       "duration_formatted":  "47m",
                       "thumbnail_url":  "/thumbnail-default.png",
                       "watch_url":  "https://www.youtube.com/watch?v=gxIjepJ18Ps"
                   },
                   {
                       "id":  "S2QHpa3o0VM",
                       "title":  "Lezione del 04/12/2025",
                       "published_at":  "2025-12-04T19:35:51Z",
                       "year":  2025,
                       "month":  12,
                       "duration_seconds":  3041,
                       "duration_formatted":  "50m",
                       "thumbnail_url":  "/thumbnail-default.png",
                       "watch_url":  "https://www.youtube.com/watch?v=S2QHpa3o0VM"
                   },
                   {
                       "id":  "ZAQOZneainQ",
                       "title":  "Lezione del 03/12/2025",
                       "published_at":  "2025-12-03T16:06:52Z",
                       "year":  2025,
                       "month":  12,
                       "duration_seconds":  1809,
                       "duration_formatted":  "30m",
                       "thumbnail_url":  "/thumbnail-default.png",
                       "watch_url":  "https://www.youtube.com/watch?v=ZAQOZneainQ"
                   },
                   {
                       "id":  "cVHYy02i7Fg",
                       "title":  "Lezione del 02/12/2025 Sera",
                       "published_at":  "2025-12-02T19:31:11Z",
                       "year":  2025,
                       "month":  12,
                       "duration_seconds":  3248,
                       "duration_formatted":  "54m",
                       "thumbnail_url":  "/thumbnail-default.png",
                       "watch_url":  "https://www.youtube.com/watch?v=cVHYy02i7Fg"
                   },
                   {
                       "id":  "JTcNK9vhcWI",
                       "title":  "Lezione del 02/12/2025 Pomeriggio",
                       "published_at":  "2025-12-02T16:08:50Z",
                       "year":  2025,
                       "month":  12,
                       "duration_seconds":  2161,
                       "duration_formatted":  "36m",
                       "thumbnail_url":  "/thumbnail-default.png",
                       "watch_url":  "https://www.youtube.com/watch?v=JTcNK9vhcWI"
                   },
                   {
                       "id":  "hMTjBv9ZV_w",
                       "title":  "Lezione del 01/12/2025 (SOLO AUDIO)",
                       "published_at":  "2025-12-01T19:33:53Z",
                       "year":  2025,
                       "month":  12,
                       "duration_seconds":  3901,
                       "duration_formatted":  "1h 5m",
                       "thumbnail_url":  "/thumbnail-default.png",
                       "watch_url":  "https://www.youtube.com/watch?v=hMTjBv9ZV_w"
                   },
                   {
                       "id":  "9DJ0uIfxKKo",
                       "title":  "Lezione del 28/11/2025",
                       "published_at":  "2025-11-28T19:34:30Z",
                       "year":  2025,
                       "month":  11,
                       "duration_seconds":  3317,
                       "duration_formatted":  "55m",
                       "thumbnail_url":  "/thumbnail-default.png",
                       "watch_url":  "https://www.youtube.com/watch?v=9DJ0uIfxKKo"
                   },
                   {
                       "id":  "rtvX-0AbeBU",
                       "title":  "Lezione del 27/11/2025",
                       "published_at":  "2025-11-27T19:34:11Z",
                       "year":  2025,
                       "month":  11,
                       "duration_seconds":  2830,
                       "duration_formatted":  "47m",
                       "thumbnail_url":  "/thumbnail-default.png",
                       "watch_url":  "https://www.youtube.com/watch?v=rtvX-0AbeBU"
                   },
                   {
                       "id":  "rHnF79DtSXk",
                       "title":  "Lezione del 25/11/2025 Sera",
                       "published_at":  "2025-11-25T19:25:28Z",
                       "year":  2025,
                       "month":  11,
                       "duration_seconds":  2925,
                       "duration_formatted":  "48m",
                       "thumbnail_url":  "/thumbnail-default.png",
                       "watch_url":  "https://www.youtube.com/watch?v=rHnF79DtSXk"
                   },
                   {
                       "id":  "23DQ3SFG83g",
                       "title":  "Lezione del 25/11/2025 Pomeriggio",
                       "published_at":  "2025-11-25T16:06:35Z",
                       "year":  2025,
                       "month":  11,
                       "duration_seconds":  2308,
                       "duration_formatted":  "38m",
                       "thumbnail_url":  "/thumbnail-default.png",
                       "watch_url":  "https://www.youtube.com/watch?v=23DQ3SFG83g"
                   },
                   {
                       "id":  "v0mQKRdnErQ",
                       "title":  "Lezione del 24/11/2025",
                       "published_at":  "2025-11-24T19:20:45Z",
                       "year":  2025,
                       "month":  11,
                       "duration_seconds":  2388,
                       "duration_formatted":  "39m",
                       "thumbnail_url":  "/thumbnail-default.png",
                       "watch_url":  "https://www.youtube.com/watch?v=v0mQKRdnErQ"
                   },
                   {
                       "id":  "pe1vfUQcLiM",
                       "title":  "Lezione del 21/11/2025",
                       "published_at":  "2025-11-21T19:35:14Z",
                       "year":  2025,
                       "month":  11,
                       "duration_seconds":  3579,
                       "duration_formatted":  "59m",
                       "thumbnail_url":  "/thumbnail-default.png",
                       "watch_url":  "https://www.youtube.com/watch?v=pe1vfUQcLiM"
                   },
                   {
                       "id":  "qarIwCNkkK4",
                       "title":  "Lezione del 20/11/2025",
                       "published_at":  "2025-11-20T19:33:58Z",
                       "year":  2025,
                       "month":  11,
                       "duration_seconds":  2922,
                       "duration_formatted":  "48m",
                       "thumbnail_url":  "/thumbnail-default.png",
                       "watch_url":  "https://www.youtube.com/watch?v=qarIwCNkkK4"
                   },
                   {
                       "id":  "y23FeuB3sb8",
                       "title":  "Lezione del 19/11/2025",
                       "published_at":  "2025-11-19T16:08:36Z",
                       "year":  2025,
                       "month":  11,
                       "duration_seconds":  1939,
                       "duration_formatted":  "32m",
                       "thumbnail_url":  "/thumbnail-default.png",
                       "watch_url":  "https://www.youtube.com/watch?v=y23FeuB3sb8"
                   },
                   {
                       "id":  "J1VCTs2oYME",
                       "title":  "Lezione del 18/11/2025 Sera",
                       "published_at":  "2025-11-18T19:34:08Z",
                       "year":  2025,
                       "month":  11,
                       "duration_seconds":  3205,
                       "duration_formatted":  "53m",
                       "thumbnail_url":  "/thumbnail-default.png",
                       "watch_url":  "https://www.youtube.com/watch?v=J1VCTs2oYME"
                   },
                   {
                       "id":  "Bgpar6IgRPQ",
                       "title":  "Lezione del 18/11/2025 Pomeriggio",
                       "published_at":  "2025-11-18T16:11:07Z",
                       "year":  2025,
                       "month":  11,
                       "duration_seconds":  2232,
                       "duration_formatted":  "37m",
                       "thumbnail_url":  "/thumbnail-default.png",
                       "watch_url":  "https://www.youtube.com/watch?v=Bgpar6IgRPQ"
                   },
                   {
                       "id":  "stWStJxJ-5A",
                       "title":  "Lezione del 17/11/2025",
                       "published_at":  "2025-11-17T19:33:40Z",
                       "year":  2025,
                       "month":  11,
                       "duration_seconds":  3097,
                       "duration_formatted":  "51m",
                       "thumbnail_url":  "/thumbnail-default.png",
                       "watch_url":  "https://www.youtube.com/watch?v=stWStJxJ-5A"
                   },
                   {
                       "id":  "aiv0jMSCsA0",
                       "title":  "Lezione del 14/11/2025",
                       "published_at":  "2025-11-14T19:34:43Z",
                       "year":  2025,
                       "month":  11,
                       "duration_seconds":  3214,
                       "duration_formatted":  "53m",
                       "thumbnail_url":  "/thumbnail-default.png",
                       "watch_url":  "https://www.youtube.com/watch?v=aiv0jMSCsA0"
                   },
                   {
                       "id":  "yCnzriccKjg",
                       "title":  "Lezione del 13/11/2025",
                       "published_at":  "2025-11-13T19:33:09Z",
                       "year":  2025,
                       "month":  11,
                       "duration_seconds":  3244,
                       "duration_formatted":  "54m",
                       "thumbnail_url":  "/thumbnail-default.png",
                       "watch_url":  "https://www.youtube.com/watch?v=yCnzriccKjg"
                   },
                   {
                       "id":  "mHlqXcATq4g",
                       "title":  "Lezione del 12/11/2025",
                       "published_at":  "2025-11-12T16:05:49Z",
                       "year":  2025,
                       "month":  11,
                       "duration_seconds":  2086,
                       "duration_formatted":  "34m",
                       "thumbnail_url":  "/thumbnail-default.png",
                       "watch_url":  "https://www.youtube.com/watch?v=mHlqXcATq4g"
                   },
                   {
                       "id":  "cM82ShhxLCo",
                       "title":  "Lezione del 11/11/2025 Sera",
                       "published_at":  "2025-11-11T19:32:39Z",
                       "year":  2025,
                       "month":  11,
                       "duration_seconds":  3494,
                       "duration_formatted":  "58m",
                       "thumbnail_url":  "/thumbnail-default.png",
                       "watch_url":  "https://www.youtube.com/watch?v=cM82ShhxLCo"
                   },
                   {
                       "id":  "gQ0DqrjF6co",
                       "title":  "Lezione del 11/11/2025 Pomeriggio",
                       "published_at":  "2025-11-11T16:05:55Z",
                       "year":  2025,
                       "month":  11,
                       "duration_seconds":  2118,
                       "duration_formatted":  "35m",
                       "thumbnail_url":  "/thumbnail-default.png",
                       "watch_url":  "https://www.youtube.com/watch?v=gQ0DqrjF6co"
                   },
                   {
                       "id":  "wpxy-yq5m8Y",
                       "title":  "Lezione del 10/11/2025",
                       "published_at":  "2025-11-10T19:33:57Z",
                       "year":  2025,
                       "month":  11,
                       "duration_seconds":  3149,
                       "duration_formatted":  "52m",
                       "thumbnail_url":  "/thumbnail-default.png",
                       "watch_url":  "https://www.youtube.com/watch?v=wpxy-yq5m8Y"
                   },
                   {
                       "id":  "gwOHWPAjmKM",
                       "title":  "Lezione del 07/11/2025",
                       "published_at":  "2025-11-07T19:34:22Z",
                       "year":  2025,
                       "month":  11,
                       "duration_seconds":  2910,
                       "duration_formatted":  "48m",
                       "thumbnail_url":  "/thumbnail-default.png",
                       "watch_url":  "https://www.youtube.com/watch?v=gwOHWPAjmKM"
                   },
                   {
                       "id":  "3cpTQ0sPba0",
                       "title":  "Lezione del 06/11/2025",
                       "published_at":  "2025-11-06T19:34:27Z",
                       "year":  2025,
                       "month":  11,
                       "duration_seconds":  3077,
                       "duration_formatted":  "51m",
                       "thumbnail_url":  "/thumbnail-default.png",
                       "watch_url":  "https://www.youtube.com/watch?v=3cpTQ0sPba0"
                   },
                   {
                       "id":  "mmdrGcj0AJM",
                       "title":  "Lezione del 05/11/2025",
                       "published_at":  "2025-11-05T16:06:04Z",
                       "year":  2025,
                       "month":  11,
                       "duration_seconds":  2266,
                       "duration_formatted":  "37m",
                       "thumbnail_url":  "/thumbnail-default.png",
                       "watch_url":  "https://www.youtube.com/watch?v=mmdrGcj0AJM"
                   },
                   {
                       "id":  "rNXgvHpQtMo",
                       "title":  "Lezione del 03/11/2025",
                       "published_at":  "2025-11-03T19:33:57Z",
                       "year":  2025,
                       "month":  11,
                       "duration_seconds":  3222,
                       "duration_formatted":  "53m",
                       "thumbnail_url":  "/thumbnail-default.png",
                       "watch_url":  "https://www.youtube.com/watch?v=rNXgvHpQtMo"
                   },
                   {
                       "id":  "teuky1a9BOo",
                       "title":  "Lezione del 31/10/2025",
                       "published_at":  "2025-10-31T19:11:56Z",
                       "year":  2025,
                       "month":  10,
                       "duration_seconds":  2120,
                       "duration_formatted":  "35m",
                       "thumbnail_url":  "/thumbnail-default.png",
                       "watch_url":  "https://www.youtube.com/watch?v=teuky1a9BOo"
                   },
                   {
                       "id":  "k1gxwhwEdpA",
                       "title":  "Lezione del 30/10/2025",
                       "published_at":  "2025-10-30T19:34:34Z",
                       "year":  2025,
                       "month":  10,
                       "duration_seconds":  2837,
                       "duration_formatted":  "47m",
                       "thumbnail_url":  "/thumbnail-default.png",
                       "watch_url":  "https://www.youtube.com/watch?v=k1gxwhwEdpA"
                   },
                   {
                       "id":  "ztZEZlDXbGQ",
                       "title":  "Lezione del 29/10/2025",
                       "published_at":  "2025-10-29T16:11:21Z",
                       "year":  2025,
                       "month":  10,
                       "duration_seconds":  2351,
                       "duration_formatted":  "39m",
                       "thumbnail_url":  "/thumbnail-default.png",
                       "watch_url":  "https://www.youtube.com/watch?v=ztZEZlDXbGQ"
                   },
                   {
                       "id":  "wxDcPskexSE",
                       "title":  "Lezione del 28/10/2025 Sera",
                       "published_at":  "2025-10-28T19:33:12Z",
                       "year":  2025,
                       "month":  10,
                       "duration_seconds":  3166,
                       "duration_formatted":  "52m",
                       "thumbnail_url":  "/thumbnail-default.png",
                       "watch_url":  "https://www.youtube.com/watch?v=wxDcPskexSE"
                   },
                   {
                       "id":  "7e2R0zB0dbQ",
                       "title":  "Lezione del 28/10/2025 Pomeriggio",
                       "published_at":  "2025-10-28T16:09:29Z",
                       "year":  2025,
                       "month":  10,
                       "duration_seconds":  2049,
                       "duration_formatted":  "34m",
                       "thumbnail_url":  "/thumbnail-default.png",
                       "watch_url":  "https://www.youtube.com/watch?v=7e2R0zB0dbQ"
                   },
                   {
                       "id":  "ok7cGedtiDs",
                       "title":  "Lezione del 27/10/2025",
                       "published_at":  "2025-10-27T19:32:31Z",
                       "year":  2025,
                       "month":  10,
                       "duration_seconds":  3010,
                       "duration_formatted":  "50m",
                       "thumbnail_url":  "/thumbnail-default.png",
                       "watch_url":  "https://www.youtube.com/watch?v=ok7cGedtiDs"
                   },
                   {
                       "id":  "TI5njb1jSxA",
                       "title":  "Lezione del 24/10/2025",
                       "published_at":  "2025-10-24T18:33:06Z",
                       "year":  2025,
                       "month":  10,
                       "duration_seconds":  3254,
                       "duration_formatted":  "54m",
                       "thumbnail_url":  "/thumbnail-default.png",
                       "watch_url":  "https://www.youtube.com/watch?v=TI5njb1jSxA"
                   },
                   {
                       "id":  "rWvD_wMLy3o",
                       "title":  "Lezione del 23/10/2025",
                       "published_at":  "2025-10-23T18:35:50Z",
                       "year":  2025,
                       "month":  10,
                       "duration_seconds":  2987,
                       "duration_formatted":  "49m",
                       "thumbnail_url":  "/thumbnail-default.png",
                       "watch_url":  "https://www.youtube.com/watch?v=rWvD_wMLy3o"
                   },
                   {
                       "id":  "lK9qWQLOk3o",
                       "title":  "Lezione del 22/10/2025",
                       "published_at":  "2025-10-22T15:06:14Z",
                       "year":  2025,
                       "month":  10,
                       "duration_seconds":  2363,
                       "duration_formatted":  "39m",
                       "thumbnail_url":  "/thumbnail-default.png",
                       "watch_url":  "https://www.youtube.com/watch?v=lK9qWQLOk3o"
                   },
                   {
                       "id":  "owi7KaN7D78",
                       "title":  "Lezione del 21/10/2025",
                       "published_at":  "2025-10-21T18:33:49Z",
                       "year":  2025,
                       "month":  10,
                       "duration_seconds":  3510,
                       "duration_formatted":  "58m",
                       "thumbnail_url":  "/thumbnail-default.png",
                       "watch_url":  "https://www.youtube.com/watch?v=owi7KaN7D78"
                   },
                   {
                       "id":  "-A7wLp7N650",
                       "title":  "Lezione del 20/10/2025",
                       "published_at":  "2025-10-20T18:33:34Z",
                       "year":  2025,
                       "month":  10,
                       "duration_seconds":  3192,
                       "duration_formatted":  "53m",
                       "thumbnail_url":  "/thumbnail-default.png",
                       "watch_url":  "https://www.youtube.com/watch?v=-A7wLp7N650"
                   },
                   {
                       "id":  "jUUwV4d0aK4",
                       "title":  "Lezione del 17/10/2025",
                       "published_at":  "2025-10-17T18:34:11Z",
                       "year":  2025,
                       "month":  10,
                       "duration_seconds":  2900,
                       "duration_formatted":  "48m",
                       "thumbnail_url":  "/thumbnail-default.png",
                       "watch_url":  "https://www.youtube.com/watch?v=jUUwV4d0aK4"
                   },
                   {
                       "id":  "PYPJzlY-IF8",
                       "title":  "Lezione del 16/10/2025",
                       "published_at":  "2025-10-16T18:35:36Z",
                       "year":  2025,
                       "month":  10,
                       "duration_seconds":  3132,
                       "duration_formatted":  "52m",
                       "thumbnail_url":  "/thumbnail-default.png",
                       "watch_url":  "https://www.youtube.com/watch?v=PYPJzlY-IF8"
                   },
                   {
                       "id":  "FOCSb_Je9DU",
                       "title":  "Lezione del 15/10/2025",
                       "published_at":  "2025-10-15T15:43:10Z",
                       "year":  2025,
                       "month":  10,
                       "duration_seconds":  2192,
                       "duration_formatted":  "36m",
                       "thumbnail_url":  "/thumbnail-default.png",
                       "watch_url":  "https://www.youtube.com/watch?v=FOCSb_Je9DU"
                   },
                   {
                       "id":  "Ka2XBXwAyxg",
                       "title":  "Lezione del 14/10/2025",
                       "published_at":  "2025-10-14T18:33:07Z",
                       "year":  2025,
                       "month":  10,
                       "duration_seconds":  3140,
                       "duration_formatted":  "52m",
                       "thumbnail_url":  "/thumbnail-default.png",
                       "watch_url":  "https://www.youtube.com/watch?v=Ka2XBXwAyxg"
                   },
                   {
                       "id":  "aOWmtkXsCI4",
                       "title":  "Lezione del 13/10/2025",
                       "published_at":  "2025-10-13T18:35:04Z",
                       "year":  2025,
                       "month":  10,
                       "duration_seconds":  3406,
                       "duration_formatted":  "56m",
                       "thumbnail_url":  "/thumbnail-default.png",
                       "watch_url":  "https://www.youtube.com/watch?v=aOWmtkXsCI4"
                   },
                   {
                       "id":  "AGHwUIyJSuU",
                       "title":  "Lezione del 10/10/2025",
                       "published_at":  "2025-10-10T18:34:44Z",
                       "year":  2025,
                       "month":  10,
                       "duration_seconds":  3405,
                       "duration_formatted":  "56m",
                       "thumbnail_url":  "/thumbnail-default.png",
                       "watch_url":  "https://www.youtube.com/watch?v=AGHwUIyJSuU"
                   },
                   {
                       "id":  "gFgHdqzZu4g",
                       "title":  "Lezione del 09/10/2025",
                       "published_at":  "2025-10-09T18:35:05Z",
                       "year":  2025,
                       "month":  10,
                       "duration_seconds":  3072,
                       "duration_formatted":  "51m",
                       "thumbnail_url":  "/thumbnail-default.png",
                       "watch_url":  "https://www.youtube.com/watch?v=gFgHdqzZu4g"
                   },
                   {
                       "id":  "MBy5E2pJHok",
                       "title":  "Lezione del 08/10/2025",
                       "published_at":  "2025-10-08T15:08:53Z",
                       "year":  2025,
                       "month":  10,
                       "duration_seconds":  2091,
                       "duration_formatted":  "34m",
                       "thumbnail_url":  "/thumbnail-default.png",
                       "watch_url":  "https://www.youtube.com/watch?v=MBy5E2pJHok"
                   },
                   {
                       "id":  "7yMb_k6cCHQ",
                       "title":  "Lezione del 07/10/2025 Sera",
                       "published_at":  "2025-10-07T18:36:42Z",
                       "year":  2025,
                       "month":  10,
                       "duration_seconds":  3637,
                       "duration_formatted":  "1h 0m",
                       "thumbnail_url":  "/thumbnail-default.png",
                       "watch_url":  "https://www.youtube.com/watch?v=7yMb_k6cCHQ"
                   },
                   {
                       "id":  "7dMOG-qSLEw",
                       "title":  "Lezione del 07/10/2025 Pomeriggio",
                       "published_at":  "2025-10-07T15:09:14Z",
                       "year":  2025,
                       "month":  10,
                       "duration_seconds":  2648,
                       "duration_formatted":  "44m",
                       "thumbnail_url":  "/thumbnail-default.png",
                       "watch_url":  "https://www.youtube.com/watch?v=7dMOG-qSLEw"
                   },
                   {
                       "id":  "H_1TxpYpBSw",
                       "title":  "Lezione del 06/10/2025",
                       "published_at":  "2025-10-06T18:33:42Z",
                       "year":  2025,
                       "month":  10,
                       "duration_seconds":  3136,
                       "duration_formatted":  "52m",
                       "thumbnail_url":  "/thumbnail-default.png",
                       "watch_url":  "https://www.youtube.com/watch?v=H_1TxpYpBSw"
                   },
                   {
                       "id":  "0AzeD9kJY1o",
                       "title":  "Lezione del 03/10/2025",
                       "published_at":  "2025-10-03T18:33:26Z",
                       "year":  2025,
                       "month":  10,
                       "duration_seconds":  3097,
                       "duration_formatted":  "51m",
                       "thumbnail_url":  "/thumbnail-default.png",
                       "watch_url":  "https://www.youtube.com/watch?v=0AzeD9kJY1o"
                   },
                   {
                       "id":  "SWV_vp2h8_Q",
                       "title":  "Lezione del 02/10/2025",
                       "published_at":  "2025-10-02T18:36:38Z",
                       "year":  2025,
                       "month":  10,
                       "duration_seconds":  3164,
                       "duration_formatted":  "52m",
                       "thumbnail_url":  "/thumbnail-default.png",
                       "watch_url":  "https://www.youtube.com/watch?v=SWV_vp2h8_Q"
                   },
                   {
                       "id":  "Y-xJbuVpe8Q",
                       "title":  "Lezione del 01/10/2025",
                       "published_at":  "2025-10-01T15:11:41Z",
                       "year":  2025,
                       "month":  10,
                       "duration_seconds":  2407,
                       "duration_formatted":  "40m",
                       "thumbnail_url":  "/thumbnail-default.png",
                       "watch_url":  "https://www.youtube.com/watch?v=Y-xJbuVpe8Q"
                   },
                   {
                       "id":  "mFMtLSdZI9I",
                       "title":  "Lezione del 30/09/2025 Sera",
                       "published_at":  "2025-09-30T18:34:10Z",
                       "year":  2025,
                       "month":  9,
                       "duration_seconds":  3359,
                       "duration_formatted":  "55m",
                       "thumbnail_url":  "/thumbnail-default.png",
                       "watch_url":  "https://www.youtube.com/watch?v=mFMtLSdZI9I"
                   },
                   {
                       "id":  "H58cx2FjVwA",
                       "title":  "Lezione del 30/09/2025 Pomeriggio",
                       "published_at":  "2025-09-30T15:08:21Z",
                       "year":  2025,
                       "month":  9,
                       "duration_seconds":  2063,
                       "duration_formatted":  "34m",
                       "thumbnail_url":  "/thumbnail-default.png",
                       "watch_url":  "https://www.youtube.com/watch?v=H58cx2FjVwA"
                   },
                   {
                       "id":  "c2iwAjTqOQo",
                       "title":  "Lezione del 29/09/2025",
                       "published_at":  "2025-09-29T18:33:29Z",
                       "year":  2025,
                       "month":  9,
                       "duration_seconds":  3316,
                       "duration_formatted":  "55m",
                       "thumbnail_url":  "/thumbnail-default.png",
                       "watch_url":  "https://www.youtube.com/watch?v=c2iwAjTqOQo"
                   },
                   {
                       "id":  "-41QbBCuSU4",
                       "title":  "Lezione del 26/09/2025",
                       "published_at":  "2025-09-26T18:32:41Z",
                       "year":  2025,
                       "month":  9,
                       "duration_seconds":  3231,
                       "duration_formatted":  "53m",
                       "thumbnail_url":  "/thumbnail-default.png",
                       "watch_url":  "https://www.youtube.com/watch?v=-41QbBCuSU4"
                   },
                   {
                       "id":  "UuwpuHrZ2JI",
                       "title":  "Lezione del 25/09/2025",
                       "published_at":  "2025-09-25T18:36:44Z",
                       "year":  2025,
                       "month":  9,
                       "duration_seconds":  3236,
                       "duration_formatted":  "53m",
                       "thumbnail_url":  "/thumbnail-default.png",
                       "watch_url":  "https://www.youtube.com/watch?v=UuwpuHrZ2JI"
                   },
                   {
                       "id":  "K7M6H2X7ABk",
                       "title":  "Lezione del 24/09/2025",
                       "published_at":  "2025-09-24T15:10:32Z",
                       "year":  2025,
                       "month":  9,
                       "duration_seconds":  2395,
                       "duration_formatted":  "39m",
                       "thumbnail_url":  "/thumbnail-default.png",
                       "watch_url":  "https://www.youtube.com/watch?v=K7M6H2X7ABk"
                   },
                   {
                       "id":  "ntrgHGffhwA",
                       "title":  "Lezione del 23/09/2025",
                       "published_at":  "2025-09-23T18:34:37Z",
                       "year":  2025,
                       "month":  9,
                       "duration_seconds":  3479,
                       "duration_formatted":  "57m",
                       "thumbnail_url":  "/thumbnail-default.png",
                       "watch_url":  "https://www.youtube.com/watch?v=ntrgHGffhwA"
                   },
                   {
                       "id":  "_omOGcnxZAM",
                       "title":  "Lezione del 22/09/2025",
                       "published_at":  "2025-09-22T18:36:23Z",
                       "year":  2025,
                       "month":  9,
                       "duration_seconds":  3020,
                       "duration_formatted":  "50m",
                       "thumbnail_url":  "/thumbnail-default.png",
                       "watch_url":  "https://www.youtube.com/watch?v=_omOGcnxZAM"
                   },
                   {
                       "id":  "qtnMti_9KU4",
                       "title":  "Lezione del 18/09/2025",
                       "published_at":  "2025-09-19T18:33:35Z",
                       "year":  2025,
                       "month":  9,
                       "duration_seconds":  3071,
                       "duration_formatted":  "51m",
                       "thumbnail_url":  "/thumbnail-default.png",
                       "watch_url":  "https://www.youtube.com/watch?v=qtnMti_9KU4"
                   },
                   {
                       "id":  "Sm37LpYTEFA",
                       "title":  "Lezione del 18/09/2025",
                       "published_at":  "2025-09-18T18:34:40Z",
                       "year":  2025,
                       "month":  9,
                       "duration_seconds":  3182,
                       "duration_formatted":  "53m",
                       "thumbnail_url":  "/thumbnail-default.png",
                       "watch_url":  "https://www.youtube.com/watch?v=Sm37LpYTEFA"
                   },
                   {
                       "id":  "F88DTJYu2wA",
                       "title":  "Lezione del 17/09/2025",
                       "published_at":  "2025-09-17T15:11:57Z",
                       "year":  2025,
                       "month":  9,
                       "duration_seconds":  2684,
                       "duration_formatted":  "44m",
                       "thumbnail_url":  "/thumbnail-default.png",
                       "watch_url":  "https://www.youtube.com/watch?v=F88DTJYu2wA"
                   },
                   {
                       "id":  "SO1ptOJROxY",
                       "title":  "Lezione del 16/09/2025 Sera",
                       "published_at":  "2025-09-16T18:34:25Z",
                       "year":  2025,
                       "month":  9,
                       "duration_seconds":  3177,
                       "duration_formatted":  "52m",
                       "thumbnail_url":  "/thumbnail-default.png",
                       "watch_url":  "https://www.youtube.com/watch?v=SO1ptOJROxY"
                   },
                   {
                       "id":  "EkpPP03mJJM",
                       "title":  "Lezione del 16/09/2025 Pomeriggio",
                       "published_at":  "2025-09-16T15:04:59Z",
                       "year":  2025,
                       "month":  9,
                       "duration_seconds":  2333,
                       "duration_formatted":  "38m",
                       "thumbnail_url":  "/thumbnail-default.png",
                       "watch_url":  "https://www.youtube.com/watch?v=EkpPP03mJJM"
                   },
                   {
                       "id":  "8JFlyR1GIMo",
                       "title":  "Lezione del 15/09/2025",
                       "published_at":  "2025-09-15T18:33:54Z",
                       "year":  2025,
                       "month":  9,
                       "duration_seconds":  3359,
                       "duration_formatted":  "55m",
                       "thumbnail_url":  "/thumbnail-default.png",
                       "watch_url":  "https://www.youtube.com/watch?v=8JFlyR1GIMo"
                   },
                   {
                       "id":  "GBrAnlZj7g0",
                       "title":  "Lezione del 12/09/2025",
                       "published_at":  "2025-09-12T18:33:18Z",
                       "year":  2025,
                       "month":  9,
                       "duration_seconds":  3392,
                       "duration_formatted":  "56m",
                       "thumbnail_url":  "/thumbnail-default.png",
                       "watch_url":  "https://www.youtube.com/watch?v=GBrAnlZj7g0"
                   },
                   {
                       "id":  "NXe2mcwsp1k",
                       "title":  "Lezione del 11/09/2025",
                       "published_at":  "2025-09-11T18:35:07Z",
                       "year":  2025,
                       "month":  9,
                       "duration_seconds":  3005,
                       "duration_formatted":  "50m",
                       "thumbnail_url":  "/thumbnail-default.png",
                       "watch_url":  "https://www.youtube.com/watch?v=NXe2mcwsp1k"
                   },
                   {
                       "id":  "a0MPGnn1sSs",
                       "title":  "Lezione del 09/09/2025",
                       "published_at":  "2025-09-09T18:33:16Z",
                       "year":  2025,
                       "month":  9,
                       "duration_seconds":  3174,
                       "duration_formatted":  "52m",
                       "thumbnail_url":  "/thumbnail-default.png",
                       "watch_url":  "https://www.youtube.com/watch?v=a0MPGnn1sSs"
                   },
                   {
                       "id":  "eNne2Z-RFCM",
                       "title":  "Lezione del 08/09/2025",
                       "published_at":  "2025-09-08T18:34:54Z",
                       "year":  2025,
                       "month":  9,
                       "duration_seconds":  3592,
                       "duration_formatted":  "59m",
                       "thumbnail_url":  "/thumbnail-default.png",
                       "watch_url":  "https://www.youtube.com/watch?v=eNne2Z-RFCM"
                   },
                   {
                       "id":  "6CSL2AG6_GE",
                       "title":  "Lezione del 04/09/2025",
                       "published_at":  "2025-09-04T18:35:30Z",
                       "year":  2025,
                       "month":  9,
                       "duration_seconds":  3111,
                       "duration_formatted":  "51m",
                       "thumbnail_url":  "/thumbnail-default.png",
                       "watch_url":  "https://www.youtube.com/watch?v=6CSL2AG6_GE"
                   },
                   {
                       "id":  "HV9OXj7VQkw",
                       "title":  "Lezione del 02/09/2025 Sera",
                       "published_at":  "2025-09-02T18:33:44Z",
                       "year":  2025,
                       "month":  9,
                       "duration_seconds":  3287,
                       "duration_formatted":  "54m",
                       "thumbnail_url":  "/thumbnail-default.png",
                       "watch_url":  "https://www.youtube.com/watch?v=HV9OXj7VQkw"
                   },
                   {
                       "id":  "9D8mlNqYI-M",
                       "title":  "Lezione del 02/09/2025 Pomeriggio",
                       "published_at":  "2025-09-02T15:14:11Z",
                       "year":  2025,
                       "month":  9,
                       "duration_seconds":  2397,
                       "duration_formatted":  "39m",
                       "thumbnail_url":  "/thumbnail-default.png",
                       "watch_url":  "https://www.youtube.com/watch?v=9D8mlNqYI-M"
                   },
                   {
                       "id":  "og9ngIp7zPw",
                       "title":  "Lezione del 01/09/2025",
                       "published_at":  "2025-09-01T18:34:27Z",
                       "year":  2025,
                       "month":  9,
                       "duration_seconds":  3173,
                       "duration_formatted":  "52m",
                       "thumbnail_url":  "/thumbnail-default.png",
                       "watch_url":  "https://www.youtube.com/watch?v=og9ngIp7zPw"
                   },
                   {
                       "id":  "GqJ-0dd87os",
                       "title":  "Pillole di Guida - Il Servosterzo",
                       "published_at":  "2025-08-31T16:00:06Z",
                       "year":  2025,
                       "month":  8,
                       "duration_seconds":  625,
                       "duration_formatted":  "10m",
                       "thumbnail_url":  "/thumbnail-default.png",
                       "watch_url":  "https://www.youtube.com/watch?v=GqJ-0dd87os"
                   },
                   {
                       "id":  "RIs21JjsoH8",
                       "title":  "Lezione del 29/08/2025",
                       "published_at":  "2025-08-29T18:28:12Z",
                       "year":  2025,
                       "month":  8,
                       "duration_seconds":  3073,
                       "duration_formatted":  "51m",
                       "thumbnail_url":  "/thumbnail-default.png",
                       "watch_url":  "https://www.youtube.com/watch?v=RIs21JjsoH8"
                   },
                   {
                       "id":  "y4GkQdVxafw",
                       "title":  "Lezione del 28/08/2025",
                       "published_at":  "2025-08-28T18:36:42Z",
                       "year":  2025,
                       "month":  8,
                       "duration_seconds":  2744,
                       "duration_formatted":  "45m",
                       "thumbnail_url":  "/thumbnail-default.png",
                       "watch_url":  "https://www.youtube.com/watch?v=y4GkQdVxafw"
                   },
                   {
                       "id":  "yYjpCc-IGFY",
                       "title":  "L\u0027 Avvocato Risponde - Premio e Massimale",
                       "published_at":  "2025-08-27T16:00:06Z",
                       "year":  2025,
                       "month":  8,
                       "duration_seconds":  831,
                       "duration_formatted":  "13m",
                       "thumbnail_url":  "/thumbnail-default.png",
                       "watch_url":  "https://www.youtube.com/watch?v=yYjpCc-IGFY"
                   },
                   {
                       "id":  "9TKIWEcf7cI",
                       "title":  "Lezione del 27/08/2025",
                       "published_at":  "2025-08-27T15:09:24Z",
                       "year":  2025,
                       "month":  8,
                       "duration_seconds":  2317,
                       "duration_formatted":  "38m",
                       "thumbnail_url":  "/thumbnail-default.png",
                       "watch_url":  "https://www.youtube.com/watch?v=9TKIWEcf7cI"
                   },
                   {
                       "id":  "6A6PGOJHxcw",
                       "title":  "Lezione del 26/08/2025 Pomeriggio",
                       "published_at":  "2025-08-26T15:05:24Z",
                       "year":  2025,
                       "month":  8,
                       "duration_seconds":  2105,
                       "duration_formatted":  "35m",
                       "thumbnail_url":  "/thumbnail-default.png",
                       "watch_url":  "https://www.youtube.com/watch?v=6A6PGOJHxcw"
                   },
                   {
                       "id":  "lW1_rhzLE-c",
                       "title":  "Lezione del 25/08/2025",
                       "published_at":  "2025-08-25T18:34:30Z",
                       "year":  2025,
                       "month":  8,
                       "duration_seconds":  3495,
                       "duration_formatted":  "58m",
                       "thumbnail_url":  "/thumbnail-default.png",
                       "watch_url":  "https://www.youtube.com/watch?v=lW1_rhzLE-c"
                   },
                   {
                       "id":  "aOq3DmUESY4",
                       "title":  "Pillole di Meccanica - Il Turbocompressore",
                       "published_at":  "2025-08-20T16:00:06Z",
                       "year":  2025,
                       "month":  8,
                       "duration_seconds":  605,
                       "duration_formatted":  "10m",
                       "thumbnail_url":  "/thumbnail-default.png",
                       "watch_url":  "https://www.youtube.com/watch?v=aOq3DmUESY4"
                   },
                   {
                       "id":  "GOyNf_PHDhs",
                       "title":  "L\u0027 Ingegnere Insegna - Le Sospensioni",
                       "published_at":  "2025-08-15T16:00:06Z",
                       "year":  2025,
                       "month":  8,
                       "duration_seconds":  609,
                       "duration_formatted":  "10m",
                       "thumbnail_url":  "/thumbnail-default.png",
                       "watch_url":  "https://www.youtube.com/watch?v=GOyNf_PHDhs"
                   },
                   {
                       "id":  "2LppnuNUdDU",
                       "title":  "Pillole di Teoria - Le Luci",
                       "published_at":  "2025-08-10T16:00:06Z",
                       "year":  2025,
                       "month":  8,
                       "duration_seconds":  990,
                       "duration_formatted":  "16m",
                       "thumbnail_url":  "/thumbnail-default.png",
                       "watch_url":  "https://www.youtube.com/watch?v=2LppnuNUdDU"
                   },
                   {
                       "id":  "HQfh_CPR9wM",
                       "title":  "Ci vediamo il 25 Agosto!!! ðŸ–ï¸",
                       "published_at":  "2025-08-08T17:30:29Z",
                       "year":  2025,
                       "month":  8,
                       "duration_seconds":  395,
                       "duration_formatted":  "6m",
                       "thumbnail_url":  "/thumbnail-default.png",
                       "watch_url":  "https://www.youtube.com/watch?v=HQfh_CPR9wM"
                   },
                   {
                       "id":  "pN8t3OwyOKo",
                       "title":  "Lezione del 07/08/2025",
                       "published_at":  "2025-08-07T18:34:41Z",
                       "year":  2025,
                       "month":  8,
                       "duration_seconds":  3258,
                       "duration_formatted":  "54m",
                       "thumbnail_url":  "/thumbnail-default.png",
                       "watch_url":  "https://www.youtube.com/watch?v=pN8t3OwyOKo"
                   },
                   {
                       "id":  "zUnVCe9C_dE",
                       "title":  "Lezione del 06/08/2025",
                       "published_at":  "2025-08-06T15:08:38Z",
                       "year":  2025,
                       "month":  8,
                       "duration_seconds":  2424,
                       "duration_formatted":  "40m",
                       "thumbnail_url":  "/thumbnail-default.png",
                       "watch_url":  "https://www.youtube.com/watch?v=zUnVCe9C_dE"
                   },
                   {
                       "id":  "KecuvgpFNXk",
                       "title":  "Lezione del 05/08/2025 Sera",
                       "published_at":  "2025-08-05T18:34:27Z",
                       "year":  2025,
                       "month":  8,
                       "duration_seconds":  3082,
                       "duration_formatted":  "51m",
                       "thumbnail_url":  "/thumbnail-default.png",
                       "watch_url":  "https://www.youtube.com/watch?v=KecuvgpFNXk"
                   },
                   {
                       "id":  "xsbiRAZ0XNg",
                       "title":  "Lezione del 05/08/2025 Pomeriggio",
                       "published_at":  "2025-08-05T15:05:02Z",
                       "year":  2025,
                       "month":  8,
                       "duration_seconds":  1977,
                       "duration_formatted":  "32m",
                       "thumbnail_url":  "/thumbnail-default.png",
                       "watch_url":  "https://www.youtube.com/watch?v=xsbiRAZ0XNg"
                   },
                   {
                       "id":  "A46jWZHRCco",
                       "title":  "Lezione del 04/08/2025",
                       "published_at":  "2025-08-04T18:35:10Z",
                       "year":  2025,
                       "month":  8,
                       "duration_seconds":  3231,
                       "duration_formatted":  "53m",
                       "thumbnail_url":  "/thumbnail-default.png",
                       "watch_url":  "https://www.youtube.com/watch?v=A46jWZHRCco"
                   },
                   {
                       "id":  "SraadRph-AU",
                       "title":  "Lezione del 30/07/2025",
                       "published_at":  "2025-07-30T15:09:38Z",
                       "year":  2025,
                       "month":  7,
                       "duration_seconds":  2008,
                       "duration_formatted":  "33m",
                       "thumbnail_url":  "/thumbnail-default.png",
                       "watch_url":  "https://www.youtube.com/watch?v=SraadRph-AU"
                   },
                   {
                       "id":  "PMuymQ1EeHM",
                       "title":  "Lezione del 29/07/2025 Sera",
                       "published_at":  "2025-07-29T18:32:46Z",
                       "year":  2025,
                       "month":  7,
                       "duration_seconds":  3639,
                       "duration_formatted":  "1h 0m",
                       "thumbnail_url":  "/thumbnail-default.png",
                       "watch_url":  "https://www.youtube.com/watch?v=PMuymQ1EeHM"
                   },
                   {
                       "id":  "fTKpxDpO4Vg",
                       "title":  "Lezione del 29/07/2025 Pomeriggio",
                       "published_at":  "2025-07-29T15:05:47Z",
                       "year":  2025,
                       "month":  7,
                       "duration_seconds":  2203,
                       "duration_formatted":  "36m",
                       "thumbnail_url":  "/thumbnail-default.png",
                       "watch_url":  "https://www.youtube.com/watch?v=fTKpxDpO4Vg"
                   },
                   {
                       "id":  "TxS2AY4RPok",
                       "title":  "Lezione del 28/07/2025",
                       "published_at":  "2025-07-28T18:33:52Z",
                       "year":  2025,
                       "month":  7,
                       "duration_seconds":  3126,
                       "duration_formatted":  "52m",
                       "thumbnail_url":  "/thumbnail-default.png",
                       "watch_url":  "https://www.youtube.com/watch?v=TxS2AY4RPok"
                   },
                   {
                       "id":  "9C4Xc2ZcD0U",
                       "title":  "Lezione del 25/07/2025",
                       "published_at":  "2025-07-25T18:35:27Z",
                       "year":  2025,
                       "month":  7,
                       "duration_seconds":  3529,
                       "duration_formatted":  "58m",
                       "thumbnail_url":  "/thumbnail-default.png",
                       "watch_url":  "https://www.youtube.com/watch?v=9C4Xc2ZcD0U"
                   },
                   {
                       "id":  "YUyo69Q_2wE",
                       "title":  "Lezione del 24/07/2025",
                       "published_at":  "2025-07-24T18:36:11Z",
                       "year":  2025,
                       "month":  7,
                       "duration_seconds":  3325,
                       "duration_formatted":  "55m",
                       "thumbnail_url":  "/thumbnail-default.png",
                       "watch_url":  "https://www.youtube.com/watch?v=YUyo69Q_2wE"
                   },
                   {
                       "id":  "Dmn6gU3aDTU",
                       "title":  "Lezione del 23/07/2025",
                       "published_at":  "2025-07-23T15:10:19Z",
                       "year":  2025,
                       "month":  7,
                       "duration_seconds":  2307,
                       "duration_formatted":  "38m",
                       "thumbnail_url":  "/thumbnail-default.png",
                       "watch_url":  "https://www.youtube.com/watch?v=Dmn6gU3aDTU"
                   },
                   {
                       "id":  "m9INmBABjlI",
                       "title":  "Lezione del 22/07/2025",
                       "published_at":  "2025-07-22T18:35:00Z",
                       "year":  2025,
                       "month":  7,
                       "duration_seconds":  3563,
                       "duration_formatted":  "59m",
                       "thumbnail_url":  "/thumbnail-default.png",
                       "watch_url":  "https://www.youtube.com/watch?v=m9INmBABjlI"
                   },
                   {
                       "id":  "vnR9bg2G4ic",
                       "title":  "Lezione del 21/07/2025",
                       "published_at":  "2025-07-21T18:32:59Z",
                       "year":  2025,
                       "month":  7,
                       "duration_seconds":  3442,
                       "duration_formatted":  "57m",
                       "thumbnail_url":  "/thumbnail-default.png",
                       "watch_url":  "https://www.youtube.com/watch?v=vnR9bg2G4ic"
                   },
                   {
                       "id":  "DfrVqmAuZY4",
                       "title":  "Lezione del 18/07/2025",
                       "published_at":  "2025-07-18T18:34:17Z",
                       "year":  2025,
                       "month":  7,
                       "duration_seconds":  3304,
                       "duration_formatted":  "55m",
                       "thumbnail_url":  "/thumbnail-default.png",
                       "watch_url":  "https://www.youtube.com/watch?v=DfrVqmAuZY4"
                   },
                   {
                       "id":  "K_iOZN0L2oA",
                       "title":  "Lezione del 17/07/2025",
                       "published_at":  "2025-07-17T18:36:22Z",
                       "year":  2025,
                       "month":  7,
                       "duration_seconds":  3302,
                       "duration_formatted":  "55m",
                       "thumbnail_url":  "/thumbnail-default.png",
                       "watch_url":  "https://www.youtube.com/watch?v=K_iOZN0L2oA"
                   },
                   {
                       "id":  "9t72-0R8OgE",
                       "title":  "Lezione del 16/07/2025",
                       "published_at":  "2025-07-16T15:08:13Z",
                       "year":  2025,
                       "month":  7,
                       "duration_seconds":  2064,
                       "duration_formatted":  "34m",
                       "thumbnail_url":  "/thumbnail-default.png",
                       "watch_url":  "https://www.youtube.com/watch?v=9t72-0R8OgE"
                   },
                   {
                       "id":  "4rR5HnwsmSw",
                       "title":  "Lezione del 15/07/2025 Sera",
                       "published_at":  "2025-07-15T18:21:07Z",
                       "year":  2025,
                       "month":  7,
                       "duration_seconds":  2899,
                       "duration_formatted":  "48m",
                       "thumbnail_url":  "/thumbnail-default.png",
                       "watch_url":  "https://www.youtube.com/watch?v=4rR5HnwsmSw"
                   },
                   {
                       "id":  "uxNqDaU_F_M",
                       "title":  "Lezione del 15/07/2025 Pomerggio",
                       "published_at":  "2025-07-15T15:09:53Z",
                       "year":  2025,
                       "month":  7,
                       "duration_seconds":  2177,
                       "duration_formatted":  "36m",
                       "thumbnail_url":  "/thumbnail-default.png",
                       "watch_url":  "https://www.youtube.com/watch?v=uxNqDaU_F_M"
                   },
                   {
                       "id":  "7P_XUDbPw2c",
                       "title":  "Lezione del 14/07/2025",
                       "published_at":  "2025-07-14T18:36:10Z",
                       "year":  2025,
                       "month":  7,
                       "duration_seconds":  3590,
                       "duration_formatted":  "59m",
                       "thumbnail_url":  "/thumbnail-default.png",
                       "watch_url":  "https://www.youtube.com/watch?v=7P_XUDbPw2c"
                   },
                   {
                       "id":  "lZVdrNo0S34",
                       "title":  "Lezione del 11/07/2025",
                       "published_at":  "2025-07-11T18:33:38Z",
                       "year":  2025,
                       "month":  7,
                       "duration_seconds":  3283,
                       "duration_formatted":  "54m",
                       "thumbnail_url":  "/thumbnail-default.png",
                       "watch_url":  "https://www.youtube.com/watch?v=lZVdrNo0S34"
                   },
                   {
                       "id":  "x4Z9CuMQ_JM",
                       "title":  "Lezione del 10/07/2025",
                       "published_at":  "2025-07-10T18:34:46Z",
                       "year":  2025,
                       "month":  7,
                       "duration_seconds":  3218,
                       "duration_formatted":  "53m",
                       "thumbnail_url":  "/thumbnail-default.png",
                       "watch_url":  "https://www.youtube.com/watch?v=x4Z9CuMQ_JM"
                   },
                   {
                       "id":  "EQ7FrcLrcvo",
                       "title":  "Lezione del 09/07/2025",
                       "published_at":  "2025-07-09T15:05:20Z",
                       "year":  2025,
                       "month":  7,
                       "duration_seconds":  2451,
                       "duration_formatted":  "40m",
                       "thumbnail_url":  "/thumbnail-default.png",
                       "watch_url":  "https://www.youtube.com/watch?v=EQ7FrcLrcvo"
                   },
                   {
                       "id":  "q5y2XnP0HeY",
                       "title":  "Lezione del 08/07/2025 Sera",
                       "published_at":  "2025-07-08T18:33:41Z",
                       "year":  2025,
                       "month":  7,
                       "duration_seconds":  3523,
                       "duration_formatted":  "58m",
                       "thumbnail_url":  "/thumbnail-default.png",
                       "watch_url":  "https://www.youtube.com/watch?v=q5y2XnP0HeY"
                   },
                   {
                       "id":  "iCuCWJWCQJU",
                       "title":  "Lezione del 08/07/2025 Pomeriggio",
                       "published_at":  "2025-07-08T15:09:45Z",
                       "year":  2025,
                       "month":  7,
                       "duration_seconds":  2333,
                       "duration_formatted":  "38m",
                       "thumbnail_url":  "/thumbnail-default.png",
                       "watch_url":  "https://www.youtube.com/watch?v=iCuCWJWCQJU"
                   },
                   {
                       "id":  "HFSCBVVKK3A",
                       "title":  "Lezione del 07/07/2025",
                       "published_at":  "2025-07-07T18:35:03Z",
                       "year":  2025,
                       "month":  7,
                       "duration_seconds":  3597,
                       "duration_formatted":  "59m",
                       "thumbnail_url":  "/thumbnail-default.png",
                       "watch_url":  "https://www.youtube.com/watch?v=HFSCBVVKK3A"
                   },
                   {
                       "id":  "7oh2st0RhCQ",
                       "title":  "Lezione del 04/07/2025",
                       "published_at":  "2025-07-04T18:34:20Z",
                       "year":  2025,
                       "month":  7,
                       "duration_seconds":  3453,
                       "duration_formatted":  "57m",
                       "thumbnail_url":  "/thumbnail-default.png",
                       "watch_url":  "https://www.youtube.com/watch?v=7oh2st0RhCQ"
                   },
                   {
                       "id":  "G0sTH3Irego",
                       "title":  "Lezione del 03/07/2025",
                       "published_at":  "2025-07-03T18:35:40Z",
                       "year":  2025,
                       "month":  7,
                       "duration_seconds":  3050,
                       "duration_formatted":  "50m",
                       "thumbnail_url":  "/thumbnail-default.png",
                       "watch_url":  "https://www.youtube.com/watch?v=G0sTH3Irego"
                   },
                   {
                       "id":  "ahg_sUMQBqM",
                       "title":  "Lezione del 02/07/2025",
                       "published_at":  "2025-07-02T15:12:44Z",
                       "year":  2025,
                       "month":  7,
                       "duration_seconds":  2559,
                       "duration_formatted":  "42m",
                       "thumbnail_url":  "/thumbnail-default.png",
                       "watch_url":  "https://www.youtube.com/watch?v=ahg_sUMQBqM"
                   },
                   {
                       "id":  "Z4YA15jbQxU",
                       "title":  "Lezione del 01/07/2025 Sera",
                       "published_at":  "2025-07-01T18:07:48Z",
                       "year":  2025,
                       "month":  7,
                       "duration_seconds":  2455,
                       "duration_formatted":  "40m",
                       "thumbnail_url":  "/thumbnail-default.png",
                       "watch_url":  "https://www.youtube.com/watch?v=Z4YA15jbQxU"
                   },
                   {
                       "id":  "9LN1_lA2Okc",
                       "title":  "Lezione del 01/07/2025 Pomeriggio",
                       "published_at":  "2025-07-01T15:04:59Z",
                       "year":  2025,
                       "month":  7,
                       "duration_seconds":  2182,
                       "duration_formatted":  "36m",
                       "thumbnail_url":  "/thumbnail-default.png",
                       "watch_url":  "https://www.youtube.com/watch?v=9LN1_lA2Okc"
                   },
                   {
                       "id":  "yAGVaJ5sEAs",
                       "title":  "Lezione del 27/06/2025",
                       "published_at":  "2025-06-27T18:33:46Z",
                       "year":  2025,
                       "month":  6,
                       "duration_seconds":  3135,
                       "duration_formatted":  "52m",
                       "thumbnail_url":  "/thumbnail-default.png",
                       "watch_url":  "https://www.youtube.com/watch?v=yAGVaJ5sEAs"
                   },
                   {
                       "id":  "LHE-ctiPO2E",
                       "title":  "Lezione del 26/06/2025",
                       "published_at":  "2025-06-26T18:33:18Z",
                       "year":  2025,
                       "month":  6,
                       "duration_seconds":  3451,
                       "duration_formatted":  "57m",
                       "thumbnail_url":  "/thumbnail-default.png",
                       "watch_url":  "https://www.youtube.com/watch?v=LHE-ctiPO2E"
                   },
                   {
                       "id":  "lWiq_9FiXIE",
                       "title":  "Lezione del 25/06/2025",
                       "published_at":  "2025-06-25T15:08:52Z",
                       "year":  2025,
                       "month":  6,
                       "duration_seconds":  2467,
                       "duration_formatted":  "41m",
                       "thumbnail_url":  "/thumbnail-default.png",
                       "watch_url":  "https://www.youtube.com/watch?v=lWiq_9FiXIE"
                   },
                   {
                       "id":  "ZxM_27rApSs",
                       "title":  "Lezione del 24/06/2025 Sera",
                       "published_at":  "2025-06-24T18:25:46Z",
                       "year":  2025,
                       "month":  6,
                       "duration_seconds":  2794,
                       "duration_formatted":  "46m",
                       "thumbnail_url":  "/thumbnail-default.png",
                       "watch_url":  "https://www.youtube.com/watch?v=ZxM_27rApSs"
                   },
                   {
                       "id":  "z7NSppdbMS0",
                       "title":  "Lezione del 24/06/2025 Pomeriggio",
                       "published_at":  "2025-06-24T15:03:19Z",
                       "year":  2025,
                       "month":  6,
                       "duration_seconds":  1976,
                       "duration_formatted":  "32m",
                       "thumbnail_url":  "/thumbnail-default.png",
                       "watch_url":  "https://www.youtube.com/watch?v=z7NSppdbMS0"
                   },
                   {
                       "id":  "1_78skEbYpM",
                       "title":  "Lezione del 23/06/2025",
                       "published_at":  "2025-06-23T18:32:53Z",
                       "year":  2025,
                       "month":  6,
                       "duration_seconds":  3487,
                       "duration_formatted":  "58m",
                       "thumbnail_url":  "/thumbnail-default.png",
                       "watch_url":  "https://www.youtube.com/watch?v=1_78skEbYpM"
                   },
                   {
                       "id":  "MWXevrFZOnI",
                       "title":  "Lezione del 20/06/2025",
                       "published_at":  "2025-06-20T18:34:34Z",
                       "year":  2025,
                       "month":  6,
                       "duration_seconds":  3326,
                       "duration_formatted":  "55m",
                       "thumbnail_url":  "/thumbnail-default.png",
                       "watch_url":  "https://www.youtube.com/watch?v=MWXevrFZOnI"
                   },
                   {
                       "id":  "g2SdTzUMKlc",
                       "title":  "Lezione del 19/06/2025",
                       "published_at":  "2025-06-19T18:31:55Z",
                       "year":  2025,
                       "month":  6,
                       "duration_seconds":  2843,
                       "duration_formatted":  "47m",
                       "thumbnail_url":  "/thumbnail-default.png",
                       "watch_url":  "https://www.youtube.com/watch?v=g2SdTzUMKlc"
                   },
                   {
                       "id":  "BYTC6_nlw5g",
                       "title":  "Lezione del 18/06/2025",
                       "published_at":  "2025-06-18T15:08:59Z",
                       "year":  2025,
                       "month":  6,
                       "duration_seconds":  2442,
                       "duration_formatted":  "40m",
                       "thumbnail_url":  "/thumbnail-default.png",
                       "watch_url":  "https://www.youtube.com/watch?v=BYTC6_nlw5g"
                   },
                   {
                       "id":  "lniO_k5XOuQ",
                       "title":  "Lezione del 17/06/2025",
                       "published_at":  "2025-06-17T15:09:27Z",
                       "year":  2025,
                       "month":  6,
                       "duration_seconds":  2123,
                       "duration_formatted":  "35m",
                       "thumbnail_url":  "/thumbnail-default.png",
                       "watch_url":  "https://www.youtube.com/watch?v=lniO_k5XOuQ"
                   },
                   {
                       "id":  "PYmsnTMz1Mc",
                       "title":  "Lezione del 16/06/2025",
                       "published_at":  "2025-06-16T18:35:54Z",
                       "year":  2025,
                       "month":  6,
                       "duration_seconds":  3204,
                       "duration_formatted":  "53m",
                       "thumbnail_url":  "/thumbnail-default.png",
                       "watch_url":  "https://www.youtube.com/watch?v=PYmsnTMz1Mc"
                   },
                   {
                       "id":  "MuEz4QrgyAw",
                       "title":  "Lezione del 13/06/2025",
                       "published_at":  "2025-06-13T18:30:27Z",
                       "year":  2025,
                       "month":  6,
                       "duration_seconds":  3689,
                       "duration_formatted":  "1h 1m",
                       "thumbnail_url":  "/thumbnail-default.png",
                       "watch_url":  "https://www.youtube.com/watch?v=MuEz4QrgyAw"
                   },
                   {
                       "id":  "56BxpEGoNQg",
                       "title":  "Lezione del 12/06/2025",
                       "published_at":  "2025-06-12T18:34:52Z",
                       "year":  2025,
                       "month":  6,
                       "duration_seconds":  2807,
                       "duration_formatted":  "46m",
                       "thumbnail_url":  "/thumbnail-default.png",
                       "watch_url":  "https://www.youtube.com/watch?v=56BxpEGoNQg"
                   },
                   {
                       "id":  "F6Z_dEqh4JM",
                       "title":  "Lezione del 11/06/2025",
                       "published_at":  "2025-06-11T15:07:26Z",
                       "year":  2025,
                       "month":  6,
                       "duration_seconds":  2155,
                       "duration_formatted":  "35m",
                       "thumbnail_url":  "/thumbnail-default.png",
                       "watch_url":  "https://www.youtube.com/watch?v=F6Z_dEqh4JM"
                   },
                   {
                       "id":  "v2e1zfEsupA",
                       "title":  "Lezione del 10/06/2025",
                       "published_at":  "2025-06-10T15:13:11Z",
                       "year":  2025,
                       "month":  6,
                       "duration_seconds":  2612,
                       "duration_formatted":  "43m",
                       "thumbnail_url":  "/thumbnail-default.png",
                       "watch_url":  "https://www.youtube.com/watch?v=v2e1zfEsupA"
                   },
                   {
                       "id":  "UJeUF84kcsc",
                       "title":  "Lezione del 09/06/2025",
                       "published_at":  "2025-06-09T18:35:27Z",
                       "year":  2025,
                       "month":  6,
                       "duration_seconds":  3264,
                       "duration_formatted":  "54m",
                       "thumbnail_url":  "/thumbnail-default.png",
                       "watch_url":  "https://www.youtube.com/watch?v=UJeUF84kcsc"
                   },
                   {
                       "id":  "zSWLUKZR-DE",
                       "title":  "L\u0027 Ingegnere Insegna - Ibrido Toyota",
                       "published_at":  "2025-06-08T18:00:06Z",
                       "year":  2025,
                       "month":  6,
                       "duration_seconds":  613,
                       "duration_formatted":  "10m",
                       "thumbnail_url":  "/thumbnail-default.png",
                       "watch_url":  "https://www.youtube.com/watch?v=zSWLUKZR-DE"
                   },
                   {
                       "id":  "zSWLUKZR-DE",
                       "title":  "L\u0027 Ingegnere Insegna - Ibrido Toyota",
                       "published_at":  "2025-06-08T18:00:06Z",
                       "year":  2025,
                       "month":  6,
                       "duration_seconds":  613,
                       "duration_formatted":  "10m",
                       "thumbnail_url":  "/thumbnail-default.png",
                       "watch_url":  "https://www.youtube.com/watch?v=zSWLUKZR-DE"
                   },
                   {
                       "id":  "EwB76VoJDes",
                       "title":  "Lezione del 06/06/2025",
                       "published_at":  "2025-06-06T18:32:20Z",
                       "year":  2025,
                       "month":  6,
                       "duration_seconds":  3272,
                       "duration_formatted":  "54m",
                       "thumbnail_url":  "/thumbnail-default.png",
                       "watch_url":  "https://www.youtube.com/watch?v=EwB76VoJDes"
                   },
                   {
                       "id":  "ujWSBWg9asg",
                       "title":  "Lezione del 05/06/2025",
                       "published_at":  "2025-06-05T18:35:29Z",
                       "year":  2025,
                       "month":  6,
                       "duration_seconds":  3336,
                       "duration_formatted":  "55m",
                       "thumbnail_url":  "/thumbnail-default.png",
                       "watch_url":  "https://www.youtube.com/watch?v=ujWSBWg9asg"
                   },
                   {
                       "id":  "bdPAF8fDmuI",
                       "title":  "Lezione del 03/06/2025",
                       "published_at":  "2025-06-04T15:12:41Z",
                       "year":  2025,
                       "month":  6,
                       "duration_seconds":  2762,
                       "duration_formatted":  "46m",
                       "thumbnail_url":  "/thumbnail-default.png",
                       "watch_url":  "https://www.youtube.com/watch?v=bdPAF8fDmuI"
                   },
                   {
                       "id":  "PFfgyKWhPCU",
                       "title":  "Lezione del 03/06/2025",
                       "published_at":  "2025-06-03T15:10:41Z",
                       "year":  2025,
                       "month":  6,
                       "duration_seconds":  2500,
                       "duration_formatted":  "41m",
                       "thumbnail_url":  "/thumbnail-default.png",
                       "watch_url":  "https://www.youtube.com/watch?v=PFfgyKWhPCU"
                   },
                   {
                       "id":  "FlF9ufQqT-s",
                       "title":  "Lezione del 30/05/2025",
                       "published_at":  "2025-05-30T18:33:20Z",
                       "year":  2025,
                       "month":  5,
                       "duration_seconds":  3352,
                       "duration_formatted":  "55m",
                       "thumbnail_url":  "/thumbnail-default.png",
                       "watch_url":  "https://www.youtube.com/watch?v=FlF9ufQqT-s"
                   },
                   {
                       "id":  "Zzm6yzuqRIo",
                       "title":  "Lezione del 29/05/2025",
                       "published_at":  "2025-05-29T18:33:43Z",
                       "year":  2025,
                       "month":  5,
                       "duration_seconds":  3221,
                       "duration_formatted":  "53m",
                       "thumbnail_url":  "/thumbnail-default.png",
                       "watch_url":  "https://www.youtube.com/watch?v=Zzm6yzuqRIo"
                   },
                   {
                       "id":  "kmNLPRtv6Fg",
                       "title":  "Lezione del 28/05/2025",
                       "published_at":  "2025-05-28T15:08:36Z",
                       "year":  2025,
                       "month":  5,
                       "duration_seconds":  2578,
                       "duration_formatted":  "42m",
                       "thumbnail_url":  "/thumbnail-default.png",
                       "watch_url":  "https://www.youtube.com/watch?v=kmNLPRtv6Fg"
                   },
                   {
                       "id":  "JJ_oaTWWtm0",
                       "title":  "Lezione del 27/05/2025 Sera",
                       "published_at":  "2025-05-27T18:32:07Z",
                       "year":  2025,
                       "month":  5,
                       "duration_seconds":  3424,
                       "duration_formatted":  "57m",
                       "thumbnail_url":  "/thumbnail-default.png",
                       "watch_url":  "https://www.youtube.com/watch?v=JJ_oaTWWtm0"
                   },
                   {
                       "id":  "nYXU3edjK7g",
                       "title":  "Lezione del 27/05/2025 Pomeriggio",
                       "published_at":  "2025-05-27T15:08:09Z",
                       "year":  2025,
                       "month":  5,
                       "duration_seconds":  2796,
                       "duration_formatted":  "46m",
                       "thumbnail_url":  "/thumbnail-default.png",
                       "watch_url":  "https://www.youtube.com/watch?v=nYXU3edjK7g"
                   },
                   {
                       "id":  "nDxJa_HQJyc",
                       "title":  "Lezione del 26/05/2025",
                       "published_at":  "2025-05-26T18:32:46Z",
                       "year":  2025,
                       "month":  5,
                       "duration_seconds":  3354,
                       "duration_formatted":  "55m",
                       "thumbnail_url":  "/thumbnail-default.png",
                       "watch_url":  "https://www.youtube.com/watch?v=nDxJa_HQJyc"
                   },
                   {
                       "id":  "RUvf5i7CCT4",
                       "title":  "Lezione del 23/05/2025",
                       "published_at":  "2025-05-23T18:31:05Z",
                       "year":  2025,
                       "month":  5,
                       "duration_seconds":  3129,
                       "duration_formatted":  "52m",
                       "thumbnail_url":  "/thumbnail-default.png",
                       "watch_url":  "https://www.youtube.com/watch?v=RUvf5i7CCT4"
                   },
                   {
                       "id":  "p6_VUDcsq2s",
                       "title":  "Lezione del 22/05/2025",
                       "published_at":  "2025-05-22T18:32:07Z",
                       "year":  2025,
                       "month":  5,
                       "duration_seconds":  3276,
                       "duration_formatted":  "54m",
                       "thumbnail_url":  "/thumbnail-default.png",
                       "watch_url":  "https://www.youtube.com/watch?v=p6_VUDcsq2s"
                   },
                   {
                       "id":  "v-f3KiZBWhU",
                       "title":  "Lezione del 21/05/2025",
                       "published_at":  "2025-05-21T15:08:57Z",
                       "year":  2025,
                       "month":  5,
                       "duration_seconds":  2288,
                       "duration_formatted":  "38m",
                       "thumbnail_url":  "/thumbnail-default.png",
                       "watch_url":  "https://www.youtube.com/watch?v=v-f3KiZBWhU"
                   },
                   {
                       "id":  "8ovXEcFoyfE",
                       "title":  "L\u0027 Ingegnere Insegna - Staccabatteria",
                       "published_at":  "2025-05-21T14:00:06Z",
                       "year":  2025,
                       "month":  5,
                       "duration_seconds":  626,
                       "duration_formatted":  "10m",
                       "thumbnail_url":  "/thumbnail-default.png",
                       "watch_url":  "https://www.youtube.com/watch?v=8ovXEcFoyfE"
                   },
                   {
                       "id":  "8ovXEcFoyfE",
                       "title":  "L\u0027 Ingegnere Insegna - Staccabatteria",
                       "published_at":  "2025-05-21T14:00:06Z",
                       "year":  2025,
                       "month":  5,
                       "duration_seconds":  626,
                       "duration_formatted":  "10m",
                       "thumbnail_url":  "/thumbnail-default.png",
                       "watch_url":  "https://www.youtube.com/watch?v=8ovXEcFoyfE"
                   },
                   {
                       "id":  "mNnPjhLx23E",
                       "title":  "Lezione del 19/05/2025",
                       "published_at":  "2025-05-19T18:34:31Z",
                       "year":  2025,
                       "month":  5,
                       "duration_seconds":  3279,
                       "duration_formatted":  "54m",
                       "thumbnail_url":  "/thumbnail-default.png",
                       "watch_url":  "https://www.youtube.com/watch?v=mNnPjhLx23E"
                   },
                   {
                       "id":  "Y2lw5fyaeUg",
                       "title":  "Lezione del 16/05/2025",
                       "published_at":  "2025-05-16T18:30:12Z",
                       "year":  2025,
                       "month":  5,
                       "duration_seconds":  3168,
                       "duration_formatted":  "52m",
                       "thumbnail_url":  "/thumbnail-default.png",
                       "watch_url":  "https://www.youtube.com/watch?v=Y2lw5fyaeUg"
                   },
                   {
                       "id":  "858SqdREuGQ",
                       "title":  "Lezione del 15/05/2025",
                       "published_at":  "2025-05-15T18:34:29Z",
                       "year":  2025,
                       "month":  5,
                       "duration_seconds":  2592,
                       "duration_formatted":  "43m",
                       "thumbnail_url":  "/thumbnail-default.png",
                       "watch_url":  "https://www.youtube.com/watch?v=858SqdREuGQ"
                   },
                   {
                       "id":  "WVUw4MnKSUA",
                       "title":  "Lezione del 14/05/2025",
                       "published_at":  "2025-05-14T15:05:28Z",
                       "year":  2025,
                       "month":  5,
